tcpdump: verbose output suppressed, use -v or -vv for full protocol decode
listening on s4203-eth3, link-type EN10MB (Ethernet), capture size 262144 bytes
23:42:34.460207 IP6 mininet > ip6-allrouters: ICMP6, router solicitation, length 16
23:42:57.764573 ARP, Request who-has 10.0.0.5 tell rfctest.harvard.edu, length 28
23:42:57.765057 ARP, Reply 10.0.0.5 is-at 86:21:71:bd:c0:f8 (oui Unknown), length 28
23:42:57.765537 IP rfctest.harvard.edu > 10.0.0.5: ICMP echo request, id 21255, seq 1, length 64
23:42:57.766032 IP 10.0.0.5 > rfctest.harvard.edu: ICMP echo reply, id 21255, seq 1, length 64
23:42:57.771241 ARP, Request who-has 10.0.0.6 tell rfctest.harvard.edu, length 28
23:42:57.771645 ARP, Reply 10.0.0.6 is-at 86:74:ea:fc:7a:62 (oui Unknown), length 28
23:42:57.771904 IP rfctest.harvard.edu > 10.0.0.6: ICMP echo request, id 21256, seq 1, length 64
23:42:57.772230 IP 10.0.0.6 > rfctest.harvard.edu: ICMP echo reply, id 21256, seq 1, length 64
23:42:57.776677 ARP, Request who-has hrewhlpt2100046.university.harvard.edu tell rfctest.harvard.edu, length 28
23:42:57.777129 ARP, Reply hrewhlpt2100046.university.harvard.edu is-at de:fc:3a:de:5a:eb (oui Unknown), length 28
23:42:57.777375 IP rfctest.harvard.edu > hrewhlpt2100046.university.harvard.edu: ICMP echo request, id 21257, seq 1, length 64
23:42:57.777843 IP hrewhlpt2100046.university.harvard.edu > rfctest.harvard.edu: ICMP echo reply, id 21257, seq 1, length 64
23:42:57.782184 ARP, Request who-has 10.0.0.8 tell rfctest.harvard.edu, length 28
23:42:57.782575 ARP, Reply 10.0.0.8 is-at 22:a1:4f:d4:cd:7d (oui Unknown), length 28
23:42:57.783009 IP rfctest.harvard.edu > 10.0.0.8: ICMP echo request, id 21258, seq 1, length 64
23:42:57.783387 IP 10.0.0.8 > rfctest.harvard.edu: ICMP echo reply, id 21258, seq 1, length 64
23:42:57.860737 ARP, Request who-has 10.0.0.5 tell paine-b-sw2.net.harvard.edu, length 28
23:42:57.861041 ARP, Reply 10.0.0.5 is-at 86:21:71:bd:c0:f8 (oui Unknown), length 28
23:42:57.861315 IP paine-b-sw2.net.harvard.edu > 10.0.0.5: ICMP echo request, id 21270, seq 1, length 64
23:42:57.861358 IP 10.0.0.5 > paine-b-sw2.net.harvard.edu: ICMP echo reply, id 21270, seq 1, length 64
23:42:57.866233 ARP, Request who-has 10.0.0.6 tell paine-b-sw2.net.harvard.edu, length 28
23:42:57.866436 ARP, Reply 10.0.0.6 is-at 86:74:ea:fc:7a:62 (oui Unknown), length 28
23:42:57.866495 IP paine-b-sw2.net.harvard.edu > 10.0.0.6: ICMP echo request, id 21271, seq 1, length 64
23:42:57.866532 IP 10.0.0.6 > paine-b-sw2.net.harvard.edu: ICMP echo reply, id 21271, seq 1, length 64
23:42:57.871454 ARP, Request who-has hrewhlpt2100046.university.harvard.edu tell paine-b-sw2.net.harvard.edu, length 28
23:42:57.871751 ARP, Reply hrewhlpt2100046.university.harvard.edu is-at de:fc:3a:de:5a:eb (oui Unknown), length 28
23:42:57.871814 IP paine-b-sw2.net.harvard.edu > hrewhlpt2100046.university.harvard.edu: ICMP echo request, id 21272, seq 1, length 64
23:42:57.871856 IP hrewhlpt2100046.university.harvard.edu > paine-b-sw2.net.harvard.edu: ICMP echo reply, id 21272, seq 1, length 64
23:42:57.876629 ARP, Request who-has 10.0.0.8 tell paine-b-sw2.net.harvard.edu, length 28
23:42:57.876815 ARP, Reply 10.0.0.8 is-at 22:a1:4f:d4:cd:7d (oui Unknown), length 28
23:42:57.877048 IP paine-b-sw2.net.harvard.edu > 10.0.0.8: ICMP echo request, id 21273, seq 1, length 64
23:42:57.877098 IP 10.0.0.8 > paine-b-sw2.net.harvard.edu: ICMP echo reply, id 21273, seq 1, length 64
23:42:57.940815 ARP, Request who-has 10.0.0.5 tell hamwhwks0643000.university.harvard.edu, length 28
23:42:57.941120 ARP, Reply 10.0.0.5 is-at 86:21:71:bd:c0:f8 (oui Unknown), length 28
23:42:57.941632 IP hamwhwks0643000.university.harvard.edu > 10.0.0.5: ICMP echo request, id 21285, seq 1, length 64
23:42:57.941673 IP 10.0.0.5 > hamwhwks0643000.university.harvard.edu: ICMP echo reply, id 21285, seq 1, length 64
23:42:57.946237 ARP, Request who-has 10.0.0.6 tell hamwhwks0643000.university.harvard.edu, length 28
23:42:57.946420 ARP, Reply 10.0.0.6 is-at 86:74:ea:fc:7a:62 (oui Unknown), length 28
23:42:57.946940 IP hamwhwks0643000.university.harvard.edu > 10.0.0.6: ICMP echo request, id 21286, seq 1, length 64
23:42:57.946985 IP 10.0.0.6 > hamwhwks0643000.university.harvard.edu: ICMP echo reply, id 21286, seq 1, length 64
23:42:57.951259 ARP, Request who-has hrewhlpt2100046.university.harvard.edu tell hamwhwks0643000.university.harvard.edu, length 28
23:42:57.951570 ARP, Reply hrewhlpt2100046.university.harvard.edu is-at de:fc:3a:de:5a:eb (oui Unknown), length 28
23:42:57.951635 IP hamwhwks0643000.university.harvard.edu > hrewhlpt2100046.university.harvard.edu: ICMP echo request, id 21287, seq 1, length 64
23:42:57.951675 IP hrewhlpt2100046.university.harvard.edu > hamwhwks0643000.university.harvard.edu: ICMP echo reply, id 21287, seq 1, length 64
23:42:57.956576 ARP, Request who-has 10.0.0.8 tell hamwhwks0643000.university.harvard.edu, length 28
23:42:57.956751 ARP, Reply 10.0.0.8 is-at 22:a1:4f:d4:cd:7d (oui Unknown), length 28
23:42:57.957140 IP hamwhwks0643000.university.harvard.edu > 10.0.0.8: ICMP echo request, id 21288, seq 1, length 64
23:42:57.957189 IP 10.0.0.8 > hamwhwks0643000.university.harvard.edu: ICMP echo reply, id 21288, seq 1, length 64
23:42:58.021864 ARP, Request who-has 10.0.0.5 tell divwhlpt1048016.university.harvard.edu, length 28
23:42:58.022162 ARP, Reply 10.0.0.5 is-at 86:21:71:bd:c0:f8 (oui Unknown), length 28
23:42:58.022695 IP divwhlpt1048016.university.harvard.edu > 10.0.0.5: ICMP echo request, id 21300, seq 1, length 64
23:42:58.023297 IP 10.0.0.5 > divwhlpt1048016.university.harvard.edu: ICMP echo reply, id 21300, seq 1, length 64
23:42:58.028220 ARP, Request who-has 10.0.0.6 tell divwhlpt1048016.university.harvard.edu, length 28
23:42:58.028465 ARP, Reply 10.0.0.6 is-at 86:74:ea:fc:7a:62 (oui Unknown), length 28
23:42:58.028624 IP divwhlpt1048016.university.harvard.edu > 10.0.0.6: ICMP echo request, id 21301, seq 1, length 64
23:42:58.028857 IP 10.0.0.6 > divwhlpt1048016.university.harvard.edu: ICMP echo reply, id 21301, seq 1, length 64
23:42:58.033421 ARP, Request who-has hrewhlpt2100046.university.harvard.edu tell divwhlpt1048016.university.harvard.edu, length 28
23:42:58.033667 ARP, Reply hrewhlpt2100046.university.harvard.edu is-at de:fc:3a:de:5a:eb (oui Unknown), length 28
23:42:58.033710 IP divwhlpt1048016.university.harvard.edu > hrewhlpt2100046.university.harvard.edu: ICMP echo request, id 21302, seq 1, length 64
23:42:58.033909 IP hrewhlpt2100046.university.harvard.edu > divwhlpt1048016.university.harvard.edu: ICMP echo reply, id 21302, seq 1, length 64
23:42:58.041106 ARP, Request who-has 10.0.0.8 tell divwhlpt1048016.university.harvard.edu, length 28
23:42:58.041302 ARP, Reply 10.0.0.8 is-at 22:a1:4f:d4:cd:7d (oui Unknown), length 28
23:42:58.041466 IP divwhlpt1048016.university.harvard.edu > 10.0.0.8: ICMP echo request, id 21303, seq 1, length 64
23:42:58.041770 IP 10.0.0.8 > divwhlpt1048016.university.harvard.edu: ICMP echo reply, id 21303, seq 1, length 64
23:42:58.098269 IP 10.0.0.5 > rfctest.harvard.edu: ICMP echo request, id 21312, seq 1, length 64
23:42:58.098328 IP rfctest.harvard.edu > 10.0.0.5: ICMP echo reply, id 21312, seq 1, length 64
23:42:58.103616 IP 10.0.0.5 > paine-b-sw2.net.harvard.edu: ICMP echo request, id 21313, seq 1, length 64
23:42:58.103671 IP paine-b-sw2.net.harvard.edu > 10.0.0.5: ICMP echo reply, id 21313, seq 1, length 64
23:42:58.109509 IP 10.0.0.5 > hamwhwks0643000.university.harvard.edu: ICMP echo request, id 21314, seq 1, length 64
23:42:58.109565 IP hamwhwks0643000.university.harvard.edu > 10.0.0.5: ICMP echo reply, id 21314, seq 1, length 64
23:42:58.114139 IP 10.0.0.5 > divwhlpt1048016.university.harvard.edu: ICMP echo request, id 21315, seq 1, length 64
23:42:58.114192 IP divwhlpt1048016.university.harvard.edu > 10.0.0.5: ICMP echo reply, id 21315, seq 1, length 64
23:42:58.142214 ARP, Request who-has 10.0.0.9 tell 10.0.0.5, length 28
23:42:58.142759 ARP, Reply 10.0.0.9 is-at 8a:c8:67:01:92:b9 (oui Unknown), length 28
23:42:58.142907 IP 10.0.0.5 > 10.0.0.9: ICMP echo request, id 21319, seq 1, length 64
23:42:58.143160 IP 10.0.0.9 > 10.0.0.5: ICMP echo reply, id 21319, seq 1, length 64
23:42:58.147544 ARP, Request who-has 10.0.0.10 tell 10.0.0.5, length 28
23:42:58.147824 ARP, Reply 10.0.0.10 is-at 9a:60:b4:e8:36:04 (oui Unknown), length 28
23:42:58.147990 IP 10.0.0.5 > 10.0.0.10: ICMP echo request, id 21320, seq 1, length 64
23:42:58.148140 IP 10.0.0.10 > 10.0.0.5: ICMP echo reply, id 21320, seq 1, length 64
23:42:58.152602 ARP, Request who-has divmhlpt104804e.university.harvard.edu tell 10.0.0.5, length 28
23:42:58.152971 ARP, Reply divmhlpt104804e.university.harvard.edu is-at a2:de:e5:ff:01:9b (oui Unknown), length 28
23:42:58.153017 IP 10.0.0.5 > divmhlpt104804e.university.harvard.edu: ICMP echo request, id 21321, seq 1, length 64
23:42:58.153162 IP divmhlpt104804e.university.harvard.edu > 10.0.0.5: ICMP echo reply, id 21321, seq 1, length 64
23:42:58.157998 ARP, Request who-has iniwhwks3292009.university.harvard.edu tell 10.0.0.5, length 28
23:42:58.158298 ARP, Reply iniwhwks3292009.university.harvard.edu is-at 7a:3d:c3:54:48:4a (oui Unknown), length 28
23:42:58.158438 IP 10.0.0.5 > iniwhwks3292009.university.harvard.edu: ICMP echo request, id 21322, seq 1, length 64
23:42:58.158605 IP iniwhwks3292009.university.harvard.edu > 10.0.0.5: ICMP echo reply, id 21322, seq 1, length 64
23:42:58.164096 ARP, Request who-has 10.0.0.13 tell 10.0.0.5, length 28
23:42:58.164621 ARP, Reply 10.0.0.13 is-at 1e:a2:7f:3b:17:a8 (oui Unknown), length 28
23:42:58.164671 IP 10.0.0.5 > 10.0.0.13: ICMP echo request, id 21323, seq 1, length 64
23:42:58.164930 IP 10.0.0.13 > 10.0.0.5: ICMP echo reply, id 21323, seq 1, length 64
23:42:58.169514 ARP, Request who-has 10.0.0.14 tell 10.0.0.5, length 28
23:42:58.170003 ARP, Reply 10.0.0.14 is-at 26:23:22:1a:bd:ad (oui Unknown), length 28
23:42:58.170051 IP 10.0.0.5 > 10.0.0.14: ICMP echo request, id 21324, seq 1, length 64
23:42:58.170236 IP 10.0.0.14 > 10.0.0.5: ICMP echo reply, id 21324, seq 1, length 64
23:42:58.186151 ARP, Request who-has 10.0.0.15 tell 10.0.0.5, length 28
23:42:58.186806 ARP, Reply 10.0.0.15 is-at a6:f6:7f:9b:22:04 (oui Unknown), length 28
23:42:58.186859 IP 10.0.0.5 > 10.0.0.15: ICMP echo request, id 21325, seq 1, length 64
23:42:58.187034 IP 10.0.0.15 > 10.0.0.5: ICMP echo reply, id 21325, seq 1, length 64
23:42:58.191658 ARP, Request who-has 10.0.0.16 tell 10.0.0.5, length 28
23:42:58.191925 ARP, Reply 10.0.0.16 is-at b6:e3:93:ad:04:21 (oui Unknown), length 28
23:42:58.192160 IP 10.0.0.5 > 10.0.0.16: ICMP echo request, id 21326, seq 1, length 64
23:42:58.192298 IP 10.0.0.16 > 10.0.0.5: ICMP echo reply, id 21326, seq 1, length 64
23:42:58.201744 IP 10.0.0.6 > rfctest.harvard.edu: ICMP echo request, id 21327, seq 1, length 64
23:42:58.201807 IP rfctest.harvard.edu > 10.0.0.6: ICMP echo reply, id 21327, seq 1, length 64
23:42:58.205895 IP 10.0.0.6 > paine-b-sw2.net.harvard.edu: ICMP echo request, id 21328, seq 1, length 64
23:42:58.205956 IP paine-b-sw2.net.harvard.edu > 10.0.0.6: ICMP echo reply, id 21328, seq 1, length 64
23:42:58.211557 IP 10.0.0.6 > hamwhwks0643000.university.harvard.edu: ICMP echo request, id 21329, seq 1, length 64
23:42:58.211617 IP hamwhwks0643000.university.harvard.edu > 10.0.0.6: ICMP echo reply, id 21329, seq 1, length 64
23:42:58.215565 IP 10.0.0.6 > divwhlpt1048016.university.harvard.edu: ICMP echo request, id 21330, seq 1, length 64
23:42:58.215615 IP divwhlpt1048016.university.harvard.edu > 10.0.0.6: ICMP echo reply, id 21330, seq 1, length 64
23:42:58.233960 ARP, Request who-has 10.0.0.9 tell 10.0.0.6, length 28
23:42:58.234380 ARP, Reply 10.0.0.9 is-at 8a:c8:67:01:92:b9 (oui Unknown), length 28
23:42:58.234427 IP 10.0.0.6 > 10.0.0.9: ICMP echo request, id 21334, seq 1, length 64
23:42:58.234580 IP 10.0.0.9 > 10.0.0.6: ICMP echo reply, id 21334, seq 1, length 64
23:42:58.239067 ARP, Request who-has 10.0.0.10 tell 10.0.0.6, length 28
23:42:58.239321 ARP, Reply 10.0.0.10 is-at 9a:60:b4:e8:36:04 (oui Unknown), length 28
23:42:58.239372 IP 10.0.0.6 > 10.0.0.10: ICMP echo request, id 21335, seq 1, length 64
23:42:58.239423 IP 10.0.0.10 > 10.0.0.6: ICMP echo reply, id 21335, seq 1, length 64
23:42:58.243805 ARP, Request who-has divmhlpt104804e.university.harvard.edu tell 10.0.0.6, length 28
23:42:58.244082 ARP, Reply divmhlpt104804e.university.harvard.edu is-at a2:de:e5:ff:01:9b (oui Unknown), length 28
23:42:58.244154 IP 10.0.0.6 > divmhlpt104804e.university.harvard.edu: ICMP echo request, id 21336, seq 1, length 64
23:42:58.244199 IP divmhlpt104804e.university.harvard.edu > 10.0.0.6: ICMP echo reply, id 21336, seq 1, length 64
23:42:58.247895 ARP, Request who-has iniwhwks3292009.university.harvard.edu tell 10.0.0.6, length 28
23:42:58.248111 ARP, Reply iniwhwks3292009.university.harvard.edu is-at 7a:3d:c3:54:48:4a (oui Unknown), length 28
23:42:58.248158 IP 10.0.0.6 > iniwhwks3292009.university.harvard.edu: ICMP echo request, id 21337, seq 1, length 64
23:42:58.248207 IP iniwhwks3292009.university.harvard.edu > 10.0.0.6: ICMP echo reply, id 21337, seq 1, length 64
23:42:58.252472 ARP, Request who-has 10.0.0.13 tell 10.0.0.6, length 28
23:42:58.252890 ARP, Reply 10.0.0.13 is-at 1e:a2:7f:3b:17:a8 (oui Unknown), length 28
23:42:58.252973 IP 10.0.0.6 > 10.0.0.13: ICMP echo request, id 21338, seq 1, length 64
23:42:58.253137 IP 10.0.0.13 > 10.0.0.6: ICMP echo reply, id 21338, seq 1, length 64
23:42:58.257640 ARP, Request who-has 10.0.0.14 tell 10.0.0.6, length 28
23:42:58.257907 ARP, Reply 10.0.0.14 is-at 26:23:22:1a:bd:ad (oui Unknown), length 28
23:42:58.257962 IP 10.0.0.6 > 10.0.0.14: ICMP echo request, id 21339, seq 1, length 64
23:42:58.258015 IP 10.0.0.14 > 10.0.0.6: ICMP echo reply, id 21339, seq 1, length 64
23:42:58.261952 ARP, Request who-has 10.0.0.15 tell 10.0.0.6, length 28
23:42:58.262288 ARP, Reply 10.0.0.15 is-at a6:f6:7f:9b:22:04 (oui Unknown), length 28
23:42:58.262335 IP 10.0.0.6 > 10.0.0.15: ICMP echo request, id 21340, seq 1, length 64
23:42:58.262383 IP 10.0.0.15 > 10.0.0.6: ICMP echo reply, id 21340, seq 1, length 64
23:42:58.266854 ARP, Request who-has 10.0.0.16 tell 10.0.0.6, length 28
23:42:58.267044 ARP, Reply 10.0.0.16 is-at b6:e3:93:ad:04:21 (oui Unknown), length 28
23:42:58.267210 IP 10.0.0.6 > 10.0.0.16: ICMP echo request, id 21341, seq 1, length 64
23:42:58.267256 IP 10.0.0.16 > 10.0.0.6: ICMP echo reply, id 21341, seq 1, length 64
23:42:58.276001 IP hrewhlpt2100046.university.harvard.edu > rfctest.harvard.edu: ICMP echo request, id 21342, seq 1, length 64
23:42:58.276069 IP rfctest.harvard.edu > hrewhlpt2100046.university.harvard.edu: ICMP echo reply, id 21342, seq 1, length 64
23:42:58.280680 IP hrewhlpt2100046.university.harvard.edu > paine-b-sw2.net.harvard.edu: ICMP echo request, id 21343, seq 1, length 64
23:42:58.280740 IP paine-b-sw2.net.harvard.edu > hrewhlpt2100046.university.harvard.edu: ICMP echo reply, id 21343, seq 1, length 64
23:42:58.284293 IP hrewhlpt2100046.university.harvard.edu > hamwhwks0643000.university.harvard.edu: ICMP echo request, id 21344, seq 1, length 64
23:42:58.284349 IP hamwhwks0643000.university.harvard.edu > hrewhlpt2100046.university.harvard.edu: ICMP echo reply, id 21344, seq 1, length 64
23:42:58.288759 IP hrewhlpt2100046.university.harvard.edu > divwhlpt1048016.university.harvard.edu: ICMP echo request, id 21345, seq 1, length 64
23:42:58.288821 IP divwhlpt1048016.university.harvard.edu > hrewhlpt2100046.university.harvard.edu: ICMP echo reply, id 21345, seq 1, length 64
23:42:58.318119 ARP, Request who-has 10.0.0.9 tell hrewhlpt2100046.university.harvard.edu, length 28
23:42:58.318699 ARP, Reply 10.0.0.9 is-at 8a:c8:67:01:92:b9 (oui Unknown), length 28
23:42:58.318987 IP hrewhlpt2100046.university.harvard.edu > 10.0.0.9: ICMP echo request, id 21349, seq 1, length 64
23:42:58.319152 IP 10.0.0.9 > hrewhlpt2100046.university.harvard.edu: ICMP echo reply, id 21349, seq 1, length 64
23:42:58.328176 ARP, Request who-has 10.0.0.10 tell hrewhlpt2100046.university.harvard.edu, length 28
23:42:58.328373 ARP, Reply 10.0.0.10 is-at 9a:60:b4:e8:36:04 (oui Unknown), length 28
23:42:58.328674 IP hrewhlpt2100046.university.harvard.edu > 10.0.0.10: ICMP echo request, id 21350, seq 1, length 64
23:42:58.328736 IP 10.0.0.10 > hrewhlpt2100046.university.harvard.edu: ICMP echo reply, id 21350, seq 1, length 64
23:42:58.333654 ARP, Request who-has divmhlpt104804e.university.harvard.edu tell hrewhlpt2100046.university.harvard.edu, length 28
23:42:58.334013 ARP, Reply divmhlpt104804e.university.harvard.edu is-at a2:de:e5:ff:01:9b (oui Unknown), length 28
23:42:58.334065 IP hrewhlpt2100046.university.harvard.edu > divmhlpt104804e.university.harvard.edu: ICMP echo request, id 21351, seq 1, length 64
23:42:58.334121 IP divmhlpt104804e.university.harvard.edu > hrewhlpt2100046.university.harvard.edu: ICMP echo reply, id 21351, seq 1, length 64
23:42:58.339572 ARP, Request who-has iniwhwks3292009.university.harvard.edu tell hrewhlpt2100046.university.harvard.edu, length 28
23:42:58.339776 ARP, Reply iniwhwks3292009.university.harvard.edu is-at 7a:3d:c3:54:48:4a (oui Unknown), length 28
23:42:58.340097 IP hrewhlpt2100046.university.harvard.edu > iniwhwks3292009.university.harvard.edu: ICMP echo request, id 21352, seq 1, length 64
23:42:58.340161 IP iniwhwks3292009.university.harvard.edu > hrewhlpt2100046.university.harvard.edu: ICMP echo reply, id 21352, seq 1, length 64
23:42:58.344498 ARP, Request who-has 10.0.0.13 tell hrewhlpt2100046.university.harvard.edu, length 28
23:42:58.344923 ARP, Reply 10.0.0.13 is-at 1e:a2:7f:3b:17:a8 (oui Unknown), length 28
23:42:58.344973 IP hrewhlpt2100046.university.harvard.edu > 10.0.0.13: ICMP echo request, id 21353, seq 1, length 64
23:42:58.345124 IP 10.0.0.13 > hrewhlpt2100046.university.harvard.edu: ICMP echo reply, id 21353, seq 1, length 64
23:42:58.349000 ARP, Request who-has 10.0.0.14 tell hrewhlpt2100046.university.harvard.edu, length 28
23:42:58.349217 ARP, Reply 10.0.0.14 is-at 26:23:22:1a:bd:ad (oui Unknown), length 28
23:42:58.349261 IP hrewhlpt2100046.university.harvard.edu > 10.0.0.14: ICMP echo request, id 21354, seq 1, length 64
23:42:58.349303 IP 10.0.0.14 > hrewhlpt2100046.university.harvard.edu: ICMP echo reply, id 21354, seq 1, length 64
23:42:58.353523 ARP, Request who-has 10.0.0.15 tell hrewhlpt2100046.university.harvard.edu, length 28
23:42:58.353845 ARP, Reply 10.0.0.15 is-at a6:f6:7f:9b:22:04 (oui Unknown), length 28
23:42:58.353886 IP hrewhlpt2100046.university.harvard.edu > 10.0.0.15: ICMP echo request, id 21355, seq 1, length 64
23:42:58.353941 IP 10.0.0.15 > hrewhlpt2100046.university.harvard.edu: ICMP echo reply, id 21355, seq 1, length 64
23:42:58.358855 ARP, Request who-has 10.0.0.16 tell hrewhlpt2100046.university.harvard.edu, length 28
23:42:58.359038 ARP, Reply 10.0.0.16 is-at b6:e3:93:ad:04:21 (oui Unknown), length 28
23:42:58.359289 IP hrewhlpt2100046.university.harvard.edu > 10.0.0.16: ICMP echo request, id 21356, seq 1, length 64
23:42:58.359369 IP 10.0.0.16 > hrewhlpt2100046.university.harvard.edu: ICMP echo reply, id 21356, seq 1, length 64
23:42:58.367876 IP 10.0.0.8 > rfctest.harvard.edu: ICMP echo request, id 21357, seq 1, length 64
23:42:58.367933 IP rfctest.harvard.edu > 10.0.0.8: ICMP echo reply, id 21357, seq 1, length 64
23:42:58.371868 IP 10.0.0.8 > paine-b-sw2.net.harvard.edu: ICMP echo request, id 21358, seq 1, length 64
23:42:58.371925 IP paine-b-sw2.net.harvard.edu > 10.0.0.8: ICMP echo reply, id 21358, seq 1, length 64
23:42:58.375963 IP 10.0.0.8 > hamwhwks0643000.university.harvard.edu: ICMP echo request, id 21359, seq 1, length 64
23:42:58.376023 IP hamwhwks0643000.university.harvard.edu > 10.0.0.8: ICMP echo reply, id 21359, seq 1, length 64
23:42:58.380205 IP 10.0.0.8 > divwhlpt1048016.university.harvard.edu: ICMP echo request, id 21360, seq 1, length 64
23:42:58.380262 IP divwhlpt1048016.university.harvard.edu > 10.0.0.8: ICMP echo reply, id 21360, seq 1, length 64
23:42:58.397119 ARP, Request who-has 10.0.0.9 tell 10.0.0.8, length 28
23:42:58.397563 ARP, Reply 10.0.0.9 is-at 8a:c8:67:01:92:b9 (oui Unknown), length 28
23:42:58.397705 IP 10.0.0.8 > 10.0.0.9: ICMP echo request, id 21364, seq 1, length 64
23:42:58.398050 IP 10.0.0.9 > 10.0.0.8: ICMP echo reply, id 21364, seq 1, length 64
23:42:58.403123 ARP, Request who-has 10.0.0.10 tell 10.0.0.8, length 28
23:42:58.403413 ARP, Reply 10.0.0.10 is-at 9a:60:b4:e8:36:04 (oui Unknown), length 28
23:42:58.403639 IP 10.0.0.8 > 10.0.0.10: ICMP echo request, id 21365, seq 1, length 64
23:42:58.403851 IP 10.0.0.10 > 10.0.0.8: ICMP echo reply, id 21365, seq 1, length 64
23:42:58.408245 ARP, Request who-has divmhlpt104804e.university.harvard.edu tell 10.0.0.8, length 28
23:42:58.408610 ARP, Reply divmhlpt104804e.university.harvard.edu is-at a2:de:e5:ff:01:9b (oui Unknown), length 28
23:42:58.408664 IP 10.0.0.8 > divmhlpt104804e.university.harvard.edu: ICMP echo request, id 21366, seq 1, length 64
23:42:58.408987 IP divmhlpt104804e.university.harvard.edu > 10.0.0.8: ICMP echo reply, id 21366, seq 1, length 64
23:42:58.413249 ARP, Request who-has iniwhwks3292009.university.harvard.edu tell 10.0.0.8, length 28
23:42:58.413547 ARP, Reply iniwhwks3292009.university.harvard.edu is-at 7a:3d:c3:54:48:4a (oui Unknown), length 28
23:42:58.413702 IP 10.0.0.8 > iniwhwks3292009.university.harvard.edu: ICMP echo request, id 21367, seq 1, length 64
23:42:58.413889 IP iniwhwks3292009.university.harvard.edu > 10.0.0.8: ICMP echo reply, id 21367, seq 1, length 64
23:42:58.418400 ARP, Request who-has 10.0.0.13 tell 10.0.0.8, length 28
23:42:58.419049 ARP, Reply 10.0.0.13 is-at 1e:a2:7f:3b:17:a8 (oui Unknown), length 28
23:42:58.419100 IP 10.0.0.8 > 10.0.0.13: ICMP echo request, id 21368, seq 1, length 64
23:42:58.419477 IP 10.0.0.13 > 10.0.0.8: ICMP echo reply, id 21368, seq 1, length 64
23:42:58.424344 ARP, Request who-has 10.0.0.14 tell 10.0.0.8, length 28
23:42:58.424548 ARP, Reply 10.0.0.14 is-at 26:23:22:1a:bd:ad (oui Unknown), length 28
23:42:58.424592 IP 10.0.0.8 > 10.0.0.14: ICMP echo request, id 21369, seq 1, length 64
23:42:58.424808 IP 10.0.0.14 > 10.0.0.8: ICMP echo reply, id 21369, seq 1, length 64
23:42:58.429261 ARP, Request who-has 10.0.0.15 tell 10.0.0.8, length 28
23:42:58.429578 ARP, Reply 10.0.0.15 is-at a6:f6:7f:9b:22:04 (oui Unknown), length 28
23:42:58.429655 IP 10.0.0.8 > 10.0.0.15: ICMP echo request, id 21370, seq 1, length 64
23:42:58.429947 IP 10.0.0.15 > 10.0.0.8: ICMP echo reply, id 21370, seq 1, length 64
23:42:58.434281 ARP, Request who-has 10.0.0.16 tell 10.0.0.8, length 28
23:42:58.434490 ARP, Reply 10.0.0.16 is-at b6:e3:93:ad:04:21 (oui Unknown), length 28
23:42:58.434790 IP 10.0.0.8 > 10.0.0.16: ICMP echo request, id 21371, seq 1, length 64
23:42:58.434999 IP 10.0.0.16 > 10.0.0.8: ICMP echo reply, id 21371, seq 1, length 64
23:42:58.460727 IP 10.0.0.9 > 10.0.0.5: ICMP echo request, id 21376, seq 1, length 64
23:42:58.460773 IP 10.0.0.5 > 10.0.0.9: ICMP echo reply, id 21376, seq 1, length 64
23:42:58.465105 IP 10.0.0.9 > 10.0.0.6: ICMP echo request, id 21377, seq 1, length 64
23:42:58.465148 IP 10.0.0.6 > 10.0.0.9: ICMP echo reply, id 21377, seq 1, length 64
23:42:58.468906 IP 10.0.0.9 > hrewhlpt2100046.university.harvard.edu: ICMP echo request, id 21378, seq 1, length 64
23:42:58.468951 IP hrewhlpt2100046.university.harvard.edu > 10.0.0.9: ICMP echo reply, id 21378, seq 1, length 64
23:42:58.473333 IP 10.0.0.9 > 10.0.0.8: ICMP echo request, id 21379, seq 1, length 64
23:42:58.473382 IP 10.0.0.8 > 10.0.0.9: ICMP echo reply, id 21379, seq 1, length 64
23:42:58.535299 IP 10.0.0.10 > 10.0.0.5: ICMP echo request, id 21391, seq 1, length 64
23:42:58.535339 IP 10.0.0.5 > 10.0.0.10: ICMP echo reply, id 21391, seq 1, length 64
23:42:58.539700 IP 10.0.0.10 > 10.0.0.6: ICMP echo request, id 21392, seq 1, length 64
23:42:58.539763 IP 10.0.0.6 > 10.0.0.10: ICMP echo reply, id 21392, seq 1, length 64
23:42:58.543544 IP 10.0.0.10 > hrewhlpt2100046.university.harvard.edu: ICMP echo request, id 21393, seq 1, length 64
23:42:58.543587 IP hrewhlpt2100046.university.harvard.edu > 10.0.0.10: ICMP echo reply, id 21393, seq 1, length 64
23:42:58.547603 IP 10.0.0.10 > 10.0.0.8: ICMP echo request, id 21394, seq 1, length 64
23:42:58.547642 IP 10.0.0.8 > 10.0.0.10: ICMP echo reply, id 21394, seq 1, length 64
23:42:58.605751 IP divmhlpt104804e.university.harvard.edu > 10.0.0.5: ICMP echo request, id 21406, seq 1, length 64
23:42:58.605796 IP 10.0.0.5 > divmhlpt104804e.university.harvard.edu: ICMP echo reply, id 21406, seq 1, length 64
23:42:58.609469 IP divmhlpt104804e.university.harvard.edu > 10.0.0.6: ICMP echo request, id 21407, seq 1, length 64
23:42:58.609516 IP 10.0.0.6 > divmhlpt104804e.university.harvard.edu: ICMP echo reply, id 21407, seq 1, length 64
23:42:58.613593 IP divmhlpt104804e.university.harvard.edu > hrewhlpt2100046.university.harvard.edu: ICMP echo request, id 21408, seq 1, length 64
23:42:58.613636 IP hrewhlpt2100046.university.harvard.edu > divmhlpt104804e.university.harvard.edu: ICMP echo reply, id 21408, seq 1, length 64
23:42:58.617913 IP divmhlpt104804e.university.harvard.edu > 10.0.0.8: ICMP echo request, id 21409, seq 1, length 64
23:42:58.617956 IP 10.0.0.8 > divmhlpt104804e.university.harvard.edu: ICMP echo reply, id 21409, seq 1, length 64
23:42:58.676899 IP iniwhwks3292009.university.harvard.edu > 10.0.0.5: ICMP echo request, id 21421, seq 1, length 64
23:42:58.676942 IP 10.0.0.5 > iniwhwks3292009.university.harvard.edu: ICMP echo reply, id 21421, seq 1, length 64
23:42:58.680638 IP iniwhwks3292009.university.harvard.edu > 10.0.0.6: ICMP echo request, id 21422, seq 1, length 64
23:42:58.680682 IP 10.0.0.6 > iniwhwks3292009.university.harvard.edu: ICMP echo reply, id 21422, seq 1, length 64
23:42:58.684468 IP iniwhwks3292009.university.harvard.edu > hrewhlpt2100046.university.harvard.edu: ICMP echo request, id 21423, seq 1, length 64
23:42:58.684510 IP hrewhlpt2100046.university.harvard.edu > iniwhwks3292009.university.harvard.edu: ICMP echo reply, id 21423, seq 1, length 64
23:42:58.688882 IP iniwhwks3292009.university.harvard.edu > 10.0.0.8: ICMP echo request, id 21424, seq 1, length 64
23:42:58.688929 IP 10.0.0.8 > iniwhwks3292009.university.harvard.edu: ICMP echo reply, id 21424, seq 1, length 64
23:42:58.748153 IP 10.0.0.13 > 10.0.0.5: ICMP echo request, id 21436, seq 1, length 64
23:42:58.748203 IP 10.0.0.5 > 10.0.0.13: ICMP echo reply, id 21436, seq 1, length 64
23:42:58.752377 IP 10.0.0.13 > 10.0.0.6: ICMP echo request, id 21437, seq 1, length 64
23:42:58.752420 IP 10.0.0.6 > 10.0.0.13: ICMP echo reply, id 21437, seq 1, length 64
23:42:58.756852 IP 10.0.0.13 > hrewhlpt2100046.university.harvard.edu: ICMP echo request, id 21438, seq 1, length 64
23:42:58.756894 IP hrewhlpt2100046.university.harvard.edu > 10.0.0.13: ICMP echo reply, id 21438, seq 1, length 64
23:42:58.760839 IP 10.0.0.13 > 10.0.0.8: ICMP echo request, id 21439, seq 1, length 64
23:42:58.760880 IP 10.0.0.8 > 10.0.0.13: ICMP echo reply, id 21439, seq 1, length 64
23:42:58.817680 IP 10.0.0.14 > 10.0.0.5: ICMP echo request, id 21451, seq 1, length 64
23:42:58.817722 IP 10.0.0.5 > 10.0.0.14: ICMP echo reply, id 21451, seq 1, length 64
23:42:58.827018 IP 10.0.0.14 > 10.0.0.6: ICMP echo request, id 21452, seq 1, length 64
23:42:58.827062 IP 10.0.0.6 > 10.0.0.14: ICMP echo reply, id 21452, seq 1, length 64
23:42:58.831180 IP 10.0.0.14 > hrewhlpt2100046.university.harvard.edu: ICMP echo request, id 21453, seq 1, length 64
23:42:58.831226 IP hrewhlpt2100046.university.harvard.edu > 10.0.0.14: ICMP echo reply, id 21453, seq 1, length 64
23:42:58.835287 IP 10.0.0.14 > 10.0.0.8: ICMP echo request, id 21454, seq 1, length 64
23:42:58.835331 IP 10.0.0.8 > 10.0.0.14: ICMP echo reply, id 21454, seq 1, length 64
23:42:58.895453 IP 10.0.0.15 > 10.0.0.5: ICMP echo request, id 21466, seq 1, length 64
23:42:58.895500 IP 10.0.0.5 > 10.0.0.15: ICMP echo reply, id 21466, seq 1, length 64
23:42:58.899439 IP 10.0.0.15 > 10.0.0.6: ICMP echo request, id 21467, seq 1, length 64
23:42:58.899479 IP 10.0.0.6 > 10.0.0.15: ICMP echo reply, id 21467, seq 1, length 64
23:42:58.903493 IP 10.0.0.15 > hrewhlpt2100046.university.harvard.edu: ICMP echo request, id 21468, seq 1, length 64
23:42:58.903536 IP hrewhlpt2100046.university.harvard.edu > 10.0.0.15: ICMP echo reply, id 21468, seq 1, length 64
23:42:58.908289 IP 10.0.0.15 > 10.0.0.8: ICMP echo request, id 21469, seq 1, length 64
23:42:58.908334 IP 10.0.0.8 > 10.0.0.15: ICMP echo reply, id 21469, seq 1, length 64
23:42:58.961096 IP 10.0.0.16 > 10.0.0.5: ICMP echo request, id 21481, seq 1, length 64
23:42:58.961138 IP 10.0.0.5 > 10.0.0.16: ICMP echo reply, id 21481, seq 1, length 64
23:42:58.965238 IP 10.0.0.16 > 10.0.0.6: ICMP echo request, id 21482, seq 1, length 64
23:42:58.965283 IP 10.0.0.6 > 10.0.0.16: ICMP echo reply, id 21482, seq 1, length 64
23:42:58.969246 IP 10.0.0.16 > hrewhlpt2100046.university.harvard.edu: ICMP echo request, id 21483, seq 1, length 64
23:42:58.969287 IP hrewhlpt2100046.university.harvard.edu > 10.0.0.16: ICMP echo reply, id 21483, seq 1, length 64
23:42:58.973416 IP 10.0.0.16 > 10.0.0.8: ICMP echo request, id 21484, seq 1, length 64
23:42:58.973500 IP 10.0.0.8 > 10.0.0.16: ICMP echo reply, id 21484, seq 1, length 64
23:43:02.875137 ARP, Request who-has paine-b-sw2.net.harvard.edu tell hrewhlpt2100046.university.harvard.edu, length 28
23:43:02.875146 ARP, Request who-has paine-b-sw2.net.harvard.edu tell 10.0.0.6, length 28
23:43:02.875152 ARP, Request who-has paine-b-sw2.net.harvard.edu tell 10.0.0.5, length 28
23:43:02.875193 ARP, Request who-has rfctest.harvard.edu tell 10.0.0.6, length 28
23:43:02.875194 ARP, Request who-has rfctest.harvard.edu tell 10.0.0.8, length 28
23:43:02.875200 ARP, Request who-has rfctest.harvard.edu tell hrewhlpt2100046.university.harvard.edu, length 28
23:43:02.875206 ARP, Request who-has rfctest.harvard.edu tell 10.0.0.5, length 28
23:43:02.875459 ARP, Reply paine-b-sw2.net.harvard.edu is-at 62:6c:1e:e9:a2:6a (oui Unknown), length 28
23:43:02.875463 ARP, Reply paine-b-sw2.net.harvard.edu is-at 62:6c:1e:e9:a2:6a (oui Unknown), length 28
23:43:02.875467 ARP, Reply paine-b-sw2.net.harvard.edu is-at 62:6c:1e:e9:a2:6a (oui Unknown), length 28
23:43:02.875485 ARP, Reply rfctest.harvard.edu is-at 12:b3:8d:e2:20:85 (oui Unknown), length 28
23:43:02.875505 ARP, Reply rfctest.harvard.edu is-at 12:b3:8d:e2:20:85 (oui Unknown), length 28
23:43:02.875509 ARP, Reply rfctest.harvard.edu is-at 12:b3:8d:e2:20:85 (oui Unknown), length 28
23:43:02.875512 ARP, Reply rfctest.harvard.edu is-at 12:b3:8d:e2:20:85 (oui Unknown), length 28
23:43:03.132062 ARP, Request who-has divwhlpt1048016.university.harvard.edu tell 10.0.0.8, length 28
23:43:03.132069 ARP, Request who-has divwhlpt1048016.university.harvard.edu tell hrewhlpt2100046.university.harvard.edu, length 28
23:43:03.132075 ARP, Request who-has divwhlpt1048016.university.harvard.edu tell 10.0.0.6, length 28
23:43:03.132080 ARP, Request who-has divwhlpt1048016.university.harvard.edu tell 10.0.0.5, length 28
23:43:03.132128 ARP, Request who-has hamwhwks0643000.university.harvard.edu tell 10.0.0.8, length 28
23:43:03.132134 ARP, Request who-has hamwhwks0643000.university.harvard.edu tell hrewhlpt2100046.university.harvard.edu, length 28
23:43:03.132139 ARP, Request who-has hamwhwks0643000.university.harvard.edu tell 10.0.0.6, length 28
23:43:03.132145 ARP, Request who-has hamwhwks0643000.university.harvard.edu tell 10.0.0.5, length 28
23:43:03.132201 ARP, Request who-has paine-b-sw2.net.harvard.edu tell 10.0.0.8, length 28
23:43:03.133199 ARP, Reply divwhlpt1048016.university.harvard.edu is-at 56:29:a3:a2:20:61 (oui Unknown), length 28
23:43:03.133203 ARP, Reply divwhlpt1048016.university.harvard.edu is-at 56:29:a3:a2:20:61 (oui Unknown), length 28
23:43:03.133207 ARP, Reply divwhlpt1048016.university.harvard.edu is-at 56:29:a3:a2:20:61 (oui Unknown), length 28
23:43:03.133210 ARP, Reply divwhlpt1048016.university.harvard.edu is-at 56:29:a3:a2:20:61 (oui Unknown), length 28
23:43:03.133243 ARP, Reply hamwhwks0643000.university.harvard.edu is-at 92:a1:ff:1f:cd:c5 (oui Unknown), length 28
23:43:03.133246 ARP, Reply hamwhwks0643000.university.harvard.edu is-at 92:a1:ff:1f:cd:c5 (oui Unknown), length 28
23:43:03.133250 ARP, Reply hamwhwks0643000.university.harvard.edu is-at 92:a1:ff:1f:cd:c5 (oui Unknown), length 28
23:43:03.133253 ARP, Reply hamwhwks0643000.university.harvard.edu is-at 92:a1:ff:1f:cd:c5 (oui Unknown), length 28
23:43:03.133285 ARP, Reply paine-b-sw2.net.harvard.edu is-at 62:6c:1e:e9:a2:6a (oui Unknown), length 28
23:43:03.390461 ARP, Request who-has hrewhlpt2100046.university.harvard.edu tell 10.0.0.16, length 28
23:43:03.390465 ARP, Request who-has hrewhlpt2100046.university.harvard.edu tell 10.0.0.15, length 28
23:43:03.390468 ARP, Request who-has hrewhlpt2100046.university.harvard.edu tell 10.0.0.14, length 28
23:43:03.390472 ARP, Request who-has hrewhlpt2100046.university.harvard.edu tell 10.0.0.13, length 28
23:43:03.390479 ARP, Request who-has hrewhlpt2100046.university.harvard.edu tell iniwhwks3292009.university.harvard.edu, length 28
23:43:03.390482 ARP, Request who-has hrewhlpt2100046.university.harvard.edu tell divmhlpt104804e.university.harvard.edu, length 28
23:43:03.390485 ARP, Request who-has hrewhlpt2100046.university.harvard.edu tell 10.0.0.10, length 28
23:43:03.390488 ARP, Request who-has hrewhlpt2100046.university.harvard.edu tell 10.0.0.9, length 28
23:43:03.390497 ARP, Request who-has 10.0.0.6 tell 10.0.0.16, length 28
23:43:03.390501 ARP, Request who-has 10.0.0.6 tell 10.0.0.15, length 28
23:43:03.390504 ARP, Request who-has 10.0.0.6 tell 10.0.0.14, length 28
23:43:03.390507 ARP, Request who-has 10.0.0.6 tell 10.0.0.13, length 28
23:43:03.390510 ARP, Request who-has 10.0.0.6 tell iniwhwks3292009.university.harvard.edu, length 28
23:43:03.390513 ARP, Request who-has 10.0.0.6 tell divmhlpt104804e.university.harvard.edu, length 28
23:43:03.390516 ARP, Request who-has 10.0.0.6 tell 10.0.0.10, length 28
23:43:03.390520 ARP, Request who-has 10.0.0.6 tell 10.0.0.9, length 28
23:43:03.390532 ARP, Request who-has 10.0.0.5 tell 10.0.0.16, length 28
23:43:03.390536 ARP, Request who-has 10.0.0.5 tell 10.0.0.15, length 28
23:43:03.390539 ARP, Request who-has 10.0.0.5 tell 10.0.0.14, length 28
23:43:03.390542 ARP, Request who-has 10.0.0.5 tell 10.0.0.13, length 28
23:43:03.390545 ARP, Request who-has 10.0.0.5 tell iniwhwks3292009.university.harvard.edu, length 28
23:43:03.390549 ARP, Request who-has 10.0.0.5 tell divmhlpt104804e.university.harvard.edu, length 28
23:43:03.390552 ARP, Request who-has 10.0.0.5 tell 10.0.0.10, length 28
23:43:03.390555 ARP, Request who-has 10.0.0.5 tell 10.0.0.9, length 28
23:43:03.391127 ARP, Reply hrewhlpt2100046.university.harvard.edu is-at de:fc:3a:de:5a:eb (oui Unknown), length 28
23:43:03.391134 ARP, Reply hrewhlpt2100046.university.harvard.edu is-at de:fc:3a:de:5a:eb (oui Unknown), length 28
23:43:03.391140 ARP, Reply hrewhlpt2100046.university.harvard.edu is-at de:fc:3a:de:5a:eb (oui Unknown), length 28
23:43:03.391145 ARP, Reply hrewhlpt2100046.university.harvard.edu is-at de:fc:3a:de:5a:eb (oui Unknown), length 28
23:43:03.391150 ARP, Reply hrewhlpt2100046.university.harvard.edu is-at de:fc:3a:de:5a:eb (oui Unknown), length 28
23:43:03.391155 ARP, Reply hrewhlpt2100046.university.harvard.edu is-at de:fc:3a:de:5a:eb (oui Unknown), length 28
23:43:03.391160 ARP, Reply hrewhlpt2100046.university.harvard.edu is-at de:fc:3a:de:5a:eb (oui Unknown), length 28
23:43:03.391165 ARP, Reply hrewhlpt2100046.university.harvard.edu is-at de:fc:3a:de:5a:eb (oui Unknown), length 28
23:43:03.391171 ARP, Reply 10.0.0.6 is-at 86:74:ea:fc:7a:62 (oui Unknown), length 28
23:43:03.391176 ARP, Reply 10.0.0.6 is-at 86:74:ea:fc:7a:62 (oui Unknown), length 28
23:43:03.391182 ARP, Reply 10.0.0.6 is-at 86:74:ea:fc:7a:62 (oui Unknown), length 28
23:43:03.391187 ARP, Reply 10.0.0.6 is-at 86:74:ea:fc:7a:62 (oui Unknown), length 28
23:43:03.391192 ARP, Reply 10.0.0.6 is-at 86:74:ea:fc:7a:62 (oui Unknown), length 28
23:43:03.391197 ARP, Reply 10.0.0.6 is-at 86:74:ea:fc:7a:62 (oui Unknown), length 28
23:43:03.391203 ARP, Reply 10.0.0.6 is-at 86:74:ea:fc:7a:62 (oui Unknown), length 28
23:43:03.391208 ARP, Reply 10.0.0.6 is-at 86:74:ea:fc:7a:62 (oui Unknown), length 28
23:43:03.391250 ARP, Reply 10.0.0.5 is-at 86:21:71:bd:c0:f8 (oui Unknown), length 28
23:43:03.391255 ARP, Reply 10.0.0.5 is-at 86:21:71:bd:c0:f8 (oui Unknown), length 28
23:43:03.391260 ARP, Reply 10.0.0.5 is-at 86:21:71:bd:c0:f8 (oui Unknown), length 28
23:43:03.391266 ARP, Reply 10.0.0.5 is-at 86:21:71:bd:c0:f8 (oui Unknown), length 28
23:43:03.391271 ARP, Reply 10.0.0.5 is-at 86:21:71:bd:c0:f8 (oui Unknown), length 28
23:43:03.391276 ARP, Reply 10.0.0.5 is-at 86:21:71:bd:c0:f8 (oui Unknown), length 28
23:43:03.391281 ARP, Reply 10.0.0.5 is-at 86:21:71:bd:c0:f8 (oui Unknown), length 28
23:43:03.391286 ARP, R