tcpdump: verbose output suppressed, use -v or -vv for full protocol decode
listening on s4207-eth1, link-type EN10MB (Ethernet), capture size 262144 bytes
23:42:57.812065 ARP, Request who-has 10.0.0.13 tell rfctest.harvard.edu, length 28
23:42:57.812320 ARP, Reply 10.0.0.13 is-at 1e:a2:7f:3b:17:a8 (oui Unknown), length 28
23:42:57.812964 IP rfctest.harvard.edu > 10.0.0.13: ICMP echo request, id 21263, seq 1, length 64
23:42:57.813199 IP 10.0.0.13 > rfctest.harvard.edu: ICMP echo reply, id 21263, seq 1, length 64
23:42:57.818112 ARP, Request who-has 10.0.0.14 tell rfctest.harvard.edu, length 28
23:42:57.818350 ARP, Reply 10.0.0.14 is-at 26:23:22:1a:bd:ad (oui Unknown), length 28
23:42:57.818661 IP rfctest.harvard.edu > 10.0.0.14: ICMP echo request, id 21264, seq 1, length 64
23:42:57.818954 IP 10.0.0.14 > rfctest.harvard.edu: ICMP echo reply, id 21264, seq 1, length 64
23:42:57.903077 ARP, Request who-has 10.0.0.13 tell paine-b-sw2.net.harvard.edu, length 28
23:42:57.903252 ARP, Reply 10.0.0.13 is-at 1e:a2:7f:3b:17:a8 (oui Unknown), length 28
23:42:57.903583 IP paine-b-sw2.net.harvard.edu > 10.0.0.13: ICMP echo request, id 21278, seq 1, length 64
23:42:57.903617 IP 10.0.0.13 > paine-b-sw2.net.harvard.edu: ICMP echo reply, id 21278, seq 1, length 64
23:42:57.907926 ARP, Request who-has 10.0.0.14 tell paine-b-sw2.net.harvard.edu, length 28
23:42:57.908070 ARP, Reply 10.0.0.14 is-at 26:23:22:1a:bd:ad (oui Unknown), length 28
23:42:57.908134 IP paine-b-sw2.net.harvard.edu > 10.0.0.14: ICMP echo request, id 21279, seq 1, length 64
23:42:57.908199 IP 10.0.0.14 > paine-b-sw2.net.harvard.edu: ICMP echo reply, id 21279, seq 1, length 64
23:42:57.981686 ARP, Request who-has 10.0.0.13 tell hamwhwks0643000.university.harvard.edu, length 28
23:42:57.981846 ARP, Reply 10.0.0.13 is-at 1e:a2:7f:3b:17:a8 (oui Unknown), length 28
23:42:57.982111 IP hamwhwks0643000.university.harvard.edu > 10.0.0.13: ICMP echo request, id 21293, seq 1, length 64
23:42:57.982140 IP 10.0.0.13 > hamwhwks0643000.university.harvard.edu: ICMP echo reply, id 21293, seq 1, length 64
23:42:57.986892 ARP, Request who-has 10.0.0.14 tell hamwhwks0643000.university.harvard.edu, length 28
23:42:57.987059 ARP, Reply 10.0.0.14 is-at 26:23:22:1a:bd:ad (oui Unknown), length 28
23:42:57.987135 IP hamwhwks0643000.university.harvard.edu > 10.0.0.14: ICMP echo request, id 21294, seq 1, length 64
23:42:57.987162 IP 10.0.0.14 > hamwhwks0643000.university.harvard.edu: ICMP echo reply, id 21294, seq 1, length 64
23:42:58.071692 ARP, Request who-has 10.0.0.13 tell divwhlpt1048016.university.harvard.edu, length 28
23:42:58.071900 ARP, Reply 10.0.0.13 is-at 1e:a2:7f:3b:17:a8 (oui Unknown), length 28
23:42:58.072171 IP divwhlpt1048016.university.harvard.edu > 10.0.0.13: ICMP echo request, id 21308, seq 1, length 64
23:42:58.072196 IP 10.0.0.13 > divwhlpt1048016.university.harvard.edu: ICMP echo reply, id 21308, seq 1, length 64
23:42:58.076727 ARP, Request who-has 10.0.0.14 tell divwhlpt1048016.university.harvard.edu, length 28
23:42:58.076899 ARP, Reply 10.0.0.14 is-at 26:23:22:1a:bd:ad (oui Unknown), length 28
23:42:58.076972 IP divwhlpt1048016.university.harvard.edu > 10.0.0.14: ICMP echo request, id 21309, seq 1, length 64
23:42:58.076995 IP 10.0.0.14 > divwhlpt1048016.university.harvard.edu: ICMP echo reply, id 21309, seq 1, length 64
23:42:58.164252 ARP, Request who-has 10.0.0.13 tell 10.0.0.5, length 28
23:42:58.164400 ARP, Reply 10.0.0.13 is-at 1e:a2:7f:3b:17:a8 (oui Unknown), length 28
23:42:58.164785 IP 10.0.0.5 > 10.0.0.13: ICMP echo request, id 21323, seq 1, length 64
23:42:58.164816 IP 10.0.0.13 > 10.0.0.5: ICMP echo reply, id 21323, seq 1, length 64
23:42:58.169632 ARP, Request who-has 10.0.0.14 tell 10.0.0.5, length 28
23:42:58.169986 ARP, Reply 10.0.0.14 is-at 26:23:22:1a:bd:ad (oui Unknown), length 28
23:42:58.170194 IP 10.0.0.5 > 10.0.0.14: ICMP echo request, id 21324, seq 1, length 64
23:42:58.170227 IP 10.0.0.14 > 10.0.0.5: ICMP echo reply, id 21324, seq 1, length 64
23:42:58.252490 ARP, Request who-has 10.0.0.13 tell 10.0.0.6, length 28
23:42:58.252667 ARP, Reply 10.0.0.13 is-at 1e:a2:7f:3b:17:a8 (oui Unknown), length 28
23:42:58.252985 IP 10.0.0.6 > 10.0.0.13: ICMP echo request, id 21338, seq 1, length 64
23:42:58.253016 IP 10.0.0.13 > 10.0.0.6: ICMP echo reply, id 21338, seq 1, length 64
23:42:58.257656 ARP, Request who-has 10.0.0.14 tell 10.0.0.6, length 28
23:42:58.257889 ARP, Reply 10.0.0.14 is-at 26:23:22:1a:bd:ad (oui Unknown), length 28
23:42:58.257974 IP 10.0.0.6 > 10.0.0.14: ICMP echo request, id 21339, seq 1, length 64
23:42:58.258005 IP 10.0.0.14 > 10.0.0.6: ICMP echo reply, id 21339, seq 1, length 64
23:42:58.344514 ARP, Request who-has 10.0.0.13 tell hrewhlpt2100046.university.harvard.edu, length 28
23:42:58.344656 ARP, Reply 10.0.0.13 is-at 1e:a2:7f:3b:17:a8 (oui Unknown), length 28
23:42:58.344983 IP hrewhlpt2100046.university.harvard.edu > 10.0.0.13: ICMP echo request, id 21353, seq 1, length 64
23:42:58.345014 IP 10.0.0.13 > hrewhlpt2100046.university.harvard.edu: ICMP echo reply, id 21353, seq 1, length 64
23:42:58.349018 ARP, Request who-has 10.0.0.14 tell hrewhlpt2100046.university.harvard.edu, length 28
23:42:58.349204 ARP, Reply 10.0.0.14 is-at 26:23:22:1a:bd:ad (oui Unknown), length 28
23:42:58.349271 IP hrewhlpt2100046.university.harvard.edu > 10.0.0.14: ICMP echo request, id 21354, seq 1, length 64
23:42:58.349294 IP 10.0.0.14 > hrewhlpt2100046.university.harvard.edu: ICMP echo reply, id 21354, seq 1, length 64
23:42:58.418415 ARP, Request who-has 10.0.0.13 tell 10.0.0.8, length 28
23:42:58.418592 ARP, Reply 10.0.0.13 is-at 1e:a2:7f:3b:17:a8 (oui Unknown), length 28
23:42:58.419112 IP 10.0.0.8 > 10.0.0.13: ICMP echo request, id 21368, seq 1, length 64
23:42:58.419250 IP 10.0.0.13 > 10.0.0.8: ICMP echo reply, id 21368, seq 1, length 64
23:42:58.424363 ARP, Request who-has 10.0.0.14 tell 10.0.0.8, length 28
23:42:58.424534 ARP, Reply 10.0.0.14 is-at 26:23:22:1a:bd:ad (oui Unknown), length 28
23:42:58.424602 IP 10.0.0.8 > 10.0.0.14: ICMP echo request, id 21369, seq 1, length 64
23:42:58.424791 IP 10.0.0.14 > 10.0.0.8: ICMP echo reply, id 21369, seq 1, length 64
23:42:58.493509 ARP, Request who-has 10.0.0.13 tell 10.0.0.9, length 28
23:42:58.493646 ARP, Reply 10.0.0.13 is-at 1e:a2:7f:3b:17:a8 (oui Unknown), length 28
23:42:58.494170 IP 10.0.0.9 > 10.0.0.13: ICMP echo request, id 21383, seq 1, length 64
23:42:58.494204 IP 10.0.0.13 > 10.0.0.9: ICMP echo reply, id 21383, seq 1, length 64
23:42:58.499003 ARP, Request who-has 10.0.0.14 tell 10.0.0.9, length 28
23:42:58.499167 ARP, Reply 10.0.0.14 is-at 26:23:22:1a:bd:ad (oui Unknown), length 28
23:42:58.499466 IP 10.0.0.9 > 10.0.0.14: ICMP echo request, id 21384, seq 1, length 64
23:42:58.499495 IP 10.0.0.14 > 10.0.0.9: ICMP echo reply, id 21384, seq 1, length 64
23:42:58.565816 ARP, Request who-has 10.0.0.13 tell 10.0.0.10, length 28
23:42:58.565978 ARP, Reply 10.0.0.13 is-at 1e:a2:7f:3b:17:a8 (oui Unknown), length 28
23:42:58.566263 IP 10.0.0.10 > 10.0.0.13: ICMP echo request, id 21398, seq 1, length 64
23:42:58.566289 IP 10.0.0.13 > 10.0.0.10: ICMP echo reply, id 21398, seq 1, length 64
23:42:58.571019 ARP, Request who-has 10.0.0.14 tell 10.0.0.10, length 28
23:42:58.571178 ARP, Reply 10.0.0.14 is-at 26:23:22:1a:bd:ad (oui Unknown), length 28
23:42:58.571288 IP 10.0.0.10 > 10.0.0.14: ICMP echo request, id 21399, seq 1, length 64
23:42:58.571314 IP 10.0.0.14 > 10.0.0.10: ICMP echo reply, id 21399, seq 1, length 64
23:42:58.635404 ARP, Request who-has 10.0.0.13 tell divmhlpt104804e.university.harvard.edu, length 28
23:42:58.635555 ARP, Reply 10.0.0.13 is-at 1e:a2:7f:3b:17:a8 (oui Unknown), length 28
23:42:58.636106 IP divmhlpt104804e.university.harvard.edu > 10.0.0.13: ICMP echo request, id 21413, seq 1, length 64
23:42:58.636137 IP 10.0.0.13 > divmhlpt104804e.university.harvard.edu: ICMP echo reply, id 21413, seq 1, length 64
23:42:58.641104 ARP, Request who-has 10.0.0.14 tell divmhlpt104804e.university.harvard.edu, length 28
23:42:58.641267 ARP, Reply 10.0.0.14 is-at 26:23:22:1a:bd:ad (oui Unknown), length 28
23:42:58.641628 IP divmhlpt104804e.university.harvard.edu > 10.0.0.14: ICMP echo request, id 21414, seq 1, length 64
23:42:58.641661 IP 10.0.0.14 > divmhlpt104804e.university.harvard.edu: ICMP echo reply, id 21414, seq 1, length 64
23:42:58.705564 ARP, Request who-has 10.0.0.13 tell iniwhwks3292009.university.harvard.edu, length 28
23:42:58.705723 ARP, Reply 10.0.0.13 is-at 1e:a2:7f:3b:17:a8 (oui Unknown), length 28
23:42:58.706172 IP iniwhwks3292009.university.harvard.edu > 10.0.0.13: ICMP echo request, id 21428, seq 1, length 64
23:42:58.706311 IP 10.0.0.13 > iniwhwks3292009.university.harvard.edu: ICMP echo reply, id 21428, seq 1, length 64
23:42:58.710651 ARP, Request who-has 10.0.0.14 tell iniwhwks3292009.university.harvard.edu, length 28
23:42:58.710916 ARP, Reply 10.0.0.14 is-at 26:23:22:1a:bd:ad (oui Unknown), length 28
23:42:58.711142 IP iniwhwks3292009.university.harvard.edu > 10.0.0.14: ICMP echo request, id 21429, seq 1, length 64
23:42:58.711264 IP 10.0.0.14 > iniwhwks3292009.university.harvard.edu: ICMP echo reply, id 21429, seq 1, length 64
23:42:58.729836 IP 10.0.0.13 > rfctest.harvard.edu: ICMP echo request, id 21432, seq 1, length 64
23:42:58.729911 IP rfctest.harvard.edu > 10.0.0.13: ICMP echo reply, id 21432, seq 1, length 64
23:42:58.734122 IP 10.0.0.13 > paine-b-sw2.net.harvard.edu: ICMP echo request, id 21433, seq 1, length 64
23:42:58.734194 IP paine-b-sw2.net.harvard.edu > 10.0.0.13: ICMP echo reply, id 21433, seq 1, length 64
23:42:58.739201 IP 10.0.0.13 > hamwhwks0643000.university.harvard.edu: ICMP echo request, id 21434, seq 1, length 64
23:42:58.739283 IP hamwhwks0643000.university.harvard.edu > 10.0.0.13: ICMP echo reply, id 21434, seq 1, length 64
23:42:58.743453 IP 10.0.0.13 > divwhlpt1048016.university.harvard.edu: ICMP echo request, id 21435, seq 1, length 64
23:42:58.743524 IP divwhlpt1048016.university.harvard.edu > 10.0.0.13: ICMP echo reply, id 21435, seq 1, length 64
23:42:58.748134 IP 10.0.0.13 > 10.0.0.5: ICMP echo request, id 21436, seq 1, length 64
23:42:58.748215 IP 10.0.0.5 > 10.0.0.13: ICMP echo reply, id 21436, seq 1, length 64
23:42:58.752359 IP 10.0.0.13 > 10.0.0.6: ICMP echo request, id 21437, seq 1, length 64
23:42:58.752430 IP 10.0.0.6 > 10.0.0.13: ICMP echo reply, id 21437, seq 1, length 64
23:42:58.756831 IP 10.0.0.13 > hrewhlpt2100046.university.harvard.edu: ICMP echo request, id 21438, seq 1, length 64
23:42:58.756905 IP hrewhlpt2100046.university.harvard.edu > 10.0.0.13: ICMP echo reply, id 21438, seq 1, length 64
23:42:58.760821 IP 10.0.0.13 > 10.0.0.8: ICMP echo request, id 21439, seq 1, length 64
23:42:58.760891 IP 10.0.0.8 > 10.0.0.13: ICMP echo reply, id 21439, seq 1, length 64
23:42:58.764438 IP 10.0.0.13 > 10.0.0.9: ICMP echo request, id 21440, seq 1, length 64
23:42:58.764537 IP 10.0.0.9 > 10.0.0.13: ICMP echo reply, id 21440, seq 1, length 64
23:42:58.768542 IP 10.0.0.13 > 10.0.0.10: ICMP echo request, id 21441, seq 1, length 64
23:42:58.768625 IP 10.0.0.10 > 10.0.0.13: ICMP echo reply, id 21441, seq 1, length 64
23:42:58.773082 IP 10.0.0.13 > divmhlpt104804e.university.harvard.edu: ICMP echo request, id 21442, seq 1, length 64
23:42:58.773170 IP divmhlpt104804e.university.harvard.edu > 10.0.0.13: ICMP echo reply, id 21442, seq 1, length 64
23:42:58.777119 IP 10.0.0.13 > iniwhwks3292009.university.harvard.edu: ICMP echo request, id 21443, seq 1, length 64
23:42:58.777224 IP iniwhwks3292009.university.harvard.edu > 10.0.0.13: ICMP echo reply, id 21443, seq 1, length 64
23:42:58.785549 ARP, Request who-has 10.0.0.15 tell 10.0.0.13, length 28
23:42:58.786013 ARP, Reply 10.0.0.15 is-at a6:f6:7f:9b:22:04 (oui Unknown), length 28
23:42:58.786248 IP 10.0.0.13 > 10.0.0.15: ICMP echo request, id 21445, seq 1, length 64
23:42:58.786517 IP 10.0.0.15 > 10.0.0.13: ICMP echo reply, id 21445, seq 1, length 64
23:42:58.791438 ARP, Request who-has 10.0.0.16 tell 10.0.0.13, length 28
23:42:58.791775 ARP, Reply 10.0.0.16 is-at b6:e3:93:ad:04:21 (oui Unknown), length 28
23:42:58.791993 IP 10.0.0.13 > 10.0.0.16: ICMP echo request, id 21446, seq 1, length 64
23:42:58.792149 IP 10.0.0.16 > 10.0.0.13: ICMP echo reply, id 21446, seq 1, length 64
23:42:58.800029 IP 10.0.0.14 > rfctest.harvard.edu: ICMP echo request, id 21447, seq 1, length 64
23:42:58.800100 IP rfctest.harvard.edu > 10.0.0.14: ICMP echo reply, id 21447, seq 1, length 64
23:42:58.804098 IP 10.0.0.14 > paine-b-sw2.net.harvard.edu: ICMP echo request, id 21448, seq 1, length 64
23:42:58.804176 IP paine-b-sw2.net.harvard.edu > 10.0.0.14: ICMP echo reply, id 21448, seq 1, length 64
23:42:58.808844 IP 10.0.0.14 > hamwhwks0643000.university.harvard.edu: ICMP echo request, id 21449, seq 1, length 64
23:42:58.808920 IP hamwhwks0643000.university.harvard.edu > 10.0.0.14: ICMP echo reply, id 21449, seq 1, length 64
23:42:58.813384 IP 10.0.0.14 > divwhlpt1048016.university.harvard.edu: ICMP echo request, id 21450, seq 1, length 64
23:42:58.813456 IP divwhlpt1048016.university.harvard.edu > 10.0.0.14: ICMP echo reply, id 21450, seq 1, length 64
23:42:58.817663 IP 10.0.0.14 > 10.0.0.5: ICMP echo request, id 21451, seq 1, length 64
23:42:58.817732 IP 10.0.0.5 > 10.0.0.14: ICMP echo reply, id 21451, seq 1, length 64
23:42:58.826971 IP 10.0.0.14 > 10.0.0.6: ICMP echo request, id 21452, seq 1, length 64
23:42:58.827074 IP 10.0.0.6 > 10.0.0.14: ICMP echo reply, id 21452, seq 1, length 64
23:42:58.831161 IP 10.0.0.14 > hrewhlpt2100046.university.harvard.edu: ICMP echo request, id 21453, seq 1, length 64
23:42:58.831238 IP hrewhlpt2100046.university.harvard.edu > 10.0.0.14: ICMP echo reply, id 21453, seq 1, length 64
23:42:58.835267 IP 10.0.0.14 > 10.0.0.8: ICMP echo request, id 21454, seq 1, length 64
23:42:58.835341 IP 10.0.0.8 > 10.0.0.14: ICMP echo reply, id 21454, seq 1, length 64
23:42:58.840280 IP 10.0.0.14 > 10.0.0.9: ICMP echo request, id 21455, seq 1, length 64
23:42:58.840364 IP 10.0.0.9 > 10.0.0.14: ICMP echo reply, id 21455, seq 1, length 64
23:42:58.844704 IP 10.0.0.14 > 10.0.0.10: ICMP echo request, id 21456, seq 1, length 64
23:42:58.844783 IP 10.0.0.10 > 10.0.0.14: ICMP echo reply, id 21456, seq 1, length 64
23:42:58.850336 IP 10.0.0.14 > divmhlpt104804e.university.harvard.edu: ICMP echo request, id 21457, seq 1, length 64
23:42:58.850450 IP divmhlpt104804e.university.harvard.edu > 10.0.0.14: ICMP echo reply, id 21457, seq 1, length 64
23:42:58.855034 IP 10.0.0.14 > iniwhwks3292009.university.harvard.edu: ICMP echo request, id 21458, seq 1, length 64
23:42:58.855115 IP iniwhwks3292009.university.harvard.edu > 10.0.0.14: ICMP echo reply, id 21458, seq 1, length 64
23:42:58.863297 ARP, Request who-has 10.0.0.15 tell 10.0.0.14, length 28
23:42:58.863612 ARP, Reply 10.0.0.15 is-at a6:f6:7f:9b:22:04 (oui Unknown), length 28
23:42:58.863781 IP 10.0.0.14 > 10.0.0.15: ICMP echo request, id 21460, seq 1, length 64
23:42:58.864048 IP 10.0.0.15 > 10.0.0.14: ICMP echo reply, id 21460, seq 1, length 64
23:42:58.868909 ARP, Request who-has 10.0.0.16 tell 10.0.0.14, length 28
23:42:58.869182 ARP, Reply 10.0.0.16 is-at b6:e3:93:ad:04:21 (oui Unknown), length 28
23:42:58.869369 IP 10.0.0.14 > 10.0.0.16: ICMP echo request, id 21461, seq 1, length 64
23:42:58.869538 IP 10.0.0.16 > 10.0.0.14: ICMP echo reply, id 21461, seq 1, length 64
23:42:58.928408 IP 10.0.0.15 > 10.0.0.13: ICMP echo request, id 21474, seq 1, length 64
23:42:58.928436 IP 10.0.0.13 > 10.0.0.15: ICMP echo reply, id 21474, seq 1, length 64
23:42:58.932391 IP 10.0.0.15 > 10.0.0.14: ICMP echo request, id 21475, seq 1, length 64
23:42:58.932419 IP 10.0.0.14 > 10.0.0.15: ICMP echo reply, id 21475, seq 1, length 64
23:42:58.994122 IP 10.0.0.16 > 10.0.0.13: ICMP echo request, id 21489, seq 1, length 64
23:42:58.994152 IP 10.0.0.13 > 10.0.0.16: ICMP echo reply, id 21489, seq 1, length 64
23:42:58.998183 IP 10.0.0.16 > 10.0.0.14: ICMP echo request, id 21490, seq 1, length 64
23:42:58.998213 IP 10.0.0.14 > 10.0.0.16: ICMP echo reply, id 21490, seq 1, length 64
23:43:02.875114 ARP, Request who-has rfctest.harvard.edu tell 10.0.0.14, length 28
23:43:02.875112 ARP, Request who-has rfctest.harvard.edu tell 10.0.0.13, length 28
23:43:02.875514 ARP, Reply rfctest.harvard.edu is-at 12:b3:8d:e2:20:85 (oui Unknown), length 28
23:43:02.875523 ARP, Reply rfctest.harvard.edu is-at 12:b3:8d:e2:20:85 (oui Unknown), length 28
23:43:03.131818 ARP, Request who-has divwhlpt1048016.university.harvard.edu tell 10.0.0.14, length 28
23:43:03.131823 ARP, Request who-has divwhlpt1048016.university.harvard.edu tell 10.0.0.13, length 28
23:43:03.131872 ARP, Request who-has hamwhwks0643000.university.harvard.edu tell 10.0.0.14, length 28
23:43:03.131875 ARP, Request who-has hamwhwks0643000.university.harvard.edu tell 10.0.0.13, length 28
23:43:03.131959 ARP, Request who-has paine-b-sw2.net.harvard.edu tell 10.0.0.14, length 28
23:43:03.131965 ARP, Request who-has paine-b-sw2.net.harvard.edu tell 10.0.0.13, length 28
23:43:03.133304 ARP, Reply divwhlpt1048016.university.harvard.edu is-at 56:29:a3:a2:20:61 (oui Unknown), length 28
23:43:03.133311 ARP, Reply divwhlpt1048016.university.harvard.edu is-at 56:29:a3:a2:20:61 (oui Unknown), length 28
23:43:03.133381 ARP, Reply hamwhwks0643000.university.harvard.edu is-at 92:a1:ff:1f:cd:c5 (oui Unknown), length 28
23:43:03.133387 ARP, Reply hamwhwks0643000.university.harvard.edu is-at 92:a1:ff:1f:cd:c5 (oui Unknown), length 28
23:43:03.133447 ARP, Reply paine-b-sw2.net.harvard.edu is-at 62:6c:1e:e9:a2:6a (oui Unknown), length 28
23:43:03.133453 ARP, Reply paine-b-sw2.net.harvard.edu is-at 62:6c:1e:e9:a2:6a (oui Unknown), length 28
23:43:03.390165 ARP, Request who-has hrewhlpt2100046.university.harvard.edu tell 10.0.0.14, length 28
23:43:03.390170 ARP, Request who-has hrewhlpt2100046.university.harvard.edu tell 10.0.0.13, length 28
23:43:03.390208 ARP, Request who-has 10.0.0.6 tell 10.0.0.14, length 28
23:43:03.390212 ARP, Request who-has 10.0.0.6 tell 10.0.0.13, length 28
23:43:03.390250 ARP, Request who-has 10.0.0.5 tell 10.0.0.14, length 28
23:43:03.390254 ARP, Request who-has 10.0.0.5 tell 10.0.0.13, length 28
23:43:03.391401 ARP, Reply hrewhlpt2100046.university.harvard.edu is-at de:fc:3a:de:5a:eb (oui Unknown), length 28
23:43:03.391408 ARP, Reply hrewhlpt2100046.university.harvard.edu is-at de:fc:3a:de:5a:eb (oui Unknown), length 28
23:43:03.391455 ARP, Reply 10.0.0.6 is-at 86:74:ea:fc:7a:62 (oui Unknown), length 28
23:43:03.391460 ARP, Reply 10.0.0.6 is-at 86:74:ea:fc:7a:62 (oui Unknown), length 28
23:43:03.391500 ARP, Reply 10.0.0.5 is-at 86:21:71:bd:c0:f8 (oui Unknown), length 28
23:43:03.391506 ARP, Reply 10.0.0.5 is-at 86:21:71:bd:c0:f8 (oui Unknown), length 28
23:43:03.643308 ARP, Request who-has divmhlpt104804e.university.harvard.edu tell 10.0.0.14, length 28
23:43:03.643336 ARP, Request who-has divmhlpt104804e.university.harvard.edu tell 10.0.0.13, length 28
23:43:03.643350 ARP, Request who-has 10.0.0.10 tell 10.0.0.14, length 28
23:43:03.643354 ARP, Request who-has 10.0.0.10 tell 10.0.0.13, length 28
23:43:03.643368 ARP, Request who-has 10.0.0.9 tell 10.0.0.14, length 28
23:43:03.643372 ARP, Request who-has 10.0.0.9 tell 10.0.0.13, length 28
23:43:03.643387 ARP, Request who-has 10.0.0.8 tell 10.0.0.14, length 28
23:43:03.643390 ARP, Request who-has 10.0.0.8 tell 10.0.0.13, length 28
23:43:03.643645 ARP, Reply divmhlpt104804e.university.harvard.edu is-at a2:de:e5:ff:01:9b (oui Unknown), length 28
23:43:03.644253 ARP, Reply divmhlpt104804e.university.harvard.edu is-at a2:de:e5:ff:01:9b (oui Unknown), length 28
23:43:03.644270 ARP, Reply 10.0.0.10 is-at 9a:60:b4:e8:36:04 (oui Unknown), length 28
23:43:03.644277 ARP, Reply 10.0.0.10 is-at 9a:60:b4:e8:36:04 (oui Unknown), length 28
23:43:03.644290 ARP, Reply 10.0.0.9 is-at 8a:c8:67:01:92:b9 (oui Unknown), length 28
23:43:03.644295 ARP, Reply 10.0.0.9 is-at 8a:c8:67:01:92:b9 (oui Unknown), length 28
23:43:03.644305 ARP, Reply 10.0.0.8 is-at 22:a1:4f:d4:cd:7d (oui Unknown), length 28
23:43:03.644311 ARP, Reply 10.0.0.8 is-at 22:a1:4f:d4:cd:7d (oui Unknown), length 28
23:43:03.899063 ARP, Request who-has 10.0.0.13 tell 10.0.0.15, length 28
23:43:03.899093 ARP, Request who-has 10.0.0.14 tell 10.0.0.16, length 28
23:43:03.899098 ARP, Request who-has 10.0.0.14 tell 10.0.0.15, length 28
23:43:03.899104 ARP, Request who-has 10.0.0.13 tell 10.0.0.16, length 28
23:43:03.899079 ARP, Request who-has iniwhwks3292009.university.harvard.edu tell 10.0.0.14, length 28
23:43:03.899083 ARP, Request who-has iniwhwks3292009.university.harvard.edu tell 10.0.0.13, length 28
23:43:03.899129 ARP, Reply 10.0.0.13 is-