tcpdump: verbose output suppressed, use -v or -vv for full protocol decode
listening on s4205-eth2, link-type EN10MB (Ethernet), capture size 262144 bytes
01:15:11.048398 IP taubman-3s-sw1-vl-1.net.harvard.edu > divmhlpt104804e.university.harvard.edu: ICMP echo request, id 3489, seq 1, length 64
01:15:11.048577 IP divmhlpt104804e.university.harvard.edu > taubman-3s-sw1-vl-1.net.harvard.edu: ICMP echo reply, id 3489, seq 1, length 64
01:15:11.052508 IP taubman-3s-sw1-vl-1.net.harvard.edu > hulmhlpt1383001.university.harvard.edu: ICMP echo request, id 3490, seq 1, length 64
01:15:11.052698 IP hulmhlpt1383001.university.harvard.edu > taubman-3s-sw1-vl-1.net.harvard.edu: ICMP echo reply, id 3490, seq 1, length 64
01:15:11.108356 IP daisy.university.harvard.edu > divmhlpt104804e.university.harvard.edu: ICMP echo request, id 3504, seq 1, length 64
01:15:11.108379 IP divmhlpt104804e.university.harvard.edu > daisy.university.harvard.edu: ICMP echo reply, id 3504, seq 1, length 64
01:15:11.116784 IP daisy.university.harvard.edu > hulmhlpt1383001.university.harvard.edu: ICMP echo request, id 3505, seq 1, length 64
01:15:11.116810 IP hulmhlpt1383001.university.harvard.edu > daisy.university.harvard.edu: ICMP echo reply, id 3505, seq 1, length 64
01:15:11.183593 IP aardvark.university.harvard.edu > divmhlpt104804e.university.harvard.edu: ICMP echo request, id 3519, seq 1, length 64
01:15:11.183617 IP divmhlpt104804e.university.harvard.edu > aardvark.university.harvard.edu: ICMP echo reply, id 3519, seq 1, length 64
01:15:11.186952 IP aardvark.university.harvard.edu > hulmhlpt1383001.university.harvard.edu: ICMP echo request, id 3520, seq 1, length 64
01:15:11.186984 IP hulmhlpt1383001.university.harvard.edu > aardvark.university.harvard.edu: ICMP echo reply, id 3520, seq 1, length 64
01:15:11.238604 IP divwhlpt1048016.university.harvard.edu > divmhlpt104804e.university.harvard.edu: ICMP echo request, id 3534, seq 1, length 64
01:15:11.238630 IP divmhlpt104804e.university.harvard.edu > divwhlpt1048016.university.harvard.edu: ICMP echo reply, id 3534, seq 1, length 64
01:15:11.241605 IP divwhlpt1048016.university.harvard.edu > hulmhlpt1383001.university.harvard.edu: ICMP echo request, id 3535, seq 1, length 64
01:15:11.241633 IP hulmhlpt1383001.university.harvard.edu > divwhlpt1048016.university.harvard.edu: ICMP echo reply, id 3535, seq 1, length 64
01:15:11.295584 IP 10.0.0.5 > divmhlpt104804e.university.harvard.edu: ICMP echo request, id 3549, seq 1, length 64
01:15:11.295607 IP divmhlpt104804e.university.harvard.edu > 10.0.0.5: ICMP echo reply, id 3549, seq 1, length 64
01:15:11.299216 IP 10.0.0.5 > hulmhlpt1383001.university.harvard.edu: ICMP echo request, id 3550, seq 1, length 64
01:15:11.299249 IP hulmhlpt1383001.university.harvard.edu > 10.0.0.5: ICMP echo reply, id 3550, seq 1, length 64
01:15:11.350177 IP 10.0.0.6 > divmhlpt104804e.university.harvard.edu: ICMP echo request, id 3564, seq 1, length 64
01:15:11.350199 IP divmhlpt104804e.university.harvard.edu > 10.0.0.6: ICMP echo reply, id 3564, seq 1, length 64
01:15:11.353354 IP 10.0.0.6 > hulmhlpt1383001.university.harvard.edu: ICMP echo request, id 3565, seq 1, length 64
01:15:11.353377 IP hulmhlpt1383001.university.harvard.edu > 10.0.0.6: ICMP echo reply, id 3565, seq 1, length 64
01:15:11.404907 IP hrewhlpt2100046.university.harvard.edu > divmhlpt104804e.university.harvard.edu: ICMP echo request, id 3579, seq 1, length 64
01:15:11.404931 IP divmhlpt104804e.university.harvard.edu > hrewhlpt2100046.university.harvard.edu: ICMP echo reply, id 3579, seq 1, length 64
01:15:11.408679 IP hrewhlpt2100046.university.harvard.edu > hulmhlpt1383001.university.harvard.edu: ICMP echo request, id 3580, seq 1, length 64
01:15:11.408703 IP hulmhlpt1383001.university.harvard.edu > hrewhlpt2100046.university.harvard.edu: ICMP echo reply, id 3580, seq 1, length 64
01:15:11.463340 IP 10.0.0.8 > divmhlpt104804e.university.harvard.edu: ICMP echo request, id 3594, seq 1, length 64
01:15:11.463548 IP divmhlpt104804e.university.harvard.edu > 10.0.0.8: ICMP echo reply, id 3594, seq 1, length 64
01:15:11.467184 IP 10.0.0.8 > hulmhlpt1383001.university.harvard.edu: ICMP echo request, id 3595, seq 1, length 64
01:15:11.467309 IP hulmhlpt1383001.university.harvard.edu > 10.0.0.8: ICMP echo reply, id 3595, seq 1, length 64
01:15:11.518348 IP 10.0.0.9 > divmhlpt104804e.university.harvard.edu: ICMP echo request, id 3609, seq 1, length 64
01:15:11.518385 IP divmhlpt104804e.university.harvard.edu > 10.0.0.9: ICMP echo reply, id 3609, seq 1, length 64
01:15:11.523254 IP 10.0.0.9 > hulmhlpt1383001.university.harvard.edu: ICMP echo request, id 3610, seq 1, length 64
01:15:11.523281 IP hulmhlpt1383001.university.harvard.edu > 10.0.0.9: ICMP echo reply, id 3610, seq 1, length 64
01:15:11.578321 IP 10.0.0.10 > divmhlpt104804e.university.harvard.edu: ICMP echo request, id 3624, seq 1, length 64
01:15:11.578485 IP divmhlpt104804e.university.harvard.edu > 10.0.0.10: ICMP echo reply, id 3624, seq 1, length 64
01:15:11.582046 IP 10.0.0.10 > hulmhlpt1383001.university.harvard.edu: ICMP echo request, id 3625, seq 1, length 64
01:15:11.582165 IP hulmhlpt1383001.university.harvard.edu > 10.0.0.10: ICMP echo reply, id 3625, seq 1, length 64
01:15:11.602240 IP divmhlpt104804e.university.harvard.edu > taubman-3s-sw1-vl-1.net.harvard.edu: ICMP echo request, id 3630, seq 1, length 64
01:15:11.602302 IP taubman-3s-sw1-vl-1.net.harvard.edu > divmhlpt104804e.university.harvard.edu: ICMP echo reply, id 3630, seq 1, length 64
01:15:11.605517 IP divmhlpt104804e.university.harvard.edu > daisy.university.harvard.edu: ICMP echo request, id 3631, seq 1, length 64
01:15:11.605583 IP daisy.university.harvard.edu > divmhlpt104804e.university.harvard.edu: ICMP echo reply, id 3631, seq 1, length 64
01:15:11.608717 IP divmhlpt104804e.university.harvard.edu > aardvark.university.harvard.edu: ICMP echo request, id 3632, seq 1, length 64
01:15:11.608798 IP aardvark.university.harvard.edu > divmhlpt104804e.university.harvard.edu: ICMP echo reply, id 3632, seq 1, length 64
01:15:11.611915 IP divmhlpt104804e.university.harvard.edu > divwhlpt1048016.university.harvard.edu: ICMP echo request, id 3633, seq 1, length 64
01:15:11.611976 IP divwhlpt1048016.university.harvard.edu > divmhlpt104804e.university.harvard.edu: ICMP echo reply, id 3633, seq 1, length 64
01:15:11.614999 IP divmhlpt104804e.university.harvard.edu > 10.0.0.5: ICMP echo request, id 3634, seq 1, length 64
01:15:11.615059 IP 10.0.0.5 > divmhlpt104804e.university.harvard.edu: ICMP echo reply, id 3634, seq 1, length 64
01:15:11.618031 IP divmhlpt104804e.university.harvard.edu > 10.0.0.6: ICMP echo request, id 3635, seq 1, length 64
01:15:11.618092 IP 10.0.0.6 > divmhlpt104804e.university.harvard.edu: ICMP echo reply, id 3635, seq 1, length 64
01:15:11.621458 IP divmhlpt104804e.university.harvard.edu > hrewhlpt2100046.university.harvard.edu: ICMP echo request, id 3636, seq 1, length 64
01:15:11.621520 IP hrewhlpt2100046.university.harvard.edu > divmhlpt104804e.university.harvard.edu: ICMP echo reply, id 3636, seq 1, length 64
01:15:11.624609 IP divmhlpt104804e.university.harvard.edu > 10.0.0.8: ICMP echo request, id 3637, seq 1, length 64
01:15:11.624691 IP 10.0.0.8 > divmhlpt104804e.university.harvard.edu: ICMP echo reply, id 3637, seq 1, length 64
01:15:11.627707 IP divmhlpt104804e.university.harvard.edu > 10.0.0.9: ICMP echo request, id 3638, seq 1, length 64
01:15:11.627742 IP 10.0.0.9 > divmhlpt104804e.university.harvard.edu: ICMP echo reply, id 3638, seq 1, length 64
01:15:11.630949 IP divmhlpt104804e.university.harvard.edu > 10.0.0.10: ICMP echo request, id 3639, seq 1, length 64
01:15:11.630986 IP 10.0.0.10 > divmhlpt104804e.university.harvard.edu: ICMP echo reply, id 3639, seq 1, length 64
01:15:11.638574 IP divmhlpt104804e.university.harvard.edu > 10.0.0.13: ICMP echo request, id 3641, seq 1, length 64
01:15:11.638834 IP 10.0.0.13 > divmhlpt104804e.university.harvard.edu: ICMP echo reply, id 3641, seq 1, length 64
01:15:11.642483 IP divmhlpt104804e.university.harvard.edu > 10.0.0.14: ICMP echo request, id 3642, seq 1, length 64
01:15:11.642653 IP 10.0.0.14 > divmhlpt104804e.university.harvard.edu: ICMP echo reply, id 3642, seq 1, length 64
01:15:11.646375 IP divmhlpt104804e.university.harvard.edu > 10.0.0.15: ICMP echo request, id 3643, seq 1, length 64
01:15:11.646481 IP 10.0.0.15 > divmhlpt104804e.university.harvard.edu: ICMP echo reply, id 3643, seq 1, length 64
01:15:11.649999 IP divmhlpt104804e.university.harvard.edu > 10.0.0.16: ICMP echo request, id 3644, seq 1, length 64
01:15:11.650162 IP 10.0.0.16 > divmhlpt104804e.university.harvard.edu: ICMP echo reply, id 3644, seq 1, length 64
01:15:11.656057 IP hulmhlpt1383001.university.harvard.edu > taubman-3s-sw1-vl-1.net.harvard.edu: ICMP echo request, id 3645, seq 1, length 64
01:15:11.656131 IP taubman-3s-sw1-vl-1.net.harvard.edu > hulmhlpt1383001.university.harvard.edu: ICMP echo reply, id 3645, seq 1, length 64
01:15:11.659640 IP hulmhlpt1383001.university.harvard.edu > daisy.university.harvard.edu: ICMP echo request, id 3646, seq 1, length 64
01:15:11.659713 IP daisy.university.harvard.edu > hulmhlpt1383001.university.harvard.edu: ICMP echo reply, id 3646, seq 1, length 64
01:15:11.663166 IP hulmhlpt1383001.university.harvard.edu > aardvark.university.harvard.edu: ICMP echo request, id 3647, seq 1, length 64
01:15:11.663225 IP aardvark.university.harvard.edu > hulmhlpt1383001.university.harvard.edu: ICMP echo reply, id 3647, seq 1, length 64
01:15:11.666467 IP hulmhlpt1383001.university.harvard.edu > divwhlpt1048016.university.harvard.edu: ICMP echo request, id 3648, seq 1, length 64
01:15:11.666553 IP divwhlpt1048016.university.harvard.edu > hulmhlpt1383001.university.harvard.edu: ICMP echo reply, id 3648, seq 1, length 64
01:15:11.670058 IP hulmhlpt1383001.university.harvard.edu > 10.0.0.5: ICMP echo request, id 3649, seq 1, length 64
01:15:11.670123 IP 10.0.0.5 > hulmhlpt1383001.university.harvard.edu: ICMP echo reply, id 3649, seq 1, length 64
01:15:11.673594 IP hulmhlpt1383001.university.harvard.edu > 10.0.0.6: ICMP echo request, id 3650, seq 1, length 64
01:15:11.673716 IP 10.0.0.6 > hulmhlpt1383001.university.harvard.edu: ICMP echo reply, id 3650, seq 1, length 64
01:15:11.677279 IP hulmhlpt1383001.university.harvard.edu > hrewhlpt2100046.university.harvard.edu: ICMP echo request, id 3651, seq 1, length 64
01:15:11.677342 IP hrewhlpt2100046.university.harvard.edu > hulmhlpt1383001.university.harvard.edu: ICMP echo reply, id 3651, seq 1, length 64
01:15:11.680628 IP hulmhlpt1383001.university.harvard.edu > 10.0.0.8: ICMP echo request, id 3652, seq 1, length 64
01:15:11.680691 IP 10.0.0.8 > hulmhlpt1383001.university.harvard.edu: ICMP echo reply, id 3652, seq 1, length 64
01:15:11.684196 IP hulmhlpt1383001.university.harvard.edu > 10.0.0.9: ICMP echo request, id 3653, seq 1, length 64
01:15:11.684241 IP 10.0.0.9 > hulmhlpt1383001.university.harvard.edu: ICMP echo reply, id 3653, seq 1, length 64
01:15:11.689177 IP hulmhlpt1383001.university.harvard.edu > 10.0.0.10: ICMP echo request, id 3654, seq 1, length 64
01:15:11.689224 IP 10.0.0.10 > hulmhlpt1383001.university.harvard.edu: ICMP echo reply, id 3654, seq 1, length 64
01:15:11.696782 IP hulmhlpt1383001.university.harvard.edu > 10.0.0.13: ICMP echo request, id 3656, seq 1, length 64
01:15:11.697192 IP 10.0.0.13 > hulmhlpt1383001.university.harvard.edu: ICMP echo reply, id 3656, seq 1, length 64
01:15:11.700858 IP hulmhlpt1383001.university.harvard.edu > 10.0.0.14: ICMP echo request, id 3657, seq 1, length 64
01:15:11.701030 IP 10.0.0.14 > hulmhlpt1383001.university.harvard.edu: ICMP echo reply, id 3657, seq 1, length 64
01:15:11.704709 IP hulmhlpt1383001.university.harvard.edu > 10.0.0.15: ICMP echo request, id 3658, seq 1, length 64
01:15:11.705123 IP 10.0.0.15 > hulmhlpt1383001.university.harvard.edu: ICMP echo reply, id 3658, seq 1, length 64
01:15:11.708604 IP hulmhlpt1383001.university.harvard.edu > 10.0.0.16: ICMP echo request, id 3659, seq 1, length 64
01:15:11.708775 IP 10.0.0.16 > hulmhlpt1383001.university.harvard.edu: ICMP echo reply, id 3659, seq 1, length 64
01:15:11.748614 IP 10.0.0.13 > divmhlpt104804e.university.harvard.edu: ICMP echo request, id 3670, seq 1, length 64
01:15:11.748638 IP divmhlpt104804e.university.harvard.edu > 10.0.0.13: ICMP echo reply, id 3670, seq 1, length 64
01:15:11.751838 IP 10.0.0.13 > hulmhlpt1383001.uni                                                                                                                                                                                                                                                                                                                                                                                                                                                                                                                                                                                                                                                                                                                                                                                                                                                                                                                                                                                                                                                                                                                                                                                                                                                                                                                                                                                                                                                                                                                                                                                                                                                                                                                                                                                                                                                                                                                                                                                                                                                                                                                                                                                                                                                                                                                                                                                                                                                                                                                                                                                                                                                                                                                                                                                                                                                                                                                                                                                                                                                                                                                                                                                                                                                                                                                                                                                                                                                                                                                                                                                                                                                                                                                                                                                                                                                                                                                                                                                                                                                                                                                                                                                                                                                                                                                                                                                                                                                                                                                                                                                                                                                                                                                                                                                                                                                                                                                                                                                                                                                                                                                                                                                                                                                                                                                                                                                                                                                                                                                                                                                                                                                                                                                                                                                                                                                                                                                                                                                                                                                                                                                                                                                                                                                                                                                                                                                                                                                                                                                                                                                                                                                                                                                                                                                                                                                                                                                                                                                                                                                                                                                                                                                                                                                                                                                                                                                                                                                                                                                                                                                                                                                                                                                                                                                                                                                                                                                                                                                                                                                                                                                                                                                                                                                                                                                                                                                                                                                                                                                                                                                                                                                                                                                                                                                                                                                                                                                                                                                                                                                                                                                                                                                                                                                                                                                                                                                                                                                                                                                                                                                                                                                                                                                                                                                                                                                                                                                                                                                                                                                                                                                                                                                                                                                                                                                                                                                                                                                                                                                                                                                                                                                                                                                                                                                                                                                                                                                                                                                                                                                                                                                                                                                                                                                                                                                                                                                                                                                                                                                                                                                                                                                                                                                                                                                                                                                                                                                                                                                                                                                                                                                                                                                                                                                                                                                                                                                                                                                                                                                                                                                                                                                                                                                                                                                                ho-has hulmhlpt1383001.university.harvard.edu tell 10.0.0.14, length 28
01:14:56.899508 ARP, Request who-has hulmhlpt1383001.university.harvard.edu tell 10.0.0.13, length 28
01:14:56.899522 ARP, Request who-has divmhlpt104804e.university.harvard.edu tell 10.0.0.16, length 28
01:14:56.899534 ARP, Request who-has divmhlpt104804e.university.harvard.edu tell 10.0.0.15, length 28
01:14:56.899546 ARP, Request who-has divmhlpt104804e.university.harvard.edu tell 10.0.0.14, length 28
01:14:56.899558 ARP, Request who-has divmhlpt104804e.university.harvard.edu tell 10.0.0.13, length 28
01:14:56.900060 ARP, Reply 10.0.0.10 is-at 2e:dd:11:c3:e2:c0 (oui Unknown), length 28
01:14:56.900073 ARP, Reply 10.0.0.10 is-at 2e:dd:11:c3:e2:c0 (oui Unknown), length 28
01:14:56.900085 ARP, Reply hulmhlpt1383001.university.harvard.edu is-at b2:db:4b:0d:7b:f9 (oui Unknown), length 28
01:14:56.900095 ARP, Reply hulmhlpt1383001.university.harvard.edu is-at b2:db:4b:0d:7b:f9 (oui Unknown), length 28
01:14:56.900103 ARP, Reply hulmhlpt1383001.university.harvard.edu is-at b2:db:4b:0d:7b:f9 (oui Unknown), length 28
01:14:56.900111 ARP, Reply hulmhlpt1383001.university.harvard.edu is-at b2:db:4b:0d:7b:f9 (oui Unknown), length 28
01:14:56.900120 ARP, Reply divmhlpt104804e.university.harvard.edu is-at 0a:7f:f7:01:3d:da (oui Unknown), length 28
01:14:56.900129 ARP, Reply divmhlpt104804e.university.harvard.edu is-at 0a:7f:f7:01:3d:da (oui Unknown), length 28
01:14:56.900137 ARP, Reply divmhlpt104804e.university.harvard.edu is-at 0a:7f:f7:01:3d:da (oui Unknown), length 28
01:14:56.900146 ARP, Reply divmhlpt104804e.university.harvard.edu is-at 0a:7f:f7:01:3d:da (oui Unknown), length 28
01:15:11.048398 IP taubman-3s-sw1-vl-1.net.harvard.edu > divmhlpt104804e.university.harvard.edu: ICMP echo request, id 3489, seq 1, length 64
01:15:11.048577 IP divmhlpt104804e.university.harvard.edu > taubman-3s-sw1-vl-1.net.harvard.edu: ICMP echo reply, id 3489, seq 1, length 64
01:15:11.052508 IP taubman-3s-sw1-vl-1.net.harvard.edu > hulmhlpt1383001.university.harvard.edu: ICMP echo request, id 3490, seq 1, length 64
01:15:11.052698 IP hulmhlpt1383001.university.harvard.edu > taubman-3s-sw1-vl-1.net.harvard.edu: ICMP echo reply, id 3490, seq 1, length 64
01:15:11.108356 IP daisy.university.harvard.edu > divmhlpt104804e.university.harvard.edu: ICMP echo request, id 3504, seq 1, length 64
01:15:11.108379 IP divmhlpt104804e.university.harvard.edu > daisy.university.harvard.edu: ICMP echo reply, id 3504, seq 1, length 64
01:15:11.116784 IP daisy.university.harvard.edu > hulmhlpt1383001.university.harvard.edu: ICMP echo request, id 3505, seq 1, length 64
01:15:11.116810 IP hulmhlpt1383001.university.harvard.edu > daisy.university.harvard.edu: ICMP echo reply, id 3505, seq 1, length 64
01:15:11.183593 IP aardvark.university.harvard.edu > divmhlpt104804e.university.harvard.edu: ICMP echo request, id 3519, seq 1, length 64
01:15:11.183617 IP divmhlpt104804e.university.harvard.edu > aardvark.university.harvard.edu: ICMP echo reply, id 3519, seq 1, length 64
01:15:11.186952 IP aardvark.university.harvard.edu > hulmhlpt1383001.university.harvard.edu: ICMP echo request, id 3520, seq 1, length 64
01:15:11.186984 IP hulmhlpt1383001.university.harvard.edu > aardvark.university.harvard.edu: ICMP echo reply, id 3520, seq 1, length 64
01:15:11.238604 IP divwhlpt1048016.university.harvard.edu > divmhlpt104804e.university.harvard.edu: ICMP echo request, id 3534, seq 1, length 64
01:15:11.238630 IP divmhlpt104804e.university.harvard.edu > divwhlpt1048016.university.harvard.edu: ICMP echo reply, id 3534, seq 1, length 64
01:15:11.241605 IP divwhlpt1048016.university.harvard.edu > hulmhlpt1383001.university.harvard.edu: ICMP echo request, id 3535, seq 1, length 64
01:15:11.241633 IP hulmhlpt1383001.university.harvard.edu > divwhlpt1048016.university.harvard.edu: ICMP echo reply, id 3535, seq 1, length 64
01:15:11.295584 IP 10.0.0.5 > divmhlpt104804e.university.harvard.edu: ICMP echo request, id 3549, seq 1, length 64
01:15:11.295607 IP divmhlpt104804e.university.harvard.edu > 10.0.0.5: ICMP echo reply, id 3549, seq 1, length 64
01:15:11.299216 IP 10.0.0.5 > hulmhlpt1383001.university.harvard.edu: ICMP echo request, id 3550, seq 1, length 64
01:15:11.299249 IP hulmhlpt1383001.university.harvard.edu > 10.0.0.5: ICMP echo reply, id 3550, seq 1, length 64
01:15:11.350177 IP 10.0.0.6 > divmhlpt104804e.university.harvard.edu: ICMP echo request, id 3564, seq 1, length 64
01:15:11.350199 IP divmhlpt104804e.university.harvard.edu > 10.0.0.6: ICMP echo reply, id 3564, seq 1, length 64
01:15:11.353354 IP 10.0.0.6 > hulmhlpt1383001.university.harvard.edu: ICMP echo request, id 3565, seq 1, length 64
01:15:11.353377 IP hulmhlpt1383001.university.harvard.edu > 10.0.0.6: ICMP echo reply, id 3565, seq 1, length 64
01:15:11.404907 IP hrewhlpt2100046.university.harvard.edu > divmhlpt104804e.university.harvard.edu: ICMP echo request, id 3579, seq 1, length 64
01:15:11.404931 IP divmhlpt104804e.university.harvard.edu > hrewhlpt2100046.university.harvard.edu: ICMP echo reply, id 3579, seq 1, length 64
01:15:11.408679 IP hrewhlpt2100046.university.harvard.edu > hulmhlpt1383001.university.harvard.edu: ICMP echo request, id 3580, seq 1, length 64
01:15:11.408703 IP hulmhlpt1383001.university.harvard.edu > hrewhlpt2100046.university.harvard.edu: ICMP echo reply, id 3580, seq 1, length 64
01:15:11.463340 IP 10.0.0.8 > divmhlpt104804e.university.harvard.edu: ICMP echo request, id 3594, seq 1, length 64
01:15:11.463548 IP divmhlpt104804e.university.harvard.edu > 10.0.0.8: ICMP echo reply, id 3594, seq 1, length 64
01:15:11.467184 IP 10.0.0.8 > hulmhlpt1383001.university.harvard.edu: ICMP echo request, id 3595, seq 1, length 64
01:15:11.467309 IP hulmhlpt1383001.university.harvard.edu > 10.0.0.8: ICMP echo reply, id 3595, seq 1, length 64
01:15:11.518348 IP 10.0.0.9 > divmhlpt104804e.university.harvard.edu: ICMP echo request, id 3609, seq 1, length 64
01:15:11.518385 IP divmhlpt104804e.university.harvard.edu > 10.0.0.9: ICMP echo reply, id 3609, seq 1, length 64
01:15:11.523254 IP 10.0.0.9 > hulmhlpt1383001.university.harvard.edu: ICMP echo request, id 3610, seq 1, length 64
01:15:11.523281 IP hulmhlpt1383001.university.harvard.edu > 10.0.0.9: ICMP echo reply, id 3610, seq 1, length 64
01:15:11.578321 IP 10.0.0.10 > divmhlpt104804e.university.harvard.edu: ICMP echo request, id 3624, seq 1, length 64
01:15:11.578485 IP divmhlpt104804e.university.harvard.edu > 10.0.0.10: ICMP echo reply, id 3624, seq 1, length 64
01:15:11.582046 IP 10.0.0.10 > hulmhlpt1383001.university.harvard.edu: ICMP echo request, id 3625, seq 1, length 64
01:15:11.582165 IP hulmhlpt1383001.university.harvard.edu > 10.0.0.10: ICMP echo reply, id 3625, seq 1, length 64
01:15:11.602240 IP divmhlpt104804e.university.harvard.edu > taubman-3s-sw1-vl-1.net.harvard.edu: ICMP echo request, id 3630, seq 1, length 64
01:15:11.602302 IP taubman-3s-sw1-vl-1.net.harvard.edu > divmhlpt104804e.university.harvard.edu: ICMP echo reply, id 3630, seq 1, length 64
01:15:11.605517 IP divmhlpt104804e.university.harvard.edu > daisy.university.harvard.edu: ICMP echo request, id 3631, seq 1, length 64
01:15:11.605583 IP daisy.university.harvard.edu > divmhlpt104804e.university.harvard.edu: ICMP echo reply, id 3631, seq 1, length 64
01:15:11.608717 IP divmhlpt104804e.university.harvard.edu > aardvark.university.harvard.edu: ICMP echo request, id 3632, seq 1, length 64
01:15:11.608798 IP aardvark.university.harvard.edu > divmhlpt104804e.university.harvard.edu: ICMP echo reply, id 3632, seq 1, length 64
01:15:11.611915 IP divmhlpt104804e.university.harvard.edu > divwhlpt1048016.university.harvard.edu: ICMP echo request, id 3633, seq 1, length 64
01:15:11.611976 IP divwhlpt1048016.university.harvard.edu > divmhlpt104804e.university.harvard.edu: ICMP echo reply, id 3633, seq 1, length 64
01:15:11.614999 IP divmhlpt104804e.university.harvard.edu > 10.0.0.5: ICMP echo request, id 3634, seq 1, length 64
01:15:11.615059 IP 10.0.0.5 > divmhlpt104804e.university.harvard.edu: ICMP echo reply, id 3634, seq 1, length 64
01:15:11.618031 IP divmhlpt104804e.university.harvard.edu > 10.0.0.6: ICMP echo request, id 3635, seq 1, length 64
01:15:11.618092 IP 10.0.0.6 > divmhlpt104804e.university.harvard.edu: ICMP echo reply, id 3635, seq 1, length 64
01:15:11.621458 IP divmhlpt104804e.university.harvard.edu > hrewhlpt2100046.university.harvard.edu: ICMP echo request, id 3636, seq 1, length 64
01:15:11.621520 IP hrewhlpt2100046.university.harvard.edu > divmhlpt104804e.university.harvard.edu: ICMP echo reply, id 3636, seq 1, length 64
01:15:11.624609 IP divmhlpt104804e.university.harvard.edu > 10.0.0.8: ICMP echo request, id 3637, seq 1, length 64
01:15:11.624691 IP 10.0.0.8 > divmhlpt104804e.university.harvard.edu: ICMP echo reply, id 3637, seq 1, length 64
01:15:11.627707 IP divmhlpt104804e.university.harvard.edu > 10.0.0.9: ICMP echo request, id 3638, seq 1, length 64
01:15:11.627742 IP 10.0.0.9 > divmhlpt104804e.university.harvard.edu: ICMP echo reply, id 3638, seq 1, length 64
01:15:11.630949 IP divmhlpt104804e.university.harvard.edu > 10.0.0.10: ICMP echo request, id 3639, seq 1, length 64
01:15:11.630986 IP 10.0.0.10 > divmhlpt104804e.university.harvard.edu: ICMP echo reply, id 3639, seq 1, length 64
01:15:11.638574 IP divmhlpt104804e.university.harvard.edu > 10.0.0.13: ICMP echo request, id 3641, seq 1, length 64
01:15:11.638834 IP 10.0.0.13 > divmhlpt104804e.university.harvard.edu: ICMP echo reply, id 3641, seq 1, length 64
01:15:11.642483 IP divmhlpt104804e.university.harvard.edu > 10.0.0.14: ICMP echo request, id 3642, seq 1, length 64
01:15:11.642653 IP 10.0.0.14 > divmhlpt104804e.university.harvard.edu: ICMP echo reply, id 3642, seq 1, length 64
01:15:11.646375 IP divmhlpt104804e.university.harvard.edu > 10.0.0.15: ICMP echo request, id 3643, seq 1, length 64
01:15:11.646481 IP 10.0.0.15 > divmhlpt104804e.university.harvard.edu: ICMP echo reply, id 3643, seq 1, length 64
01:15:11.649999 IP divmhlpt104804e.university.harvard.edu > 10.0.0.16: ICMP echo request, id 3644, seq 1, length 64
01:15:11.650162 IP 10.0.0.16 > divmhlpt104804e.university.harvard.edu: ICMP echo reply, id 3644, seq 1, length 64
01:15:11.656057 IP hulmhlpt1383001.university.harvard.edu > taubman-3s-sw1-vl-1.net.harvard.edu: ICMP echo request, id 3645, seq 1, length 64
01:15:11.656131 IP taubman-3s-sw1-vl-1.net.harvard.edu > hulmhlpt1383001.university.harvard.edu: ICMP echo reply, id 3645, seq 1, length 64
01:15:11.659640 IP hulmhlpt1383001.university.harvard.edu > daisy.university.harvard.edu: ICMP echo request, id 3646, seq 1, length 64
01:15:11.659713 IP daisy.university.harvard.edu > hulmhlpt1383001.university.harvard.edu: ICMP echo reply, id 3646, seq 1, length 64
01:15:11.663166 IP hulmhlpt1383001.university.harvard.edu > aardvark.university.harvard.edu: ICMP echo request, id 3647, seq 1, length 64
01:15:11.663225 IP aardvark.university.harvard.edu > hulmhlpt1383001.university.harvard.edu: ICMP echo reply, id 3647, seq 1, length 64
01:15:11.666467 IP hulmhlpt1383001.university.harvard.edu > divwhlpt1048016.university.harvard.edu: ICMP echo request, id 3648, seq 1, length 64
01:15:11.666553 IP divwhlpt1048016.university.harvard.edu > hulmhlpt1383001.university.harvard.edu: ICMP echo reply, id 3648, seq 1, length 64
01:15:11.670058 IP hulmhlpt1383001.university.harvard.edu > 10.0.0.5: ICMP echo request, id 3649, seq 1, length 64
01:15:11.670123 IP 10.0.0.5 > hulmhlpt1383001.university.harvard.edu: ICMP echo reply, id 3649, seq 1, length 64
01:15:11.673594 IP hulmhlpt1383001.university.harvard.edu > 10.0.0.6: ICMP echo request, id 3650, seq 1, length 64
01:15:11.673716 IP 10.0.0.6 > hulmhlpt1383001.university.harvard.edu: ICMP echo reply, id 3650, seq 1, length 64
01:15:11.677279 IP hulmhlpt1383001.university.harvard.edu > hrewhlpt2100046.university.harvard.edu: ICMP echo request, id 3651, seq 1, length 64
01:15:11.677342 IP hrewhlpt2100046.university.harvard.edu > hulmhlpt1383001.university.harvard.edu: ICMP echo reply, id 3651, seq 1, length 64
01:15:11.680628 IP hulmhlpt1383001.university.harvard.edu > 10.0.0.8: ICMP echo request, id 3652, seq 1, length 64
01:15:11.680691 IP 10.0.0.8 > hulmhlpt1383001.university.harvard.edu: ICMP echo reply, id 3652, s