tcpdump: verbose output suppressed, use -v or -vv for full protocol decode
listening on s4203-eth2, link-type EN10MB (Ethernet), capture size 262144 bytes
01:15:11.031821 IP taubman-3s-sw1-vl-1.net.harvard.edu > hrewhlpt2100046.university.harvard.edu: ICMP echo request, id 3485, seq 1, length 64
01:15:11.032011 IP hrewhlpt2100046.university.harvard.edu > taubman-3s-sw1-vl-1.net.harvard.edu: ICMP echo reply, id 3485, seq 1, length 64
01:15:11.035863 IP taubman-3s-sw1-vl-1.net.harvard.edu > 10.0.0.8: ICMP echo request, id 3486, seq 1, length 64
01:15:11.036045 IP 10.0.0.8 > taubman-3s-sw1-vl-1.net.harvard.edu: ICMP echo reply, id 3486, seq 1, length 64
01:15:11.093758 IP daisy.university.harvard.edu > hrewhlpt2100046.university.harvard.edu: ICMP echo request, id 3500, seq 1, length 64
01:15:11.093787 IP hrewhlpt2100046.university.harvard.edu > daisy.university.harvard.edu: ICMP echo reply, id 3500, seq 1, length 64
01:15:11.097273 IP daisy.university.harvard.edu > 10.0.0.8: ICMP echo request, id 3501, seq 1, length 64
01:15:11.097294 IP 10.0.0.8 > daisy.university.harvard.edu: ICMP echo reply, id 3501, seq 1, length 64
01:15:11.159591 IP aardvark.university.harvard.edu > hrewhlpt2100046.university.harvard.edu: ICMP echo request, id 3515, seq 1, length 64
01:15:11.159620 IP hrewhlpt2100046.university.harvard.edu > aardvark.university.harvard.edu: ICMP echo reply, id 3515, seq 1, length 64
01:15:11.173354 IP aardvark.university.harvard.edu > 10.0.0.8: ICMP echo request, id 3516, seq 1, length 64
01:15:11.173378 IP 10.0.0.8 > aardvark.university.harvard.edu: ICMP echo reply, id 3516, seq 1, length 64
01:15:11.224188 IP divwhlpt1048016.university.harvard.edu > hrewhlpt2100046.university.harvard.edu: ICMP echo request, id 3530, seq 1, length 64
01:15:11.224407 IP hrewhlpt2100046.university.harvard.edu > divwhlpt1048016.university.harvard.edu: ICMP echo reply, id 3530, seq 1, length 64
01:15:11.228136 IP divwhlpt1048016.university.harvard.edu > 10.0.0.8: ICMP echo request, id 3531, seq 1, length 64
01:15:11.228268 IP 10.0.0.8 > divwhlpt1048016.university.harvard.edu: ICMP echo reply, id 3531, seq 1, length 64
01:15:11.278937 IP 10.0.0.5 > hrewhlpt2100046.university.harvard.edu: ICMP echo request, id 3545, seq 1, length 64
01:15:11.278978 IP hrewhlpt2100046.university.harvard.edu > 10.0.0.5: ICMP echo reply, id 3545, seq 1, length 64
01:15:11.283205 IP 10.0.0.5 > 10.0.0.8: ICMP echo request, id 3546, seq 1, length 64
01:15:11.283239 IP 10.0.0.8 > 10.0.0.5: ICMP echo reply, id 3546, seq 1, length 64
01:15:11.336100 IP 10.0.0.6 > hrewhlpt2100046.university.harvard.edu: ICMP echo request, id 3560, seq 1, length 64
01:15:11.336254 IP hrewhlpt2100046.university.harvard.edu > 10.0.0.6: ICMP echo reply, id 3560, seq 1, length 64
01:15:11.339888 IP 10.0.0.6 > 10.0.0.8: ICMP echo request, id 3561, seq 1, length 64
01:15:11.340009 IP 10.0.0.8 > 10.0.0.6: ICMP echo reply, id 3561, seq 1, length 64
01:15:11.372802 IP hrewhlpt2100046.university.harvard.edu > taubman-3s-sw1-vl-1.net.harvard.edu: ICMP echo request, id 3570, seq 1, length 64
01:15:11.372869 IP taubman-3s-sw1-vl-1.net.harvard.edu > hrewhlpt2100046.university.harvard.edu: ICMP echo reply, id 3570, seq 1, length 64
01:15:11.376373 IP hrewhlpt2100046.university.harvard.edu > daisy.university.harvard.edu: ICMP echo request, id 3571, seq 1, length 64
01:15:11.376456 IP daisy.university.harvard.edu > hrewhlpt2100046.university.harvard.edu: ICMP echo reply, id 3571, seq 1, length 64
01:15:11.379660 IP hrewhlpt2100046.university.harvard.edu > aardvark.university.harvard.edu: ICMP echo request, id 3572, seq 1, length 64
01:15:11.379722 IP aardvark.university.harvard.edu > hrewhlpt2100046.university.harvard.edu: ICMP echo reply, id 3572, seq 1, length 64
01:15:11.382835 IP hrewhlpt2100046.university.harvard.edu > divwhlpt1048016.university.harvard.edu: ICMP echo request, id 3573, seq 1, length 64
01:15:11.382896 IP divwhlpt1048016.university.harvard.edu > hrewhlpt2100046.university.harvard.edu: ICMP echo reply, id 3573, seq 1, length 64
01:15:11.386093 IP hrewhlpt2100046.university.harvard.edu > 10.0.0.5: ICMP echo request, id 3574, seq 1, length 64
01:15:11.386152 IP 10.0.0.5 > hrewhlpt2100046.university.harvard.edu: ICMP echo reply, id 3574, seq 1, length 64
01:15:11.389570 IP hrewhlpt2100046.university.harvard.edu > 10.0.0.6: ICMP echo request, id 3575, seq 1, length 64
01:15:11.389611 IP 10.0.0.6 > hrewhlpt2100046.university.harvard.edu: ICMP echo reply, id 3575, seq 1, length 64
01:15:11.397006 IP hrewhlpt2100046.university.harvard.edu > 10.0.0.9: ICMP echo request, id 3577, seq 1, length 64
01:15:11.397273 IP 10.0.0.9 > hrewhlpt2100046.university.harvard.edu: ICMP echo reply, id 3577, seq 1, length 64
01:15:11.400804 IP hrewhlpt2100046.university.harvard.edu > 10.0.0.10: ICMP echo request, id 3578, seq 1, length 64
01:15:11.400966 IP 10.0.0.10 > hrewhlpt2100046.university.harvard.edu: ICMP echo reply, id 3578, seq 1, length 64
01:15:11.404880 IP hrewhlpt2100046.university.harvard.edu > divmhlpt104804e.university.harvard.edu: ICMP echo request, id 3579, seq 1, length 64
01:15:11.404948 IP divmhlpt104804e.university.harvard.edu > hrewhlpt2100046.university.harvard.edu: ICMP echo reply, id 3579, seq 1, length 64
01:15:11.408560 IP hrewhlpt2100046.university.harvard.edu > hulmhlpt1383001.university.harvard.edu: ICMP echo request, id 3580, seq 1, length 64
01:15:11.408715 IP hulmhlpt1383001.university.harvard.edu > hrewhlpt2100046.university.harvard.edu: ICMP echo reply, id 3580, seq 1, length 64
01:15:11.412054 IP hrewhlpt2100046.university.harvard.edu > 10.0.0.13: ICMP echo request, id 3581, seq 1, length 64
01:15:11.412344 IP 10.0.0.13 > hrewhlpt2100046.university.harvard.edu: ICMP echo reply, id 3581, seq 1, length 64
01:15:11.415434 IP hrewhlpt2100046.university.harvard.edu > 10.0.0.14: ICMP echo request, id 3582, seq 1, length 64
01:15:11.415517 IP 10.0.0.14 > hrewhlpt2100046.university.harvard.edu: ICMP echo reply, id 3582, seq 1, length 64
01:15:11.422915 IP hrewhlpt2100046.university.harvard.edu > 10.0.0.15: ICMP echo request, id 3583, seq 1, length 64
01:15:11.422974 IP 10.0.0.15 > hrewhlpt2100046.university.harvard.edu: ICMP echo reply, id 3583, seq 1, length 64
01:15:11.426651 IP hrewhlpt2100046.university.harvard.edu > 10.0.0.16: ICMP echo request, id 3584, seq 1, length 64
01:15:11.426816 IP 10.0.0.16 > hrewhlpt2100046.university.harvard.edu: ICMP echo reply, id 3584, seq 1, length 64
01:15:11.431821 IP 10.0.0.8 > taubman-3s-sw1-vl-1.net.harvard.edu: ICMP echo request, id 3585, seq 1, length 64
01:15:11.431883 IP taubman-3s-sw1-vl-1.net.harvard.edu > 10.0.0.8: ICMP echo reply, id 3585, seq 1, length 64
01:15:11.435156 IP 10.0.0.8 > daisy.university.harvard.edu: ICMP echo request, id 3586, seq 1, length 64
01:15:11.435229 IP daisy.university.harvard.edu > 10.0.0.8: ICMP echo reply, id 3586, seq 1, length 64
01:15:11.438801 IP 10.0.0.8 > aardvark.university.harvard.edu: ICMP echo request, id 3587, seq 1, length 64
01:15:11.438867 IP aardvark.university.harvard.edu > 10.0.0.8: ICMP echo reply, id 3587, seq 1, length 64
01:15:11.442097 IP 10.0.0.8 > divwhlpt1048016.university.harvard.edu: ICMP echo request, id 3588, seq 1, length 64
01:15:11.442162 IP divwhlpt1048016.university.harvard.edu > 10.0.0.8: ICMP echo reply, id 3588, seq 1, length 64
01:15:11.445036 IP 10.0.0.8 > 10.0.0.5: ICMP echo request, id 3589, seq 1, length 64
01:15:11.445074 IP 10.0.0.5 > 10.0.0.8: ICMP echo reply, id 3589, seq 1, length 64
01:15:11.448801 IP 10.0.0.8 > 10.0.0.6: ICMP echo request, id 3590, seq 1, length 64
01:15:11.448843 IP 10.0.0.6 > 10.0.0.8: ICMP echo reply, id 3590, seq 1, length 64
01:15:11.455880 IP 10.0.0.8 > 10.0.0.9: ICMP echo request, id 3592, seq 1, length 64
01:15:11.456209 IP 10.0.0.9 > 10.0.0.8: ICMP echo reply, id 3592, seq 1, length 64
01:15:11.459812 IP 10.0.0.8 > 10.0.0.10: ICMP echo request, id 3593, seq 1, length 64
01:15:11.459972 IP 10.0.0.10 > 10.0.0.8: ICMP echo reply, id 3593, seq 1, length 64
01:15:11.463314 IP 10.0.0.8 > divmhlpt104804e.university.harvard.edu: ICMP echo request, id 3594, seq 1, length 64
01:15:11.463663 IP divmhlpt104804e.university.harvard.edu > 10.0.0.8: ICMP echo reply, id 3594, seq 1, length 64
01:15:11.467160 IP 10.0.0.8 > hulmhlpt1383001.university.harvard.edu: ICMP echo request, id 3595, seq 1, length 64
01:15:11.467325 IP hulmhlpt1383001.university.harvard.edu > 10.0.0.8: ICMP echo reply, id 3595, seq 1, length 64
01:15:11.470771 IP 10.0.0.8 > 10.0.0.13: ICMP echo request, id 3596, seq 1, length 64
01:15:11.471540 IP 10.0.0.13 > 10.0.0.8: ICMP echo reply, id 3596, seq 1, length 64
01:15:11.474667 IP 10.0.0.8 > 10.0.0.14: ICMP echo request, id 3597, seq 1, length 64
01:15:11.474977 IP 10.0.0.14 > 10.0.0.8: ICMP echo reply, id 3597, seq 1, length 64
01:15:11.478513 IP 10.0.0.8 > 10.0.0.15: ICMP echo request, id 3598, seq 1, length 64
01:15:11.478890 IP 10.0.0.15 > 10.0.0.8: ICMP echo reply, id 3598, seq 1, length 64
01:15:11.482448 IP 10.0.0.8 > 10.0.0.16: ICMP echo request, id 3599, seq 1, length 64
01:15:11.482604 IP 10.0.0.16 > 10.0.0.8: ICMP echo reply, id 3599, seq 1, length 64
01:15:11.508357 IP 10.0.0.9 > hrewhlpt2100046.university.harvard.edu: ICMP echo request, id 3606, seq 1, length 64
01:15:11.508382 IP hrewhlpt2100046.university.harvard.edu > 10.0.0.9: ICMP echo reply, id 3606, seq 1, length 64
01:15:11.511488 IP 10.0.0.9 > 10.0.0.8: ICMP echo request, id 3607, seq 1, length 64
01:15:11.511508 IP 10.0.0.8 > 10.0.0.9: ICMP echo reply, id 3607, seq 1, length 64
01:15:11.567719 IP 10.0.0.10 > hrewhlpt2100046.university.harvard.edu: ICMP echo request, id 3621, seq 1, length 64
01:15:11.567741 IP hrewhlpt2100046.university.harvard.edu > 10.0.0.10: ICMP echo reply, id 3621, seq 1, length 64
01:15:11.571502 IP 10.0.0.10 > 10.0.0.8: ICMP echo request, id 3622, seq 1, length 64
01:15:11.571557 IP 10.0.0.8 > 10.0.0.10: ICMP echo reply, id 3622, seq 1, length 64
01:15:11.621483 IP divmhlpt104804e.university.harvard.edu > hrewhlpt2100046.university.harvard.edu: ICMP echo request, id 3636, seq 1, length 64
01:15:11.621507 IP hrewhlpt2100046.university.harvard.edu > divmhlpt104804e.university.harvard.edu: ICMP echo reply, id 3636, seq 1, length 64
01:15:11.624638 IP divmhlpt104804e.university.harvard.edu > 10.0.0.8: ICMP echo request, id 3637, seq 1, length 64
01:15:11.624674 IP 10.0.0.8 > divmhlpt104804e.university.harvard.edu: ICMP echo reply, id 3637, seq 1, length 64
01:15:11.677304 IP hulmhlpt1383001.university.harvard.edu > hrewhlpt2100046.university.harvard.edu: ICMP echo request, id 3651, seq 1, length 64
01:15:11.677328 IP hrewhlpt2100046.university.harvard.edu > hulmhlpt1383001.university.harvard.edu: ICMP echo reply, id 3651, seq 1, length 64
01:15:11.680652 IP hulmhlpt1383001.university.harvard.edu > 10.0.0.8: ICMP echo request, id 3652, seq 1, length 64
01:15:11.680676 IP 10.0.0.8 > hulmhlpt1383001.university.harvard.edu: ICMP echo reply, id 3652, seq 1, length 64
01:15:11.734269 IP 10.0.0.13 > hrewhlpt2100046.university.harvard.edu: ICMP echo request, id 3666, seq 1, length 64
01:15:11.734293 IP hrewhlpt2100046.university.harvard.edu > 10.0.0.13: ICMP echo reply, id 3666, seq 1, length 64
01:15:11.737946 IP 10.0.0.13 > 10.0.0.8: ICMP echo request, id 3667, seq 1, length 64
01:15:11.737978 IP 10.0.0.8 > 10.0.0.13: ICMP echo reply, id 3667, seq 1, length 64
01:15:11.789038 IP 10.0.0.14 > hrewhlpt2100046.university.harvard.edu: ICMP echo request, id 3681, seq 1, length 64
01:15:11.789068 IP hrewhlpt2100046.university.harvard.edu > 10.0.0.14: ICMP echo reply, id 3681, seq 1, length 64
01:15:11.792217 IP 10.0.0.14 > 10.0.0.8: ICMP echo request, id 3682, seq 1, length 64
01:15:11.792252 IP 10.0.0.8 > 10.0.0.14: ICMP echo reply, id 3682, seq 1, length 64
01:15:11.846122 IP 10.0.0.15 > hrewhlpt2100046.university.harvard.edu: ICMP echo request, id 3696, seq 1, length 64
01:15:11.846147 IP hrewhlpt2100046.university.harvard.edu > 10.0.0.15: ICMP echo reply, id 3696, seq 1, length 64
01:15:11.849564 IP 10.0.0.15 > 10.0.0.8: ICMP echo request, id 3697, seq 1, length 64
01:15:11.849587 IP 10.0.0.8 > 10.0.0.15: ICMP echo reply, id 3697, seq 1, length 64
01:15:11.900360 IP 10.0.0.16 > hrewhlpt2100046.university.harvard.edu: ICMP echo request, id 3711, seq 1, length 64
01:15:11.900384 IP hrewhlpt2100046.university.harvard.edu > 10.0.0.16: ICMP echo reply, id 3711, seq 1, length 64
01:15:11.903647 IP 10.0.0.16 > 10.0.0.8: ICMP echo                                                                                                                                                                                                                                                                                                                                                                                                                                                                                                                                                                                                                                                                                                                                                                                                                                                                                                                                                                                                                                                                                                                                                                                                                                                                                                                                                                                                                                                                                                                                                                                                                                                                                                                                                                                                                                                                                                                                                                                                                                                                                                                                                                                                                                                                                                                                                                                                                                                                                                                                                                                                                                                                                                                                                                                                                                                                                                                                                                                                                                                                                                                                                                                                                                                                                                                                                                                                                                                                                                                                                                                                                                                                                                                                                                                                                                                                                                                                                                                                                                                                                                                                                                                                                                                                                                                                                                                                                                                                                                                                                                                                                                                                                                                                                                                                                                                                                                                                                                                                                                                                                                                                                                                                                                                                                                                                                                                                                                                                                                                                                                                                                                                                                                                                                                                                                                                                                                                                                                                                                                                                                                                                                                                                                                                                                                                                                                                                                                                                                                                                                                                                                                                                                                                                                                                                                                                                                                                                                                                                                                                                                                                                                                                                                                                                                                                                                                                                                                                                                                                                                                                                                                                                                                                                                                                                                                                                                                                                                                                                                                                                                                                                                                                                                                                                                                                                                                                                                                                                                                                                rsity.harvard.edu tell 10.0.0.13, length 28
01:14:56.387560 ARP, Request who-has hrewhlpt2100046.university.harvard.edu tell hulmhlpt1383001.university.harvard.edu, length 28
01:14:56.387572 ARP, Request who-has hrewhlpt2100046.university.harvard.edu tell divmhlpt104804e.university.harvard.edu, length 28
01:14:56.387584 ARP, Request who-has hrewhlpt2100046.university.harvard.edu tell 10.0.0.10, length 28
01:14:56.387596 ARP, Request who-has hrewhlpt2100046.university.harvard.edu tell 10.0.0.9, length 28
01:14:56.388470 ARP, Reply 10.0.0.6 is-at 4a:a7:68:ed:97:77 (oui Unknown), length 28
01:14:56.388483 ARP, Reply 10.0.0.6 is-at 4a:a7:68:ed:97:77 (oui Unknown), length 28
01:14:56.388561 ARP, Reply 10.0.0.5 is-at 0a:bb:ee:71:6c:d5 (oui Unknown), length 28
01:14:56.388573 ARP, Reply 10.0.0.5 is-at 0a:bb:ee:71:6c:d5 (oui Unknown), length 28
01:14:56.388584 ARP, Reply hrewhlpt2100046.university.harvard.edu is-at 32:c2:75:be:18:1b (oui Unknown), length 28
01:14:56.388593 ARP, Reply hrewhlpt2100046.university.harvard.edu is-at 32:c2:75:be:18:1b (oui Unknown), length 28
01:14:56.388602 ARP, Reply hrewhlpt2100046.university.harvard.edu is-at 32:c2:75:be:18:1b (oui Unknown), length 28
01:14:56.388612 ARP, Reply hrewhlpt2100046.university.harvard.edu is-at 32:c2:75:be:18:1b (oui Unknown), length 28
01:14:56.388682 ARP, Reply hrewhlpt2100046.university.harvard.edu is-at 32:c2:75:be:18:1b (oui Unknown), length 28
01:14:56.388690 ARP, Reply hrewhlpt2100046.university.harvard.edu is-at 32:c2:75:be:18:1b (oui Unknown), length 28
01:14:56.388698 ARP, Reply hrewhlpt2100046.university.harvard.edu is-at 32:c2:75:be:18:1b (oui Unknown), length 28
01:14:56.388706 ARP, Reply hrewhlpt2100046.university.harvard.edu is-at 32:c2:75:be:18:1b (oui Unknown), length 28
01:14:56.643898 ARP, Request who-has 10.0.0.8 tell 10.0.0.16, length 28
01:14:56.643916 ARP, Request who-has 10.0.0.8 tell 10.0.0.15, length 28
01:14:56.643932 ARP, Request who-has 10.0.0.8 tell 10.0.0.14, length 28
01:14:56.643948 ARP, Request who-has 10.0.0.8 tell 10.0.0.13, length 28
01:14:56.643963 ARP, Request who-has 10.0.0.8 tell hulmhlpt1383001.university.harvard.edu, length 28
01:14:56.643979 ARP, Request who-has 10.0.0.8 tell divmhlpt104804e.university.harvard.edu, length 28
01:14:56.643995 ARP, Request who-has 10.0.0.8 tell 10.0.0.10, length 28
01:14:56.644011 ARP, Request who-has 10.0.0.8 tell 10.0.0.9, length 28
01:14:56.644482 ARP, Reply 10.0.0.8 is-at f6:0e:01:97:39:4d (oui Unknown), length 28
01:14:56.644494 ARP, Reply 10.0.0.8 is-at f6:0e:01:97:39:4d (oui Unknown), length 28
01:14:56.644505 ARP, Reply 10.0.0.8 is-at f6:0e:01:97:39:4d (oui Unknown), length 28
01:14:56.644515 ARP, Reply 10.0.0.8 is-at f6:0e:01:97:39:4d (oui Unknown), length 28
01:14:56.644526 ARP, Reply 10.0.0.8 is-at f6:0e:01:97:39:4d (oui Unknown), length 28
01:14:56.644630 ARP, Reply 10.0.0.8 is-at f6:0e:01:97:39:4d (oui Unknown), length 28
01:14:56.644645 ARP, Reply 10.0.0.8 is-at f6:0e:01:97:39:4d (oui Unknown), length 28
01:14:56.644656 ARP, Reply 10.0.0.8 is-at f6:0e:01:97:39:4d (oui Unknown), length 28
01:14:59.714736 IP6 mininet > ip6-allrouters: ICMP6, router solicitation, length 16
01:15:01.777955 IP6 mininet > ip6-allrouters: ICMP6, router solicitation, length 16
01:15:11.031821 IP taubman-3s-sw1-vl-1.net.harvard.edu > hrewhlpt2100046.university.harvard.edu: ICMP echo request, id 3485, seq 1, length 64
01:15:11.032011 IP hrewhlpt2100046.university.harvard.edu > taubman-3s-sw1-vl-1.net.harvard.edu: ICMP echo reply, id 3485, seq 1, length 64
01:15:11.035863 IP taubman-3s-sw1-vl-1.net.harvard.edu > 10.0.0.8: ICMP echo request, id 3486, seq 1, length 64
01:15:11.036045 IP 10.0.0.8 > taubman-3s-sw1-vl-1.net.harvard.edu: ICMP echo reply, id 3486, seq 1, length 64
01:15:11.093758 IP daisy.university.harvard.edu > hrewhlpt2100046.university.harvard.edu: ICMP echo request, id 3500, seq 1, length 64
01:15:11.093787 IP hrewhlpt2100046.university.harvard.edu > daisy.university.harvard.edu: ICMP echo reply, id 3500, seq 1, length 64
01:15:11.097273 IP daisy.university.harvard.edu > 10.0.0.8: ICMP echo request, id 3501, seq 1, length 64
01:15:11.097294 IP 10.0.0.8 > daisy.university.harvard.edu: ICMP echo reply, id 3501, seq 1, length 64
01:15:11.159591 IP aardvark.university.harvard.edu > hrewhlpt2100046.university.harvard.edu: ICMP echo request, id 3515, seq 1, length 64
01:15:11.159620 IP hrewhlpt2100046.university.harvard.edu > aardvark.university.harvard.edu: ICMP echo reply, id 3515, seq 1, length 64
01:15:11.173354 IP aardvark.university.harvard.edu > 10.0.0.8: ICMP echo request, id 3516, seq 1, length 64
01:15:11.173378 IP 10.0.0.8 > aardvark.university.harvard.edu: ICMP echo reply, id 3516, seq 1, length 64
01:15:11.224188 IP divwhlpt1048016.university.harvard.edu > hrewhlpt2100046.university.harvard.edu: ICMP echo request, id 3530, seq 1, length 64
01:15:11.224407 IP hrewhlpt2100046.university.harvard.edu > divwhlpt1048016.university.harvard.edu: ICMP echo reply, id 3530, seq 1, length 64
01:15:11.228136 IP divwhlpt1048016.university.harvard.edu > 10.0.0.8: ICMP echo request, id 3531, seq 1, length 64
01:15:11.228268 IP 10.0.0.8 > divwhlpt1048016.university.harvard.edu: ICMP echo reply, id 3531, seq 1, length 64
01:15:11.278937 IP 10.0.0.5 > hrewhlpt2100046.university.harvard.edu: ICMP echo request, id 3545, seq 1, length 64
01:15:11.278978 IP hrewhlpt2100046.university.harvard.edu > 10.0.0.5: ICMP echo reply, id 3545, seq 1, length 64
01:15:11.283205 IP 10.0.0.5 > 10.0.0.8: ICMP echo request, id 3546, seq 1, length 64
01:15:11.283239 IP 10.0.0.8 > 10.0.0.5: ICMP echo reply, id 3546, seq 1, length 64
01:15:11.336100 IP 10.0.0.6 > hrewhlpt2100046.university.harvard.edu: ICMP echo request, id 3560, seq 1, length 64
01:15:11.336254 IP hrewhlpt2100046.university.harvard.edu > 10.0.0.6: ICMP echo reply, id 3560, seq 1, length 64
01:15:11.339888 IP 10.0.0.6 > 10.0.0.8: ICMP echo request, id 3561, seq 1, length 64
01:15:11.340009 IP 10.0.0.8 > 10.0.0.6: ICMP echo reply, id 3561, seq 1, length 64
01:15:11.372802 IP hrewhlpt2100046.university.harvard.edu > taubman-3s-sw1-vl-1.net.harvard.edu: ICMP echo request, id 3570, seq 1, length 64
01:15:11.372869 IP taubman-3s-sw1-vl-1.net.harvard.edu > hrewhlpt2100046.university.harvard.edu: ICMP echo reply, id 3570, seq 1, length 64
01:15:11.376373 IP hrewhlpt2100046.university.harvard.edu > daisy.university.harvard.edu: ICMP echo request, id 3571, seq 1, length 64
01:15:11.376456 IP daisy.university.harvard.edu > hrewhlpt2100046.university.harvard.edu: ICMP echo reply, id 3571, seq 1, length 64
01:15:11.379660 IP hrewhlpt2100046.university.harvard.edu > aardvark.university.harvard.edu: ICMP echo request, id 3572, seq 1, length 64
01:15:11.379722 IP aardvark.university.harvard.edu > hrewhlpt2100046.university.harvard.edu: ICMP echo reply, id 3572, seq 1, length 64
01:15:11.382835 IP hrewhlpt2100046.university.harvard.edu > divwhlpt1048016.university.harvard.edu: ICMP echo request, id 3573, seq 1, length 64
01:15:11.382896 IP divwhlpt1048016.university.harvard.edu > hrewhlpt2100046.university.harvard.edu: ICMP echo reply, id 3573, seq 1, length 64
01:15:11.386093 IP hrewhlpt2100046.university.harvard.edu > 10.0.0.5: ICMP echo request, id 3574, seq 1, length 64
01:15:11.386152 IP 10.0.0.5 > hrewhlpt2100046.university.harvard.edu: ICMP echo reply, id 3574, seq 1, length 64
01:15:11.389570 IP hrewhlpt2100046.university.harvard.edu > 10.0.0.6: ICMP echo request, id 3575, seq 1, length 64
01:15:11.389611 IP 10.0.0.6 > hrewhlpt2100046.university.harvard.edu: ICMP echo reply, id 3575, seq 1, length 64
01:15:11.397006 IP hrewhlpt2100046.university.harvard.edu > 10.0.0.9: ICMP echo request, id 3577, seq 1, length 64
01:15:11.397273 IP 10.0.0.9 > hrewhlpt2100046.university.harvard.edu: ICMP echo reply, id 3577, seq 1, length 64
01:15:11.400804 IP hrewhlpt2100046.university.harvard.edu > 10.0.0.10: ICMP echo request, id 3578, seq 1, length 64
01:15:11.400966 IP 10.0.0.10 > hrewhlpt2100046.university.harvard.edu: ICMP echo reply, id 3578, seq 1, length 64
01:15:11.404880 IP hrewhlpt2100046.university.harvard.edu > divmhlpt104804e.university.harvard.edu: ICMP echo request, id 3579, seq 1, length 64
01:15:11.404948 IP divmhlpt104804e.university.harvard.edu > hrewhlpt2100046.university.harvard.edu: ICMP echo reply, id 3579, seq 1, length 64
01:15:11.408560 IP hrewhlpt2100046.university.harvard.edu > hulmhlpt1383001.university.harvard.edu: ICMP echo request, id 3580, seq 1, length 64
01:15:11.408715 IP hulmhlpt1383001.university.harvard.edu > hrewhlpt2100046.university.harvard.edu: ICMP echo reply, id 3580, seq 1, length 64
01:15:11.412054 IP hrewhlpt2100046.university.harvard.edu > 10.0.0.13: ICMP echo request, id 3581, seq 1, length 64
01:15:11.412344 IP 10.0.0.13 > hrewhlpt2100046.university.harvard.edu: ICMP echo reply, id 3581, seq 1, length 64
01:15:11.415434 IP hrewhlpt2100046.university.harvard.edu > 10.0.0.14: ICMP echo request, id 3582, seq 1, length 64
01:15:11.415517 IP 10.0.0.14 > hrewhlpt2100046.university.harvard.edu: ICMP echo reply, id 3582, seq 1, length 64
01:15:11.422915 IP hrewhlpt2100046.university.harvard.edu > 10.0.0.15: ICMP echo request, id 3583, seq 1, length 64
01:15:11.422974 IP 10.0.0.15 > hrewhlpt2100046.university.harvard.edu: ICMP echo reply, id 3583, seq 1, length 64
01:15:11.426651 IP hrewhlpt2100046.university.harvard.edu > 10.0.0.16: ICMP echo request, id 3584, seq 1, length 64
01:15:11.426816 IP 10.0.0.16 > hrewhlpt2100046.university.harvard.edu: ICMP echo reply, id 3584, seq 1, length 64
01:15:11.431821 IP 10.0.0.8 > taubman-3s-sw1-vl-1.net.harvard.edu: ICMP echo request, id 3585, seq 1, length 64
01:15:11.431883 IP taubman-3s-sw1-vl-1.net.harvard.edu > 10.0.0.8: ICMP echo reply, id 3585, seq 1, length 64
01:15:11.435156 IP 10.0.0.8 > daisy.university.harvard.edu: ICMP echo request, id 3586, seq 1, length 64
01:15:11.435229 IP daisy.university.harvard.edu > 10.0.0.8: ICMP echo reply, id 3586, seq 1, length 64
01:15:11.438801 IP 10.0.0.8 > aardvark.university.harvard.edu: ICMP echo request, id 3587, seq 1, length 64
01:15:11.438867 IP aardvark.university.harvard.edu > 10.0.0.8: ICMP echo reply, id 3587, seq 1, length 64
01:15:11.442097 IP 10.0.0.8 > divwhlpt1048016.university.harvard.edu: ICMP echo request, id 3588, seq 1, length 64
01:15:11.442162 IP divwhlpt1048016.university.harvard.edu > 10.0.0.8: ICMP echo reply, id 3588, seq 1, length 64
01:15:11.445036 IP 10.0.0.8 > 10.0.0.5: ICMP echo request, id 3589, seq 1, length 64
01:15:11.445074 IP 10.0.0.5 > 10.0.0.8: ICMP echo reply, id 3589, seq 1, length 64
01:15:11.448801 IP 10.0.0.8 > 10.0.0.6: ICMP echo request, id 3590, seq 1, length 64
01:15:11.448843 IP 10.0.0.6 > 10.0.0.8: ICMP echo reply, id 3590, seq 1, length 64
01:15:11.455880 IP 10.0.0.8 > 10.0.0.9: ICMP echo request, id 3592, seq 1, length 64
01:15:11.456209 IP 10.0.0.9 > 10.0.0.8: ICMP echo reply, id 3592, seq 1, length 64
01:15:11.459812 IP 10.0.0.8 > 10.0.0.10: ICMP echo request, id 3593, seq 1, length 64
01:15:11.459972 IP 10.0.0.10 > 10.0.0.8: ICMP echo reply, id 3593, seq 1, length 64
01:15:11.463314 IP 10.0.0.8 > divmhlpt104804e.university.harvard.edu: ICMP echo request, id 3594, seq 1, length 64
01:15:11.463663 IP divmhlpt104804e.university.harvard.edu > 10.0.0.8: ICMP echo reply, id 3594, seq 1, length 64
01:15:11.467160 IP 10.0.0.8 > hulmhlpt1383001.university.harvard.edu: ICMP echo request, id 3595, seq 1, length 64
01:15:11.467325 IP hulmhlpt1383001.university.harvard.edu > 10.0.0.8: ICMP echo reply, id 3595, seq 1, length 64
01:15:11.470771 IP 10.0.0.8 > 10.0.0.13: ICMP echo request, id 3596, seq 1, length 64
01:15:11.471540 IP 10.0.0.13 > 10.0.0.8: ICMP echo reply, id 3596, seq 1, length 64
01:15:11.474667 IP 10.0.0.8 > 10.0.0.14: ICMP echo request, id 3597, seq 1, length 64
01:15:11.474977 IP 10.0.0.14 > 10.0.0.8: ICMP echo reply, id 3597, seq 1, length 64
01:15:11.478513 IP 10.0.0.8 > 10.0.0.15: ICMP echo request, id 3598, seq 1, length 64
01:15:11.478890 IP 10.0.0.15 > 10.0.0.8: ICMP echo reply, id 3598, seq 1, length 64
01:15:11.482448 IP 10.0.0.8 > 10.0.0.16: ICMP echo request, id 3599, seq 1, length 64
01:15:11.482604 IP 10.0.0.16 > 10.0.0.8: ICMP echo reply, id 3599, seq 1, length 64
01:15:11.508357 IP 10.0.0.9 > hrewhlpt2100046.university.h