tcpdump: verbose output suppressed, use -v or -vv for full protocol decode
listening on s4205-eth1, link-type EN10MB (Ethernet), capture size 262144 bytes
23:42:34.460231 IP6 mininet > ip6-allrouters: ICMP6, router solicitation, length 16
23:42:57.788553 ARP, Request who-has 10.0.0.9 tell rfctest.harvard.edu, length 28
23:42:57.788791 ARP, Reply 10.0.0.9 is-at 8a:c8:67:01:92:b9 (oui Unknown), length 28
23:42:57.789287 IP rfctest.harvard.edu > 10.0.0.9: ICMP echo request, id 21259, seq 1, length 64
23:42:57.789501 IP 10.0.0.9 > rfctest.harvard.edu: ICMP echo reply, id 21259, seq 1, length 64
23:42:57.794326 ARP, Request who-has 10.0.0.10 tell rfctest.harvard.edu, length 28
23:42:57.794715 ARP, Reply 10.0.0.10 is-at 9a:60:b4:e8:36:04 (oui Unknown), length 28
23:42:57.795035 IP rfctest.harvard.edu > 10.0.0.10: ICMP echo request, id 21260, seq 1, length 64
23:42:57.795304 IP 10.0.0.10 > rfctest.harvard.edu: ICMP echo reply, id 21260, seq 1, length 64
23:42:57.881545 ARP, Request who-has 10.0.0.9 tell paine-b-sw2.net.harvard.edu, length 28
23:42:57.881733 ARP, Reply 10.0.0.9 is-at 8a:c8:67:01:92:b9 (oui Unknown), length 28
23:42:57.882150 IP paine-b-sw2.net.harvard.edu > 10.0.0.9: ICMP echo request, id 21274, seq 1, length 64
23:42:57.882183 IP 10.0.0.9 > paine-b-sw2.net.harvard.edu: ICMP echo reply, id 21274, seq 1, length 64
23:42:57.887189 ARP, Request who-has 10.0.0.10 tell paine-b-sw2.net.harvard.edu, length 28
23:42:57.887399 ARP, Reply 10.0.0.10 is-at 9a:60:b4:e8:36:04 (oui Unknown), length 28
23:42:57.887484 IP paine-b-sw2.net.harvard.edu > 10.0.0.10: ICMP echo request, id 21275, seq 1, length 64
23:42:57.887519 IP 10.0.0.10 > paine-b-sw2.net.harvard.edu: ICMP echo reply, id 21275, seq 1, length 64
23:42:57.961771 ARP, Request who-has 10.0.0.9 tell hamwhwks0643000.university.harvard.edu, length 28
23:42:57.961959 ARP, Reply 10.0.0.9 is-at 8a:c8:67:01:92:b9 (oui Unknown), length 28
23:42:57.962280 IP hamwhwks0643000.university.harvard.edu > 10.0.0.9: ICMP echo request, id 21289, seq 1, length 64
23:42:57.962311 IP 10.0.0.9 > hamwhwks0643000.university.harvard.edu: ICMP echo reply, id 21289, seq 1, length 64
23:42:57.967111 ARP, Request who-has 10.0.0.10 tell hamwhwks0643000.university.harvard.edu, length 28
23:42:57.967276 ARP, Reply 10.0.0.10 is-at 9a:60:b4:e8:36:04 (oui Unknown), length 28
23:42:57.967353 IP hamwhwks0643000.university.harvard.edu > 10.0.0.10: ICMP echo request, id 21290, seq 1, length 64
23:42:57.967380 IP 10.0.0.10 > hamwhwks0643000.university.harvard.edu: ICMP echo reply, id 21290, seq 1, length 64
23:42:58.047057 ARP, Request who-has 10.0.0.9 tell divwhlpt1048016.university.harvard.edu, length 28
23:42:58.047313 ARP, Reply 10.0.0.9 is-at 8a:c8:67:01:92:b9 (oui Unknown), length 28
23:42:58.047623 IP divwhlpt1048016.university.harvard.edu > 10.0.0.9: ICMP echo request, id 21304, seq 1, length 64
23:42:58.047652 IP 10.0.0.9 > divwhlpt1048016.university.harvard.edu: ICMP echo reply, id 21304, seq 1, length 64
23:42:58.053874 ARP, Request who-has 10.0.0.10 tell divwhlpt1048016.university.harvard.edu, length 28
23:42:58.054035 ARP, Reply 10.0.0.10 is-at 9a:60:b4:e8:36:04 (oui Unknown), length 28
23:42:58.054105 IP divwhlpt1048016.university.harvard.edu > 10.0.0.10: ICMP echo request, id 21305, seq 1, length 64
23:42:58.054131 IP 10.0.0.10 > divwhlpt1048016.university.harvard.edu: ICMP echo reply, id 21305, seq 1, length 64
23:42:58.142330 ARP, Request who-has 10.0.0.9 tell 10.0.0.5, length 28
23:42:58.142463 ARP, Reply 10.0.0.9 is-at 8a:c8:67:01:92:b9 (oui Unknown), length 28
23:42:58.143020 IP 10.0.0.5 > 10.0.0.9: ICMP echo request, id 21319, seq 1, length 64
23:42:58.143049 IP 10.0.0.9 > 10.0.0.5: ICMP echo reply, id 21319, seq 1, length 64
23:42:58.147681 ARP, Request who-has 10.0.0.10 tell 10.0.0.5, length 28
23:42:58.147812 ARP, Reply 10.0.0.10 is-at 9a:60:b4:e8:36:04 (oui Unknown), length 28
23:42:58.148100 IP 10.0.0.5 > 10.0.0.10: ICMP echo request, id 21320, seq 1, length 64
23:42:58.148131 IP 10.0.0.10 > 10.0.0.5: ICMP echo reply, id 21320, seq 1, length 64
23:42:58.233976 ARP, Request who-has 10.0.0.9 tell 10.0.0.6, length 28
23:42:58.234132 ARP, Reply 10.0.0.9 is-at 8a:c8:67:01:92:b9 (oui Unknown), length 28
23:42:58.234438 IP 10.0.0.6 > 10.0.0.9: ICMP echo request, id 21334, seq 1, length 64
23:42:58.234465 IP 10.0.0.9 > 10.0.0.6: ICMP echo reply, id 21334, seq 1, length 64
23:42:58.239084 ARP, Request who-has 10.0.0.10 tell 10.0.0.6, length 28
23:42:58.239304 ARP, Reply 10.0.0.10 is-at 9a:60:b4:e8:36:04 (oui Unknown), length 28
23:42:58.239385 IP 10.0.0.6 > 10.0.0.10: ICMP echo request, id 21335, seq 1, length 64
23:42:58.239413 IP 10.0.0.10 > 10.0.0.6: ICMP echo reply, id 21335, seq 1, length 64
23:42:58.318137 ARP, Request who-has 10.0.0.9 tell hrewhlpt2100046.university.harvard.edu, length 28
23:42:58.318274 ARP, Reply 10.0.0.9 is-at 8a:c8:67:01:92:b9 (oui Unknown), length 28
23:42:58.319001 IP hrewhlpt2100046.university.harvard.edu > 10.0.0.9: ICMP echo request, id 21349, seq 1, length 64
23:42:58.319035 IP 10.0.0.9 > hrewhlpt2100046.university.harvard.edu: ICMP echo reply, id 21349, seq 1, length 64
23:42:58.328198 ARP, Request who-has 10.0.0.10 tell hrewhlpt2100046.university.harvard.edu, length 28
23:42:58.328356 ARP, Reply 10.0.0.10 is-at 9a:60:b4:e8:36:04 (oui Unknown), length 28
23:42:58.328693 IP hrewhlpt2100046.university.harvard.edu > 10.0.0.10: ICMP echo request, id 21350, seq 1, length 64
23:42:58.328725 IP 10.0.0.10 > hrewhlpt2100046.university.harvard.edu: ICMP echo reply, id 21350, seq 1, length 64
23:42:58.397135 ARP, Request who-has 10.0.0.9 tell 10.0.0.8, length 28
23:42:58.397283 ARP, Reply 10.0.0.9 is-at 8a:c8:67:01:92:b9 (oui Unknown), length 28
23:42:58.397716 IP 10.0.0.8 > 10.0.0.9: ICMP echo request, id 21364, seq 1, length 64
23:42:58.397849 IP 10.0.0.9 > 10.0.0.8: ICMP echo reply, id 21364, seq 1, length 64
23:42:58.403140 ARP, Request who-has 10.0.0.10 tell 10.0.0.8, length 28
23:42:58.403396 ARP, Reply 10.0.0.10 is-at 9a:60:b4:e8:36:04 (oui Unknown), length 28
23:42:58.403659 IP 10.0.0.8 > 10.0.0.10: ICMP echo request, id 21365, seq 1, length 64
23:42:58.403834 IP 10.0.0.10 > 10.0.0.8: ICMP echo reply, id 21365, seq 1, length 64
23:42:58.443927 IP 10.0.0.9 > rfctest.harvard.edu: ICMP echo request, id 21372, seq 1, length 64
23:42:58.443999 IP rfctest.harvard.edu > 10.0.0.9: ICMP echo reply, id 21372, seq 1, length 64
23:42:58.447932 IP 10.0.0.9 > paine-b-sw2.net.harvard.edu: ICMP echo request, id 21373, seq 1, length 64
23:42:58.448006 IP paine-b-sw2.net.harvard.edu > 10.0.0.9: ICMP echo reply, id 21373, seq 1, length 64
23:42:58.451928 IP 10.0.0.9 > hamwhwks0643000.university.harvard.edu: ICMP echo request, id 21374, seq 1, length 64
23:42:58.452013 IP hamwhwks0643000.university.harvard.edu > 10.0.0.9: ICMP echo reply, id 21374, seq 1, length 64
23:42:58.456627 IP 10.0.0.9 > divwhlpt1048016.university.harvard.edu: ICMP echo request, id 21375, seq 1, length 64
23:42:58.456705 IP divwhlpt1048016.university.harvard.edu > 10.0.0.9: ICMP echo reply, id 21375, seq 1, length 64
23:42:58.460706 IP 10.0.0.9 > 10.0.0.5: ICMP echo request, id 21376, seq 1, length 64
23:42:58.460787 IP 10.0.0.5 > 10.0.0.9: ICMP echo reply, id 21376, seq 1, length 64
23:42:58.465086 IP 10.0.0.9 > 10.0.0.6: ICMP echo request, id 21377, seq 1, length 64
23:42:58.465160 IP 10.0.0.6 > 10.0.0.9: ICMP echo reply, id 21377, seq 1, length 64
23:42:58.468886 IP 10.0.0.9 > hrewhlpt2100046.university.harvard.edu: ICMP echo request, id 21378, seq 1, length 64
23:42:58.468963 IP hrewhlpt2100046.university.harvard.edu > 10.0.0.9: ICMP echo reply, id 21378, seq 1, length 64
23:42:58.473311 IP 10.0.0.9 > 10.0.0.8: ICMP echo request, id 21379, seq 1, length 64
23:42:58.473394 IP 10.0.0.8 > 10.0.0.9: ICMP echo reply, id 21379, seq 1, length 64
23:42:58.483103 ARP, Request who-has divmhlpt104804e.university.harvard.edu tell 10.0.0.9, length 28
23:42:58.483502 ARP, Reply divmhlpt104804e.university.harvard.edu is-at a2:de:e5:ff:01:9b (oui Unknown), length 28
23:42:58.483662 IP 10.0.0.9 > divmhlpt104804e.university.harvard.edu: ICMP echo request, id 21381, seq 1, length 64
23:42:58.483919 IP divmhlpt104804e.university.harvard.edu > 10.0.0.9: ICMP echo reply, id 21381, seq 1, length 64
23:42:58.488500 ARP, Request who-has iniwhwks3292009.university.harvard.edu tell 10.0.0.9, length 28
23:42:58.488851 ARP, Reply iniwhwks3292009.university.harvard.edu is-at 7a:3d:c3:54:48:4a (oui Unknown), length 28
23:42:58.489000 IP 10.0.0.9 > iniwhwks3292009.university.harvard.edu: ICMP echo request, id 21382, seq 1, length 64
23:42:58.489212 IP iniwhwks3292009.university.harvard.edu > 10.0.0.9: ICMP echo reply, id 21382, seq 1, length 64
23:42:58.493238 ARP, Request who-has 10.0.0.13 tell 10.0.0.9, length 28
23:42:58.493859 ARP, Reply 10.0.0.13 is-at 1e:a2:7f:3b:17:a8 (oui Unknown), length 28
23:42:58.493895 IP 10.0.0.9 > 10.0.0.13: ICMP echo request, id 21383, seq 1, length 64
23:42:58.494324 IP 10.0.0.13 > 10.0.0.9: ICMP echo reply, id 21383, seq 1, length 64
23:42:58.498623 ARP, Request who-has 10.0.0.14 tell 10.0.0.9, length 28
23:42:58.499187 ARP, Reply 10.0.0.14 is-at 26:23:22:1a:bd:ad (oui Unknown), length 28
23:42:58.499225 IP 10.0.0.9 > 10.0.0.14: ICMP echo request, id 21384, seq 1, length 64
23:42:58.499510 IP 10.0.0.14 > 10.0.0.9: ICMP echo reply, id 21384, seq 1, length 64
23:42:58.503754 ARP, Request who-has 10.0.0.15 tell 10.0.0.9, length 28
23:42:58.504429 ARP, Reply 10.0.0.15 is-at a6:f6:7f:9b:22:04 (oui Unknown), length 28
23:42:58.504467 IP 10.0.0.9 > 10.0.0.15: ICMP echo request, id 21385, seq 1, length 64
23:42:58.504641 IP 10.0.0.15 > 10.0.0.9: ICMP echo reply, id 21385, seq 1, length 64
23:42:58.509382 ARP, Request who-has 10.0.0.16 tell 10.0.0.9, length 28
23:42:58.509843 ARP, Reply 10.0.0.16 is-at b6:e3:93:ad:04:21 (oui Unknown), length 28
23:42:58.510056 IP 10.0.0.9 > 10.0.0.16: ICMP echo request, id 21386, seq 1, length 64
23:42:58.510346 IP 10.0.0.16 > 10.0.0.9: ICMP echo reply, id 21386, seq 1, length 64
23:42:58.518582 IP 10.0.0.10 > rfctest.harvard.edu: ICMP echo request, id 21387, seq 1, length 64
23:42:58.518708 IP rfctest.harvard.edu > 10.0.0.10: ICMP echo reply, id 21387, seq 1, length 64
23:42:58.522986 IP 10.0.0.10 > paine-b-sw2.net.harvard.edu: ICMP echo request, id 21388, seq 1, length 64
23:42:58.523058 IP paine-b-sw2.net.harvard.edu > 10.0.0.10: ICMP echo reply, id 21388, seq 1, length 64
23:42:58.527168 IP 10.0.0.10 > hamwhwks0643000.university.harvard.edu: ICMP echo request, id 21389, seq 1, length 64
23:42:58.527242 IP hamwhwks0643000.university.harvard.edu > 10.0.0.10: ICMP echo reply, id 21389, seq 1, length 64
23:42:58.531287 IP 10.0.0.10 > divwhlpt1048016.university.harvard.edu: ICMP echo request, id 21390, seq 1, length 64
23:42:58.531356 IP divwhlpt1048016.university.harvard.edu > 10.0.0.10: ICMP echo reply, id 21390, seq 1, length 64
23:42:58.535280 IP 10.0.0.10 > 10.0.0.5: ICMP echo request, id 21391, seq 1, length 64
23:42:58.535350 IP 10.0.0.5 > 10.0.0.10: ICMP echo reply, id 21391, seq 1, length 64
23:42:58.539682 IP 10.0.0.10 > 10.0.0.6: ICMP echo request, id 21392, seq 1, length 64
23:42:58.539775 IP 10.0.0.6 > 10.0.0.10: ICMP echo reply, id 21392, seq 1, length 64
23:42:58.543526 IP 10.0.0.10 > hrewhlpt2100046.university.harvard.edu: ICMP echo request, id 21393, seq 1, length 64
23:42:58.543597 IP hrewhlpt2100046.university.harvard.edu > 10.0.0.10: ICMP echo reply, id 21393, seq 1, length 64
23:42:58.547580 IP 10.0.0.10 > 10.0.0.8: ICMP echo request, id 21394, seq 1, length 64
23:42:58.547655 IP 10.0.0.8 > 10.0.0.10: ICMP echo reply, id 21394, seq 1, length 64
23:42:58.555975 ARP, Request who-has divmhlpt104804e.university.harvard.edu tell 10.0.0.10, length 28
23:42:58.556322 ARP, Reply divmhlpt104804e.university.harvard.edu is-at a2:de:e5:ff:01:9b (oui Unknown), length 28
23:42:58.556475 IP 10.0.0.10 > divmhlpt104804e.university.harvard.edu: ICMP echo request, id 21396, seq 1, length 64
23:42:58.556870 IP divmhlpt104804e.university.harvard.edu > 10.0.0.10: ICMP echo reply, id 21396, seq 1, length 64
23:42:58.561155 ARP, Request who-has iniwhwks3292009.university.harvard.edu tell 10.0.0.10, length 28
23:42:58.561358 ARP, Reply iniwhwks3292009.university.harvard.edu is-at 7a:3d:c3:54:48:4a (oui Unknown), length 28
23:42:58.561571 IP 10.0.0.10 > iniwhwks3292009.university.harvard.edu: ICMP echo request, id 21397, seq 1, length 64
23:42:58.561761 IP iniwhwks3292009.university.harvard.edu > 10.0.0.10: ICMP echo reply, id 21397, seq 1, length 64
23:42:58.565788 ARP, Request who-has 10.0.0.13 tell 10.0.0.10, length 28
23:42:58.566213 ARP, Reply 10.0.0.13 is-at 1e:a2:7f:3b:17:a8 (oui Unknown), length 28
23:42:58.566247 IP 10.0.0.10 > 10.0.0.13: ICMP echo request, id 21398, seq 1, length 64
23:42:58.566509 IP 10.0.0.13 > 10.0.0.10: ICMP echo reply, id 21398, seq 1, length 64
23:42:58.570993 ARP, Request who-has 10.0.0.14 tell 10.0.0.10, length 28
23:42:58.571237 ARP, Reply 10.0.0.14 is-at 26:23:22:1a:bd:ad (oui Unknown), length 28
23:42:58.571272 IP 10.0.0.10 > 10.0.0.14: ICMP echo request, id 21399, seq 1, length 64
23:42:58.571328 IP 10.0.0.14 > 10.0.0.10: ICMP echo reply, id 21399, seq 1, length 64
23:42:58.575191 ARP, Request who-has 10.0.0.15 tell 10.0.0.10, length 28
23:42:58.575537 ARP, Reply 10.0.0.15 is-at a6:f6:7f:9b:22:04 (oui Unknown), length 28
23:42:58.575574 IP 10.0.0.10 > 10.0.0.15: ICMP echo request, id 21400, seq 1, length 64
23:42:58.575635 IP 10.0.0.15 > 10.0.0.10: ICMP echo reply, id 21400, seq 1, length 64
23:42:58.580104 ARP, Request who-has 10.0.0.16 tell 10.0.0.10, length 28
23:42:58.580351 ARP, Reply 10.0.0.16 is-at b6:e3:93:ad:04:21 (oui Unknown), length 28
23:42:58.580585 IP 10.0.0.10 > 10.0.0.16: ICMP echo request, id 21401, seq 1, length 64
23:42:58.580664 IP 10.0.0.16 > 10.0.0.10: ICMP echo reply, id 21401, seq 1, length 64
23:42:58.622266 IP divmhlpt104804e.university.harvard.edu > 10.0.0.9: ICMP echo request, id 21410, seq 1, length 64
23:42:58.622300 IP 10.0.0.9 > divmhlpt104804e.university.harvard.edu: ICMP echo reply, id 21410, seq 1, length 64
23:42:58.626241 IP divmhlpt104804e.university.harvard.edu > 10.0.0.10: ICMP echo request, id 21411, seq 1, length 64
23:42:58.626273 IP 10.0.0.10 > divmhlpt104804e.university.harvard.edu: ICMP echo reply, id 21411, seq 1, length 64
23:42:58.692977 IP iniwhwks3292009.university.harvard.edu > 10.0.0.9: ICMP echo request, id 21425, seq 1, length 64
23:42:58.693008 IP 10.0.0.9 > iniwhwks3292009.university.harvard.edu: ICMP echo reply, id 21425, seq 1, length 64
23:42:58.697116 IP iniwhwks3292009.university.harvard.edu > 10.0.0.10: ICMP echo request, id 21426, seq 1, length 64
23:42:58.697196 IP 10.0.0.10 > iniwhwks3292009.university.harvard.edu: ICMP echo reply, id 21426, seq 1, length 64
23:42:58.764463 IP 10.0.0.13 > 10.0.0.9: ICMP echo request, id 21440, seq 1, length 64
23:42:58.764492 IP 10.0.0.9 > 10.0.0.13: ICMP echo reply, id 21440, seq 1, length 64
23:42:58.768571 IP 10.0.0.13 > 10.0.0.10: ICMP echo request, id 21441, seq 1, length 64
23:42:58.768604 IP 10.0.0.10 > 10.0.0.13: ICMP echo reply, id 21441, seq 1, length 64
23:42:58.840312 IP 10.0.0.14 > 10.0.0.9: ICMP echo request, id 21455, seq 1, length 64
23:42:58.840343 IP 10.0.0.9 > 10.0.0.14: ICMP echo reply, id 21455, seq 1, length 64
23:42:58.844733 IP 10.0.0.14 > 10.0.0.10: ICMP echo request, id 21456, seq 1, length 64
23:42:58.844763 IP 10.0.0.10 > 10.0.0.14: ICMP echo reply, id 21456, seq 1, length 64
23:42:58.912509 IP 10.0.0.15 > 10.0.0.9: ICMP echo request, id 21470, seq 1, length 64
23:42:58.912541 IP 10.0.0.9 > 10.0.0.15: ICMP echo reply, id 21470, seq 1, length 64
23:42:58.916621 IP 10.0.0.15 > 10.0.0.10: ICMP echo request, id 21471, seq 1, length 64
23:42:58.916652 IP 10.0.0.10 > 10.0.0.15: ICMP echo reply, id 21471, seq 1, length 64
23:42:58.977177 IP 10.0.0.16 > 10.0.0.9: ICMP echo request, id 21485, seq 1, length 64
23:42:58.977210 IP 10.0.0.9 > 10.0.0.16: ICMP echo reply, id 21485, seq 1, length 64
23:42:58.980933 IP 10.0.0.16 > 10.0.0.10: ICMP echo request, id 21486, seq 1, length 64
23:42:58.980963 IP 10.0.0.10 > 10.0.0.16: ICMP echo reply, id 21486, seq 1, length 64
23:43:02.875119 ARP, Request who-has rfctest.harvard.edu tell 10.0.0.10, length 28
23:43:02.875124 ARP, Request who-has rfctest.harvard.edu tell 10.0.0.9, length 28
23:43:02.875520 ARP, Reply rfctest.harvard.edu is-at 12:b3:8d:e2:20:85 (oui Unknown), length 28
23:43:02.875526 ARP, Reply rfctest.harvard.edu is-at 12:b3:8d:e2:20:85 (oui Unknown), length 28
23:43:03.131836 ARP, Request who-has divwhlpt1048016.university.harvard.edu tell 10.0.0.10, length 28
23:43:03.131841 ARP, Request who-has divwhlpt1048016.university.harvard.edu tell 10.0.0.9, length 28
23:43:03.131887 ARP, Request who-has hamwhwks0643000.university.harvard.edu tell 10.0.0.10, length 28
23:43:03.131892 ARP, Request who-has hamwhwks0643000.university.harvard.edu tell 10.0.0.9, length 28
23:43:03.131976 ARP, Request who-has paine-b-sw2.net.harvard.edu tell 10.0.0.10, length 28
23:43:03.131980 ARP, Request who-has paine-b-sw2.net.harvard.edu tell 10.0.0.9, length 28
23:43:03.133330 ARP, Reply divwhlpt1048016.university.harvard.edu is-at 56:29:a3:a2:20:61 (oui Unknown), length 28
23:43:03.133338 ARP, Reply divwhlpt1048016.university.harvard.edu is-at 56:29:a3:a2:20:61 (oui Unknown), length 28
23:43:03.133404 ARP, Reply hamwhwks0643000.university.harvard.edu is-at 92:a1:ff:1f:cd:c5 (oui Unknown), length 28
23:43:03.133409 ARP, Reply hamwhwks0643000.university.harvard.edu is-at 92:a1:ff:1f:cd:c5 (oui Unknown), length 28
23:43:03.133469 ARP, Reply paine-b-sw2.net.harvard.edu is-at 62:6c:1e:e9:a2:6a (oui Unknown), length 28
23:43:03.133474 ARP, Reply paine-b-sw2.net.harvard.edu is-at 62:6c:1e:e9:a2:6a (oui Unknown), length 28
23:43:03.390185 ARP, Request who-has hrewhlpt2100046.university.harvard.edu tell 10.0.0.10, length 28
23:43:03.390192 ARP, Request who-has hrewhlpt2100046.university.harvard.edu tell 10.0.0.9, length 28
23:43:03.390225 ARP, Request who-has 10.0.0.6 tell 10.0.0.10, length 28
23:43:03.390229 ARP, Request who-has 10.0.0.6 tell 10.0.0.9, length 28
23:43:03.390266 ARP, Request who-has 10.0.0.5 tell 10.0.0.10, length 28
23:43:03.390271 ARP, Request who-has 10.0.0.5 tell 10.0.0.9, length 28
23:43:03.391430 ARP, Reply hrewhlpt2100046.university.harvard.edu is-at de:fc:3a:de:5a:eb (oui Unknown), length 28
23:43:03.391438 ARP, Reply hrewhlpt2100046.university.harvard.edu is-at de:fc:3a:de:5a:eb (oui Unknown), length 28
23:43:03.391478 ARP, Reply 10.0.0.6 is-at 86:74:ea:fc:7a:62 (oui Unknown), length 28
23:43:03.391483 ARP, Reply 10.0.0.6 is-at 86:74:ea:fc:7a:62 (oui Unknown), length 28
23:43:03.391523 ARP, Reply 10.0.0.5 is-at 86:21:71:bd:c0:f8 (oui Unknown), length 28
23:43:03.391528 ARP, Reply 10.0.0.5 is-at 86:21:71:bd:c0:f8 (oui Unknown), length 28
23:43:03.643358 ARP, Request who-has 10.0.0.10 tell iniwhwks3292009.university.harvard.edu, length 28
23:43:03.643372 ARP, Request who-has 10.0.0.9 tell divmhlpt104804e.university.harvard.edu, length 28
23:43:03.643423 ARP, Request who-has 10.0.0.10 tell 10.0.0.16, length 28
23:43:03.643437 ARP, Request who-has 10.0.0.9 tell 10.0.0.16, length 28
23:43:03.643449 ARP, Request who-has 10.0.0.10 tell divmhlpt104804e.university.harvard.edu, length 28
23:43:03.643474 ARP, Request who-has 10.0.0.9 tell iniwhwks3292009.university.harvard.edu, length 28
23:43:03.643468 ARP, Reply 10.0.0.10 is-at 9a:60:b4:e8:36:04 (oui Unknown), length 28
23:43:03.643478 ARP, Reply 10.0.0.9 is-at 8a:c8:67:01:92:b9 (oui Unknown), length 28
23:43:03.643404 ARP, Request who-has 10.0.0.8 tell 10.0.0.10, length 28
23:43:03.643408 ARP, Request who-has 10.0.0.8 tell 10.0.0.9, length 28
23:43:03.643541 ARP, Reply 10.0.0.10 is-at 9a:60:b4:e8:36:04 (oui Unknown), length 28
23:43:03.643554 ARP, Reply 10.0.0.9 is-at 8a:c8:67:01:92:b9 (oui Unknown), length 28
23:43:03.643652 ARP, Request who-has 10.0.0.10 tell 10.0.0.15, length 28
23:43:03.643658 ARP, Request who-has 10.0.0.10 tell 10.0.0.14, length 28
23:43:03.643666 ARP, Request who-has 10.0.0.10 tell 10.0.0.13, length 28
23:43:03.643680 ARP, Request who-has 10.0.0.9 tell 10.0.0.15, length 28
23:43:03.643687 ARP, Request who-has 10.0.0.9 tell 10.0.0.14, length 28
23:43:03.643693 ARP, Request who-has 10.0.0.9 tell 10.0.0.13, length 28
23:43:03.643782 ARP, Reply 10.0.0.10 is-at 9a:60:b4:e8:36:04 (oui Unknown), length 28
23:43:03.643803 ARP, Reply 10.0.0.9 is-at 8a:c8:67:01:92:b9 (oui Unknown), length 28
23:43:03.643943 ARP, Reply 10.0.0.10 is-at 9a:60:b4:e8:36:04 (oui Unknown), length 28
23:43:03.643949 ARP, Reply 10.0.0.10 is-at 9a:60:b4:e8:36:04 (o