tcpdump: verbose output suppressed, use -v or -vv for full protocol decode
listening on s4201-eth2, link-type EN10MB (Ethernet), capture size 262144 bytes
01:15:11.016096 IP taubman-3s-sw1-vl-1.net.harvard.edu > aardvark.university.harvard.edu: ICMP echo request, id 3481, seq 1, length 64
01:15:11.016315 IP aardvark.university.harvard.edu > taubman-3s-sw1-vl-1.net.harvard.edu: ICMP echo reply, id 3481, seq 1, length 64
01:15:11.019801 IP taubman-3s-sw1-vl-1.net.harvard.edu > divwhlpt1048016.university.harvard.edu: ICMP echo request, id 3482, seq 1, length 64
01:15:11.020034 IP divwhlpt1048016.university.harvard.edu > taubman-3s-sw1-vl-1.net.harvard.edu: ICMP echo reply, id 3482, seq 1, length 64
01:15:11.079113 IP daisy.university.harvard.edu > aardvark.university.harvard.edu: ICMP echo request, id 3496, seq 1, length 64
01:15:11.079232 IP aardvark.university.harvard.edu > daisy.university.harvard.edu: ICMP echo reply, id 3496, seq 1, length 64
01:15:11.082992 IP daisy.university.harvard.edu > divwhlpt1048016.university.harvard.edu: ICMP echo request, id 3497, seq 1, length 64
01:15:11.083139 IP divwhlpt1048016.university.harvard.edu > daisy.university.harvard.edu: ICMP echo reply, id 3497, seq 1, length 64
01:15:11.138357 IP aardvark.university.harvard.edu > taubman-3s-sw1-vl-1.net.harvard.edu: ICMP echo request, id 3510, seq 1, length 64
01:15:11.138415 IP taubman-3s-sw1-vl-1.net.harvard.edu > aardvark.university.harvard.edu: ICMP echo reply, id 3510, seq 1, length 64
01:15:11.142539 IP aardvark.university.harvard.edu > daisy.university.harvard.edu: ICMP echo request, id 3511, seq 1, length 64
01:15:11.142588 IP daisy.university.harvard.edu > aardvark.university.harvard.edu: ICMP echo reply, id 3511, seq 1, length 64
01:15:11.150968 IP aardvark.university.harvard.edu > 10.0.0.5: ICMP echo request, id 3513, seq 1, length 64
01:15:11.151381 IP 10.0.0.5 > aardvark.university.harvard.edu: ICMP echo reply, id 3513, seq 1, length 64
01:15:11.156054 IP aardvark.university.harvard.edu > 10.0.0.6: ICMP echo request, id 3514, seq 1, length 64
01:15:11.156214 IP 10.0.0.6 > aardvark.university.harvard.edu: ICMP echo reply, id 3514, seq 1, length 64
01:15:11.159561 IP aardvark.university.harvard.edu > hrewhlpt2100046.university.harvard.edu: ICMP echo request, id 3515, seq 1, length 64
01:15:11.159639 IP hrewhlpt2100046.university.harvard.edu > aardvark.university.harvard.edu: ICMP echo reply, id 3515, seq 1, length 64
01:15:11.173207 IP aardvark.university.harvard.edu > 10.0.0.8: ICMP echo request, id 3516, seq 1, length 64
01:15:11.173390 IP 10.0.0.8 > aardvark.university.harvard.edu: ICMP echo reply, id 3516, seq 1, length 64
01:15:11.176786 IP aardvark.university.harvard.edu > 10.0.0.9: ICMP echo request, id 3517, seq 1, length 64
01:15:11.177031 IP 10.0.0.9 > aardvark.university.harvard.edu: ICMP echo reply, id 3517, seq 1, length 64
01:15:11.180272 IP aardvark.university.harvard.edu > 10.0.0.10: ICMP echo request, id 3518, seq 1, length 64
01:15:11.180343 IP 10.0.0.10 > aardvark.university.harvard.edu: ICMP echo reply, id 3518, seq 1, length 64
01:15:11.183567 IP aardvark.university.harvard.edu > divmhlpt104804e.university.harvard.edu: ICMP echo request, id 3519, seq 1, length 64
01:15:11.183633 IP divmhlpt104804e.university.harvard.edu > aardvark.university.harvard.edu: ICMP echo reply, id 3519, seq 1, length 64
01:15:11.186918 IP aardvark.university.harvard.edu > hulmhlpt1383001.university.harvard.edu: ICMP echo request, id 3520, seq 1, length 64
01:15:11.187002 IP hulmhlpt1383001.university.harvard.edu > aardvark.university.harvard.edu: ICMP echo reply, id 3520, seq 1, length 64
01:15:11.190376 IP aardvark.university.harvard.edu > 10.0.0.13: ICMP echo request, id 3521, seq 1, length 64
01:15:11.190566 IP 10.0.0.13 > aardvark.university.harvard.edu: ICMP echo reply, id 3521, seq 1, length 64
01:15:11.193617 IP aardvark.university.harvard.edu > 10.0.0.14: ICMP echo request, id 3522, seq 1, length 64
01:15:11.193739 IP 10.0.0.14 > aardvark.university.harvard.edu: ICMP echo reply, id 3522, seq 1, length 64
01:15:11.196990 IP aardvark.university.harvard.edu > 10.0.0.15: ICMP echo request, id 3523, seq 1, length 64
01:15:11.197050 IP 10.0.0.15 > aardvark.university.harvard.edu: ICMP echo reply, id 3523, seq 1, length 64
01:15:11.200289 IP aardvark.university.harvard.edu > 10.0.0.16: ICMP echo request, id 3524, seq 1, length 64
01:15:11.200458 IP 10.0.0.16 > aardvark.university.harvard.edu: ICMP echo reply, id 3524, seq 1, length 64
01:15:11.206876 IP divwhlpt1048016.university.harvard.edu > taubman-3s-sw1-vl-1.net.harvard.edu: ICMP echo request, id 3525, seq 1, length 64
01:15:11.206913 IP taubman-3s-sw1-vl-1.net.harvard.edu > divwhlpt1048016.university.harvard.edu: ICMP echo reply, id 3525, seq 1, length 64
01:15:11.210089 IP divwhlpt1048016.university.harvard.edu > daisy.university.harvard.edu: ICMP echo request, id 3526, seq 1, length 64
01:15:11.210136 IP daisy.university.harvard.edu > divwhlpt1048016.university.harvard.edu: ICMP echo reply, id 3526, seq 1, length 64
01:15:11.216785 IP divwhlpt1048016.university.harvard.edu > 10.0.0.5: ICMP echo request, id 3528, seq 1, length 64
01:15:11.217210 IP 10.0.0.5 > divwhlpt1048016.university.harvard.edu: ICMP echo reply, id 3528, seq 1, length 64
01:15:11.220659 IP divwhlpt1048016.university.harvard.edu > 10.0.0.6: ICMP echo request, id 3529, seq 1, length 64
01:15:11.220819 IP 10.0.0.6 > divwhlpt1048016.university.harvard.edu: ICMP echo reply, id 3529, seq 1, length 64
01:15:11.224162 IP divwhlpt1048016.university.harvard.edu > hrewhlpt2100046.university.harvard.edu: ICMP echo request, id 3530, seq 1, length 64
01:15:11.224529 IP hrewhlpt2100046.university.harvard.edu > divwhlpt1048016.university.harvard.edu: ICMP echo reply, id 3530, seq 1, length 64
01:15:11.228110 IP divwhlpt1048016.university.harvard.edu > 10.0.0.8: ICMP echo request, id 3531, seq 1, length 64
01:15:11.228283 IP 10.0.0.8 > divwhlpt1048016.university.harvard.edu: ICMP echo reply, id 3531, seq 1, length 64
01:15:11.231557 IP divwhlpt1048016.university.harvard.edu > 10.0.0.9: ICMP echo request, id 3532, seq 1, length 64
01:15:11.231863 IP 10.0.0.9 > divwhlpt1048016.university.harvard.edu: ICMP echo reply, id 3532, seq 1, length 64
01:15:11.235127 IP divwhlpt1048016.university.harvard.edu > 10.0.0.10: ICMP echo request, id 3533, seq 1, length 64
01:15:11.235189 IP 10.0.0.10 > divwhlpt1048016.university.harvard.edu: ICMP echo reply, id 3533, seq 1, length 64
01:15:11.238547 IP divwhlpt1048016.university.harvard.edu > divmhlpt104804e.university.harvard.edu: ICMP echo request, id 3534, seq 1, length 64
01:15:11.238644 IP divmhlpt104804e.university.harvard.edu > divwhlpt1048016.university.harvard.edu: ICMP echo reply, id 3534, seq 1, length 64
01:15:11.241576 IP divwhlpt1048016.university.harvard.edu > hulmhlpt1383001.university.harvard.edu: ICMP echo request, id 3535, seq 1, length 64
01:15:11.241648 IP hulmhlpt1383001.university.harvard.edu > divwhlpt1048016.university.harvard.edu: ICMP echo reply, id 3535, seq 1, length 64
01:15:11.244717 IP divwhlpt1048016.university.harvard.edu > 10.0.0.13: ICMP echo request, id 3536, seq 1, length 64
01:15:11.244961 IP 10.0.0.13 > divwhlpt1048016.university.harvard.edu: ICMP echo reply, id 3536, seq 1, length 64
01:15:11.248198 IP divwhlpt1048016.university.harvard.edu > 10.0.0.14: ICMP echo request, id 3537, seq 1, length 64
01:15:11.248263 IP 10.0.0.14 > divwhlpt1048016.university.harvard.edu: ICMP echo reply, id 3537, seq 1, length 64
01:15:11.251298 IP divwhlpt1048016.university.harvard.edu > 10.0.0.15: ICMP echo request, id 3538, seq 1, length 64
01:15:11.251356 IP 10.0.0.15 > divwhlpt1048016.university.harvard.edu: ICMP echo reply, id 3538, seq 1, length 64
01:15:11.255258 IP divwhlpt1048016.university.harvard.edu > 10.0.0.16: ICMP echo request, id 3539, seq 1, length 64
01:15:11.255322 IP 10.0.0.16 > divwhlpt1048016.university.harvard.edu: ICMP echo reply, id 3539, seq 1, length 64
01:15:11.267787 IP 10.0.0.5 > aardvark.university.harvard.edu: ICMP echo request, id 3542, seq 1, length 64
01:15:11.267811 IP aardvark.university.harvard.edu > 10.0.0.5: ICMP echo reply, id 3542, seq 1, length 64
01:15:11.271491 IP 10.0.0.5 > divwhlpt1048016.university.harvard.edu: ICMP echo request, id 3543, seq 1, length 64
01:15:11.271516 IP divwhlpt1048016.university.harvard.edu > 10.0.0.5: ICMP echo reply, id 3543, seq 1, length 64
01:15:11.326215 IP 10.0.0.6 > aardvark.university.harvard.edu: ICMP echo request, id 3557, seq 1, length 64
01:15:11.326241 IP aardvark.university.harvard.edu > 10.0.0.6: ICMP echo reply, id 3557, seq 1, length 64
01:15:11.329526 IP 10.0.0.6 > divwhlpt1048016.university.harvard.edu: ICMP echo request, id 3558, seq 1, length 64
01:15:11.329560 IP divwhlpt1048016.university.harvard.edu > 10.0.0.6: ICMP echo reply, id 3558, seq 1, length 64
01:15:11.379684 IP hrewhlpt2100046.university.harvard.edu > aardvark.university.harvard.edu: ICMP echo request, id 3572, seq 1, length 64
01:15:11.379706 IP aardvark.university.harvard.edu > hrewhlpt2100046.university.harvard.edu: ICMP echo reply, id 3572, seq 1, length 64
01:15:11.382859 IP hrewhlpt2100046.university.harvard.edu > divwhlpt1048016.university.harvard.edu: ICMP echo request, id 3573, seq 1, length 64
01:15:11.382883 IP divwhlpt1048016.university.harvard.edu > hrewhlpt2100046.university.harvard.edu: ICMP echo reply, id 3573, seq 1, length 64
01:15:11.438826 IP 10.0.0.8 > aardvark.university.harvard.edu: ICMP echo request, id 3587, seq 1, length 64
01:15:11.438851 IP aardvark.university.harvard.edu > 10.0.0.8: ICMP echo reply, id 3587, seq 1, length 64
01:15:11.442121 IP 10.0.0.8 > divwhlpt1048016.university.harvard.edu: ICMP echo request, id 3588, seq 1, length 64
01:15:11.442148 IP divwhlpt1048016.university.harvard.edu > 10.0.0.8: ICMP echo reply, id 3588, seq 1, length 64
01:15:11.494992 IP 10.0.0.9 > aardvark.university.harvard.edu: ICMP echo request, id 3602, seq 1, length 64
01:15:11.495016 IP aardvark.university.harvard.edu > 10.0.0.9: ICMP echo reply, id 3602, seq 1, length 64
01:15:11.498272 IP 10.0.0.9 > divwhlpt1048016.university.harvard.edu: ICMP echo request, id 3603, seq 1, length 64
01:15:11.498325 IP divwhlpt1048016.university.harvard.edu > 10.0.0.9: ICMP echo reply, id 3603, seq 1, length 64
01:15:11.553371 IP 10.0.0.10 > aardvark.university.harvard.edu: ICMP echo request, id 3617, seq 1, length 64
01:15:11.553403 IP aardvark.university.harvard.edu > 10.0.0.10: ICMP echo reply, id 3617, seq 1, length 64
01:15:11.556962 IP 10.0.0.10 > divwhlpt1048016.university.harvard.edu: ICMP echo request, id 3618, seq 1, length 64
01:15:11.556987 IP divwhlpt1048016.university.harvard.edu > 10.0.0.10: ICMP echo reply, id 3618, seq 1, length 64
01:15:11.608745 IP divmhlpt104804e.university.harvard.edu > aardvark.university.harvard.edu: ICMP echo request, id 3632, seq 1, length 64
01:15:11.608778 IP aardvark.university.harvard.edu > divmhlpt104804e.university.harvard.edu: ICMP echo reply, id 3632, seq 1, length 64
01:15:11.611938 IP divmhlpt104804e.university.harvard.edu > divwhlpt1048016.university.harvard.edu: ICMP echo request, id 3633, seq 1, length 64
01:15:11.611961 IP divwhlpt1048016.university.harvard.edu > divmhlpt104804e.university.harvard.edu: ICMP echo reply, id 3633, seq 1, length 64
01:15:11.663191 IP hulmhlpt1383001.university.harvard.edu > aardvark.university.harvard.edu: ICMP echo request, id 3647, seq 1, length 64
01:15:11.663213 IP aardvark.university.harvard.edu > hulmhlpt1383001.university.harvard.edu: ICMP echo reply, id 3647, seq 1, length 64
01:15:11.666495 IP hulmhlpt1383001.university.harvard.edu > divwhlpt1048016.university.harvard.edu: ICMP echo request, id 3648, seq 1, length 64
01:15:11.666533 IP divwhlpt1048016.university.harvard.edu > hulmhlpt1383001.university.harvard.edu: ICMP echo reply, id 3648, seq 1, length 64
01:15:11.720936 IP 10.0.0.13 > aardvark.university.harvard.edu: ICMP echo request, id 3662, seq 1, length 64
01:15:11.720970 IP aardvark.university.harvard.edu > 10.0.0.13: ICMP echo reply, id 3662, seq 1, length 64
01:15:11.724327 IP 10.0.0.13 > divwhlpt1048016.university.harvard.edu: ICMP echo request, id 3663, seq 1, length 64
01:15:11.724353 IP divwhlpt1048016.university.harvard.edu > 10.0.0.13: ICMP echo reply, id 3663, seq 1, length 64
01:15:11.775416 IP 10.0.0.14 > aardvark.university.harvard.edu: ICMP echo request, id 3677, seq 1, length 64
01:15                                                                                                                                                                                                                                                                                                                                                                                                                                                                                                                                                                                                                                                                                                                                                                                                                                                                                                                                                                                                                                                                                                                                                                                                                                                                                                                                                                                                                                                                                                                                                                                                                                                                                                                                                                                                                                                                                                                                                                                                                                                                                                                                                                                                                                                                                                                                                                                                                                                                                                                                                                                                                                                                                                                                                                                                                                                                                                                                                                                                                                                                                                                                                                                                                                                                                                                                                                                                                                                                                                                                                                                                                                                                                                                                                                                                                                                                                                                                                                                                                                                                                                                                                                                                                                                                                                                                                                                                                                                                                                                                                                                                                                                                                                                                                                                                                                                                                                                                                                                                                                                                                                                                                                                                                                                                                                                                                                                                                                                                                                                                                                                                                                                                                                                                                                                                                                                                                                                                                                                                                                                                                                                                                                                                                                                                                                                                                                                                                                                                                                                                                                                                                                                                                                                                                                                                                                                                                                                                                                                                                                                                                                                                                                                                                                                                                                                                                                                                                                                                                                                                                                                                                                                                                                                                                                                                                                                                                                                                                                                                                                                                                                                                                                                                                                                                                                                                                                                                                                                                                                                                                                                                                                                                                                                                                                                                                                                                                                                                                                                                                                                                                                                                                                                                                                                                                                                                                                                                                                                                                                                                                                                                                                                                                                                                                                                                                                                                                                                                                                                                                                                                                                                                                                                                                                                                                                                                                                                                                                                                                                                                                                                                                                                                                                                                                                                                                                                                                                                                                                                                                                                                                                                                                                                                                                                                                                                                                                                                                                                                                                                                                                                                                                                                                                                                                                                                                                                                                                                                                                                                                                                                                                                                                                                                                                                                                                                                                                                                                                                                                                                                                                                                                                                                                                                                                                                                56.139310 ARP, Reply divwhlpt1048016.university.harvard.edu is-at 9a:92:3a:76:bb:4d (oui Unknown), length 28
01:14:56.139319 ARP, Reply divwhlpt1048016.university.harvard.edu is-at 9a:92:3a:76:bb:4d (oui Unknown), length 28
01:14:56.139327 ARP, Reply uismhlpt401301e.university.harvard.edu is-at b6:eb:c2:0b:99:8e (oui Unknown), length 28
01:14:56.139337 ARP, Reply uismhlpt401301e.university.harvard.edu is-at b6:eb:c2:0b:99:8e (oui Unknown), length 28
01:14:56.139345 ARP, Reply uismhlpt401301e.university.harvard.edu is-at b6:eb:c2:0b:99:8e (oui Unknown), length 28
01:14:56.139353 ARP, Reply uismhlpt401301e.university.harvard.edu is-at b6:eb:c2:0b:99:8e (oui Unknown), length 28
01:14:56.139361 ARP, Reply uismhlpt401301e.university.harvard.edu is-at b6:eb:c2:0b:99:8e (oui Unknown), length 28
01:14:56.139369 ARP, Reply uismhlpt401301e.university.harvard.edu is-at b6:eb:c2:0b:99:8e (oui Unknown), length 28
01:14:56.139377 ARP, Reply uismhlpt401301e.university.harvard.edu is-at b6:eb:c2:0b:99:8e (oui Unknown), length 28
01:14:56.139386 ARP, Reply uismhlpt401301e.university.harvard.edu is-at b6:eb:c2:0b:99:8e (oui Unknown), length 28
01:14:56.139394 ARP, Reply uismhlpt401301e.university.harvard.edu is-at b6:eb:c2:0b:99:8e (oui Unknown), length 28
01:14:56.139403 ARP, Reply uismhlpt401301e.university.harvard.edu is-at b6:eb:c2:0b:99:8e (oui Unknown), length 28
01:14:56.139411 ARP, Reply uismhlpt401301e.university.harvard.edu is-at b6:eb:c2:0b:99:8e (oui Unknown), length 28
01:14:56.139420 ARP, Reply uismhlpt401301e.university.harvard.edu is-at b6:eb:c2:0b:99:8e (oui Unknown), length 28
01:15:01.777666 IP6 mininet > ip6-allrouters: ICMP6, router solicitation, length 16
01:15:03.842065 IP6 mininet > ip6-allrouters: ICMP6, router solicitation, length 16
01:15:11.016096 IP taubman-3s-sw1-vl-1.net.harvard.edu > uismhlpt401301e.university.harvard.edu: ICMP echo request, id 3481, seq 1, length 64
01:15:11.016315 IP uismhlpt401301e.university.harvard.edu > taubman-3s-sw1-vl-1.net.harvard.edu: ICMP echo reply, id 3481, seq 1, length 64
01:15:11.019801 IP taubman-3s-sw1-vl-1.net.harvard.edu > divwhlpt1048016.university.harvard.edu: ICMP echo request, id 3482, seq 1, length 64
01:15:11.020034 IP divwhlpt1048016.university.harvard.edu > taubman-3s-sw1-vl-1.net.harvard.edu: ICMP echo reply, id 3482, seq 1, length 64
01:15:11.079113 IP daisy.university.harvard.edu > uismhlpt401301e.university.harvard.edu: ICMP echo request, id 3496, seq 1, length 64
01:15:11.079232 IP uismhlpt401301e.university.harvard.edu > daisy.university.harvard.edu: ICMP echo reply, id 3496, seq 1, length 64
01:15:11.082992 IP daisy.university.harvard.edu > divwhlpt1048016.university.harvard.edu: ICMP echo request, id 3497, seq 1, length 64
01:15:11.083139 IP divwhlpt1048016.university.harvard.edu > daisy.university.harvard.edu: ICMP echo reply, id 3497, seq 1, length 64
01:15:11.138357 IP uismhlpt401301e.university.harvard.edu > taubman-3s-sw1-vl-1.net.harvard.edu: ICMP echo request, id 3510, seq 1, length 64
01:15:11.138415 IP taubman-3s-sw1-vl-1.net.harvard.edu > uismhlpt401301e.university.harvard.edu: ICMP echo reply, id 3510, seq 1, length 64
01:15:11.142539 IP uismhlpt401301e.university.harvard.edu > daisy.university.harvard.edu: ICMP echo request, id 3511, seq 1, length 64
01:15:11.142588 IP daisy.university.harvard.edu > uismhlpt401301e.university.harvard.edu: ICMP echo reply, id 3511, seq 1, length 64
01:15:11.150968 IP uismhlpt401301e.university.harvard.edu > 10.0.0.5: ICMP echo request, id 3513, seq 1, length 64
01:15:11.151381 IP 10.0.0.5 > uismhlpt401301e.university.harvard.edu: ICMP echo reply, id 3513, seq 1, length 64
01:15:11.156054 IP uismhlpt401301e.university.harvard.edu > 10.0.0.6: ICMP echo request, id 3514, seq 1, length 64
01:15:11.156214 IP 10.0.0.6 > uismhlpt401301e.university.harvard.edu: ICMP echo reply, id 3514, seq 1, length 64
01:15:11.159561 IP uismhlpt401301e.university.harvard.edu > hrewhlpt2100046.university.harvard.edu: ICMP echo request, id 3515, seq 1, length 64
01:15:11.159639 IP hrewhlpt2100046.university.harvard.edu > uismhlpt401301e.university.harvard.edu: ICMP echo reply, id 3515, seq 1, length 64
01:15:11.173207 IP uismhlpt401301e.university.harvard.edu > 10.0.0.8: ICMP echo request, id 3516, seq 1, length 64
01:15:11.173390 IP 10.0.0.8 > uismhlpt401301e.university.harvard.edu: ICMP echo reply, id 3516, seq 1, length 64
01:15:11.176786 IP uismhlpt401301e.university.harvard.edu > 10.0.0.9: ICMP echo request, id 3517, seq 1, length 64
01:15:11.177031 IP 10.0.0.9 > uismhlpt401301e.university.harvard.edu: ICMP echo reply, id 3517, seq 1, length 64
01:15:11.180272 IP uismhlpt401301e.university.harvard.edu > 10.0.0.10: ICMP echo request, id 3518, seq 1, length 64
01:15:11.180343 IP 10.0.0.10 > uismhlpt401301e.university.harvard.edu: ICMP echo reply, id 3518, seq 1, length 64
01:15:11.183567 IP uismhlpt401301e.university.harvard.edu > divmhlpt104804e.university.harvard.edu: ICMP echo request, id 3519, seq 1, length 64
01:15:11.183633 IP divmhlpt104804e.university.harvard.edu > uismhlpt401301e.university.harvard.edu: ICMP echo reply, id 3519, seq 1, length 64
01:15:11.186918 IP uismhlpt401301e.university.harvard.edu > iniwhwks3292009.university.harvard.edu: ICMP echo request, id 3520, seq 1, length 64
01:15:11.187002 IP iniwhwks3292009.university.harvard.edu > uismhlpt401301e.university.harvard.edu: ICMP echo reply, id 3520, seq 1, length 64
01:15:11.190376 IP uismhlpt401301e.university.harvard.edu > 10.0.0.13: ICMP echo request, id 3521, seq 1, length 64
01:15:11.190566 IP 10.0.0.13 > uismhlpt401301e.university.harvard.edu: ICMP echo reply, id 3521, seq 1, length 64
01:15:11.193617 IP uismhlpt401301e.university.harvard.edu > 10.0.0.14: ICMP echo request, id 3522, seq 1, length 64
01:15:11.193739 IP 10.0.0.14 > uismhlpt401301e.university.harvard.edu: ICMP echo reply, id 3522, seq 1, length 64
01:15:11.196990 IP uismhlpt401301e.university.harvard.edu > 10.0.0.15: ICMP echo request, id 3523, seq 1, length 64
01:15:11.197050 IP 10.0.0.15 > uismhlpt401301e.university.harvard.edu: ICMP echo reply, id 3523, seq 1, length 64
01:15:11.200289 IP uismhlpt401301e.university.harvard.edu > 10.0.0.16: ICMP echo request, id 3524, seq 1, length 64
01:15:11.200458 IP 10.0.0.16 > uismhlpt401301e.university.harvard.edu: ICMP echo reply, id 3524, seq 1, length 64
01:15:11.206876 IP divwhlpt1048016.university.harvard.edu > taubman-3s-sw1-vl-1.net.harvard.edu: ICMP echo request, id 3525, seq 1, length 64
01:15:11.206913 IP taubman-3s-sw1-vl-1.net.harvard.edu > divwhlpt1048016.university.harvard.edu: ICMP echo reply, id 3525, seq 1, length 64
01:15:11.210089 IP divwhlpt1048016.university.harvard.edu > daisy.university.harvard.edu: ICMP echo request, id 3526, seq 1, length 64
01:15:11.210136 IP daisy.university.harvard.edu > divwhlpt1048016.university.harvard.edu: ICMP echo reply, id 3526, seq 1, length 64
01:15:11.216785 IP divwhlpt1048016.university.harvard.edu > 10.0.0.5: ICMP echo request, id 3528, seq 1, length 64
01:15:11.217210 IP 10.0.0.5 > divwhlpt1048016.university.harvard.edu: ICMP echo reply, id 3528, seq 1, length 64
01:15:11.220659 IP divwhlpt1048016.university.harvard.edu > 10.0.0.6: ICMP echo request, id 3529, seq 1, length 64
01:15:11.220819 IP 10.0.0.6 > divwhlpt1048016.university.harvard.edu: ICMP echo reply, id 3529, seq 1, length 64
01:15:11.224162 IP divwhlpt1048016.university.harvard.edu > hrewhlpt2100046.university.harvard.edu: ICMP echo request, id 3530, seq 1, length 64
01:15:11.224529 IP hrewhlpt2100046.university.harvard.edu > divwhlpt1048016.university.harvard.edu: ICMP echo reply, id 3530, seq 1, length 64
01:15:11.228110 IP divwhlpt1048016.university.harvard.edu > 10.0.0.8: ICMP echo request, id 3531, seq 1, length 64
01:15:11.228283 IP 10.0.0.8 > divwhlpt1048016.university.harvard.edu: ICMP echo reply, id 3531, seq 1, length 64
01:15:11.231557 IP divwhlpt1048016.university.harvard.edu > 10.0.0.9: ICMP echo request, id 3532, seq 1, length 64
01:15:11.231863 IP 10.0.0.9 > divwhlpt1048016.university.harvard.edu: ICMP echo reply, id 3532, seq 1, length 64
01:15:11.235127 IP divwhlpt1048016.university.harvard.edu > 10.0.0.10: ICMP echo request, id 3533, seq 1, length 64
01:15:11.235189 IP 10.0.0.10 > divwhlpt1048016.university.harvard.edu: ICMP echo reply, id 3533, seq 1, length 64
01:15:11.238547 IP divwhlpt1048016.university.harvard.edu > divmhlpt104804e.university.harvard.edu: ICMP echo request, id 3534, seq 1, length 64
01:15:11.238644 IP divmhlpt104804e.university.harvard.edu > divwhlpt1048016.university.harvard.edu: ICMP echo reply, id 3534, seq 1, length 64
01:15:11.241576 IP divwhlpt1048016.university.harvard.edu > iniwhwks3292009.university.harvard.edu: ICMP echo request, id 3535, seq 1, length 64
01:15:11.241648 IP iniwhwks3292009.university.harvard.edu > divwhlpt1048016.university.harvard.edu: ICMP echo reply, id 3535, seq 1, length 64
01:15:11.244717 IP divwhlpt1048016.university.harvard.edu > 10.0.0.13: ICMP echo request, id 3536, seq 1, length 64
01:15:11.244961 IP 10.0.0.13 > divwhlpt1048016.university.harvard.edu: ICMP echo reply, id 3536, seq 1, length 64
01:15:11.248198 IP divwhlpt1048016.university.harvard.edu > 10.0.0.14: ICMP echo request, id 3537, seq 1, length 64
01:15:11.248263 IP 10.0.0.14 > divwhlpt1048016.university.harvard.edu: ICMP echo reply, id 3537, seq 1, length 64
01:15:11.251298 IP divwhlpt1048016.university.harvard.edu > 10.0.0.15: ICMP echo request, id 3538, seq 1, length 64
01:15:11.251356 IP 10.0.0.15 > divwhlpt1048016.university.harvard.edu: ICMP echo reply, id 3538, seq 1, length 64
01:15:11.255258 IP divwhlpt1048016.university.harvard.edu > 10.0.0.16: ICMP echo request, id 3539, seq 1, length 64
01:15:11.255322 IP 10.0.0.16 > divwhlpt1048016.university.harvard.edu: ICMP echo reply, id 3539, seq 1, length 64
01:15:11.267787 IP 10.0.0.5 > uismhlpt401301e.university.harvard.edu: ICMP echo request, id 3542, seq 1, length 64
01:15:11.267811 IP uismhlpt401301e.university.harvard.edu > 10.0.0.5: ICMP echo reply, id 3542, seq 1, length 64
01:15:11.271491 IP 10.0.0.5 > divwhlpt1048016.university.harvard.edu: ICMP echo request, id 3543, seq 1, length 64
01:15:11.271516 IP divwhlpt1048016.university.harvard.edu > 10.0.0.5: ICMP echo reply, id 3543, seq 1, length 64
01:15:11.326215 IP 10.0.0.6 > uismhlpt401301e.university.harvard.edu: ICMP echo request, id 3557, seq 1, length 64
01:15:11.326241 IP uismhlpt401301e.university.harvard.edu > 10.0.0.6: ICMP echo reply, id 3557, seq 1, length 64
01:15:11.329526 IP 10.0.0.6 > divwhlpt1048016.university.harvard.edu: ICMP echo request, id 3558, seq 1, length 64
01:15:11.329560 IP divwhlpt1048016.university.harvard.edu > 10.0.0.6: ICMP echo reply, id 3558, seq 1, length 64
01:15:11.379684 IP hrewhlpt2100046.university.harvard.edu > uismhlpt401301e.university.harvard.edu: ICMP echo request, id 3572, seq 1, length 64
01:15:11.379706 IP uismhlpt401301e.university.harvard.edu > hrewhlpt2100046.university.harvard.edu: ICMP echo reply, id 3572, seq 1, length 64
01:15:11.382859 IP hrewhlpt2100046.university.harvard.edu > divwhlpt1048016.university.harvard.edu: ICMP echo request, id 3573, seq 1, length 64
01:15:11.382883 IP divwhlpt1048016.university.harvard.edu > hrewhlpt2100046.university.harvard.edu: ICMP echo reply, id 3573, seq 1, length 64
01:15:11.438826 IP 10.0.0.8 > uismhlpt401301e.university.harvard.edu: ICMP echo request, id 3587, seq 1, length 64
01:15:11.438851 IP uismhlpt401301e.university.harvard.edu > 10.0.0.8: ICMP echo reply, id 3587, seq 1, length 64
01:15:11.442121 IP 10.0.0.8 > divwhlpt1048016.university.harvard.edu: ICMP echo request, id 3588, seq 1, length 64
01:15:11.442148 IP divwhlpt1048016.university.harvard.edu > 10.0.0.8: ICMP echo reply, id 3588, seq 1, length 64
01:15:11.494992 IP 10.0.0.9 > uismhlpt401301e.university.harvard.edu: ICMP echo request, id 3602, seq 1, length 64
01:15:11.495016 IP uismhlpt401301e.university.harvard.edu > 10.0.0.9: ICMP echo reply, id 3602, seq 1, length 64
01:15:11.498272 IP 10.0.0.9 > divwhlpt1048016.university.harvard.edu: ICMP echo request, id 3603, seq 1, length 64
01:15:11.498325 IP divwhlpt1048016.university.harvard.edu > 10.0.0.9: ICMP echo reply, id 3603, seq 1, length 64
01:15:11.553371 IP 10.0.0.10 > uismhlpt401301e.university.harvar