tcpdump: verbose output suppressed, use -v or -vv for full protocol decode
listening on s4203-eth1, link-type EN10MB (Ethernet), capture size 262144 bytes
23:42:57.764715 ARP, Request who-has 10.0.0.5 tell rfctest.harvard.edu, length 28
23:42:57.764957 ARP, Reply 10.0.0.5 is-at 86:21:71:bd:c0:f8 (oui Unknown), length 28
23:42:57.765693 IP rfctest.harvard.edu > 10.0.0.5: ICMP echo request, id 21255, seq 1, length 64
23:42:57.765928 IP 10.0.0.5 > rfctest.harvard.edu: ICMP echo reply, id 21255, seq 1, length 64
23:42:57.771346 ARP, Request who-has 10.0.0.6 tell rfctest.harvard.edu, length 28
23:42:57.771636 ARP, Reply 10.0.0.6 is-at 86:74:ea:fc:7a:62 (oui Unknown), length 28
23:42:57.772003 IP rfctest.harvard.edu > 10.0.0.6: ICMP echo request, id 21256, seq 1, length 64
23:42:57.772225 IP 10.0.0.6 > rfctest.harvard.edu: ICMP echo reply, id 21256, seq 1, length 64
23:42:57.860744 ARP, Request who-has 10.0.0.5 tell paine-b-sw2.net.harvard.edu, length 28
23:42:57.860911 ARP, Reply 10.0.0.5 is-at 86:21:71:bd:c0:f8 (oui Unknown), length 28
23:42:57.861322 IP paine-b-sw2.net.harvard.edu > 10.0.0.5: ICMP echo request, id 21270, seq 1, length 64
23:42:57.861353 IP 10.0.0.5 > paine-b-sw2.net.harvard.edu: ICMP echo reply, id 21270, seq 1, length 64
23:42:57.866240 ARP, Request who-has 10.0.0.6 tell paine-b-sw2.net.harvard.edu, length 28
23:42:57.866429 ARP, Reply 10.0.0.6 is-at 86:74:ea:fc:7a:62 (oui Unknown), length 28
23:42:57.866499 IP paine-b-sw2.net.harvard.edu > 10.0.0.6: ICMP echo request, id 21271, seq 1, length 64
23:42:57.866527 IP 10.0.0.6 > paine-b-sw2.net.harvard.edu: ICMP echo reply, id 21271, seq 1, length 64
23:42:57.940822 ARP, Request who-has 10.0.0.5 tell hamwhwks0643000.university.harvard.edu, length 28
23:42:57.940995 ARP, Reply 10.0.0.5 is-at 86:21:71:bd:c0:f8 (oui Unknown), length 28
23:42:57.941637 IP hamwhwks0643000.university.harvard.edu > 10.0.0.5: ICMP echo request, id 21285, seq 1, length 64
23:42:57.941668 IP 10.0.0.5 > hamwhwks0643000.university.harvard.edu: ICMP echo reply, id 21285, seq 1, length 64
23:42:57.946247 ARP, Request who-has 10.0.0.6 tell hamwhwks0643000.university.harvard.edu, length 28
23:42:57.946413 ARP, Reply 10.0.0.6 is-at 86:74:ea:fc:7a:62 (oui Unknown), length 28
23:42:57.946947 IP hamwhwks0643000.university.harvard.edu > 10.0.0.6: ICMP echo request, id 21286, seq 1, length 64
23:42:57.946980 IP 10.0.0.6 > hamwhwks0643000.university.harvard.edu: ICMP echo reply, id 21286, seq 1, length 64
23:42:58.021870 ARP, Request who-has 10.0.0.5 tell divwhlpt1048016.university.harvard.edu, length 28
23:42:58.022050 ARP, Reply 10.0.0.5 is-at 86:21:71:bd:c0:f8 (oui Unknown), length 28
23:42:58.022701 IP divwhlpt1048016.university.harvard.edu > 10.0.0.5: ICMP echo request, id 21300, seq 1, length 64
23:42:58.023172 IP 10.0.0.5 > divwhlpt1048016.university.harvard.edu: ICMP echo reply, id 21300, seq 1, length 64
23:42:58.028227 ARP, Request who-has 10.0.0.6 tell divwhlpt1048016.university.harvard.edu, length 28
23:42:58.028456 ARP, Reply 10.0.0.6 is-at 86:74:ea:fc:7a:62 (oui Unknown), length 28
23:42:58.028629 IP divwhlpt1048016.university.harvard.edu > 10.0.0.6: ICMP echo request, id 21301, seq 1, length 64
23:42:58.028851 IP 10.0.0.6 > divwhlpt1048016.university.harvard.edu: ICMP echo reply, id 21301, seq 1, length 64
23:42:58.098260 IP 10.0.0.5 > rfctest.harvard.edu: ICMP echo request, id 21312, seq 1, length 64
23:42:58.098332 IP rfctest.harvard.edu > 10.0.0.5: ICMP echo reply, id 21312, seq 1, length 64
23:42:58.103608 IP 10.0.0.5 > paine-b-sw2.net.harvard.edu: ICMP echo request, id 21313, seq 1, length 64
23:42:58.103675 IP paine-b-sw2.net.harvard.edu > 10.0.0.5: ICMP echo reply, id 21313, seq 1, length 64
23:42:58.109501 IP 10.0.0.5 > hamwhwks0643000.university.harvard.edu: ICMP echo request, id 21314, seq 1, length 64
23:42:58.109570 IP hamwhwks0643000.university.harvard.edu > 10.0.0.5: ICMP echo reply, id 21314, seq 1, length 64
23:42:58.114130 IP 10.0.0.5 > divwhlpt1048016.university.harvard.edu: ICMP echo request, id 21315, seq 1, length 64
23:42:58.114196 IP divwhlpt1048016.university.harvard.edu > 10.0.0.5: ICMP echo reply, id 21315, seq 1, length 64
23:42:58.127321 ARP, Request who-has hrewhlpt2100046.university.harvard.edu tell 10.0.0.5, length 28
23:42:58.127892 ARP, Reply hrewhlpt2100046.university.harvard.edu is-at de:fc:3a:de:5a:eb (oui Unknown), length 28
23:42:58.128114 IP 10.0.0.5 > hrewhlpt2100046.university.harvard.edu: ICMP echo request, id 21317, seq 1, length 64
23:42:58.128547 IP hrewhlpt2100046.university.harvard.edu > 10.0.0.5: ICMP echo reply, id 21317, seq 1, length 64
23:42:58.132981 ARP, Request who-has 10.0.0.8 tell 10.0.0.5, length 28
23:42:58.133246 ARP, Reply 10.0.0.8 is-at 22:a1:4f:d4:cd:7d (oui Unknown), length 28
23:42:58.137260 IP 10.0.0.5 > 10.0.0.8: ICMP echo request, id 21318, seq 1, length 64
23:42:58.137497 IP 10.0.0.8 > 10.0.0.5: ICMP echo reply, id 21318, seq 1, length 64
23:42:58.142065 ARP, Request who-has 10.0.0.9 tell 10.0.0.5, length 28
23:42:58.142768 ARP, Reply 10.0.0.9 is-at 8a:c8:67:01:92:b9 (oui Unknown), length 28
23:42:58.142804 IP 10.0.0.5 > 10.0.0.9: ICMP echo request, id 21319, seq 1, length 64
23:42:58.143167 IP 10.0.0.9 > 10.0.0.5: ICMP echo reply, id 21319, seq 1, length 64
23:42:58.147388 ARP, Request who-has 10.0.0.10 tell 10.0.0.5, length 28
23:42:58.147830 ARP, Reply 10.0.0.10 is-at 9a:60:b4:e8:36:04 (oui Unknown), length 28
23:42:58.147862 IP 10.0.0.5 > 10.0.0.10: ICMP echo request, id 21320, seq 1, length 64
23:42:58.148144 IP 10.0.0.10 > 10.0.0.5: ICMP echo reply, id 21320, seq 1, length 64
23:42:58.152484 ARP, Request who-has divmhlpt104804e.university.harvard.edu tell 10.0.0.5, length 28
23:42:58.152979 ARP, Reply divmhlpt104804e.university.harvard.edu is-at a2:de:e5:ff:01:9b (oui Unknown), length 28
23:42:58.153012 IP 10.0.0.5 > divmhlpt104804e.university.harvard.edu: ICMP echo request, id 21321, seq 1, length 64
23:42:58.153166 IP divmhlpt104804e.university.harvard.edu > 10.0.0.5: ICMP echo reply, id 21321, seq 1, length 64
23:42:58.157834 ARP, Request who-has iniwhwks3292009.university.harvard.edu tell 10.0.0.5, length 28
23:42:58.158304 ARP, Reply iniwhwks3292009.university.harvard.edu is-at 7a:3d:c3:54:48:4a (oui Unknown), length 28
23:42:58.158335 IP 10.0.0.5 > iniwhwks3292009.university.harvard.edu: ICMP echo request, id 21322, seq 1, length 64
23:42:58.158610 IP iniwhwks3292009.university.harvard.edu > 10.0.0.5: ICMP echo reply, id 21322, seq 1, length 64
23:42:58.163938 ARP, Request who-has 10.0.0.13 tell 10.0.0.5, length 28
23:42:58.164629 ARP, Reply 10.0.0.13 is-at 1e:a2:7f:3b:17:a8 (oui Unknown), length 28
23:42:58.164666 IP 10.0.0.5 > 10.0.0.13: ICMP echo request, id 21323, seq 1, length 64
23:42:58.164936 IP 10.0.0.13 > 10.0.0.5: ICMP echo reply, id 21323, seq 1, length 64
23:42:58.169356 ARP, Request who-has 10.0.0.14 tell 10.0.0.5, length 28
23:42:58.170010 ARP, Reply 10.0.0.14 is-at 26:23:22:1a:bd:ad (oui Unknown), length 28
23:42:58.170046 IP 10.0.0.5 > 10.0.0.14: ICMP echo request, id 21324, seq 1, length 64
23:42:58.170241 IP 10.0.0.14 > 10.0.0.5: ICMP echo reply, id 21324, seq 1, length 64
23:42:58.186003 ARP, Request who-has 10.0.0.15 tell 10.0.0.5, length 28
23:42:58.186814 ARP, Reply 10.0.0.15 is-at a6:f6:7f:9b:22:04 (oui Unknown), length 28
23:42:58.186854 IP 10.0.0.5 > 10.0.0.15: ICMP echo request, id 21325, seq 1, length 64
23:42:58.187040 IP 10.0.0.15 > 10.0.0.5: ICMP echo reply, id 21325, seq 1, length 64
23:42:58.191540 ARP, Request who-has 10.0.0.16 tell 10.0.0.5, length 28
23:42:58.191930 ARP, Reply 10.0.0.16 is-at b6:e3:93:ad:04:21 (oui Unknown), length 28
23:42:58.192063 IP 10.0.0.5 > 10.0.0.16: ICMP echo request, id 21326, seq 1, length 64
23:42:58.192303 IP 10.0.0.16 > 10.0.0.5: ICMP echo reply, id 21326, seq 1, length 64
23:42:58.201734 IP 10.0.0.6 > rfctest.harvard.edu: ICMP echo request, id 21327, seq 1, length 64
23:42:58.201812 IP rfctest.harvard.edu > 10.0.0.6: ICMP echo reply, id 21327, seq 1, length 64
23:42:58.205886 IP 10.0.0.6 > paine-b-sw2.net.harvard.edu: ICMP echo request, id 21328, seq 1, length 64
23:42:58.205962 IP paine-b-sw2.net.harvard.edu > 10.0.0.6: ICMP echo reply, id 21328, seq 1, length 64
23:42:58.211547 IP 10.0.0.6 > hamwhwks0643000.university.harvard.edu: ICMP echo request, id 21329, seq 1, length 64
23:42:58.211622 IP hamwhwks0643000.university.harvard.edu > 10.0.0.6: ICMP echo reply, id 21329, seq 1, length 64
23:42:58.215555 IP 10.0.0.6 > divwhlpt1048016.university.harvard.edu: ICMP echo request, id 21330, seq 1, length 64
23:42:58.215620 IP divwhlpt1048016.university.harvard.edu > 10.0.0.6: ICMP echo reply, id 21330, seq 1, length 64
23:42:58.224055 ARP, Request who-has hrewhlpt2100046.university.harvard.edu tell 10.0.0.6, length 28
23:42:58.224331 ARP, Reply hrewhlpt2100046.university.harvard.edu is-at de:fc:3a:de:5a:eb (oui Unknown), length 28
23:42:58.224461 IP 10.0.0.6 > hrewhlpt2100046.university.harvard.edu: ICMP echo request, id 21332, seq 1, length 64
23:42:58.224768 IP hrewhlpt2100046.university.harvard.edu > 10.0.0.6: ICMP echo reply, id 21332, seq 1, length 64
23:42:58.229070 ARP, Request who-has 10.0.0.8 tell 10.0.0.6, length 28
23:42:58.229278 ARP, Reply 10.0.0.8 is-at 22:a1:4f:d4:cd:7d (oui Unknown), length 28
23:42:58.229420 IP 10.0.0.6 > 10.0.0.8: ICMP echo request, id 21333, seq 1, length 64
23:42:58.229637 IP 10.0.0.8 > 10.0.0.6: ICMP echo reply, id 21333, seq 1, length 64
23:42:58.233950 ARP, Request who-has 10.0.0.9 tell 10.0.0.6, length 28
23:42:58.234388 ARP, Reply 10.0.0.9 is-at 8a:c8:67:01:92:b9 (oui Unknown), length 28
23:42:58.234421 IP 10.0.0.6 > 10.0.0.9: ICMP echo request, id 21334, seq 1, length 64
23:42:58.234589 IP 10.0.0.9 > 10.0.0.6: ICMP echo reply, id 21334, seq 1, length 64
23:42:58.239054 ARP, Request who-has 10.0.0.10 tell 10.0.0.6, length 28
23:42:58.239328 ARP, Reply 10.0.0.10 is-at 9a:60:b4:e8:36:04 (oui Unknown), length 28
23:42:58.239366 IP 10.0.0.6 > 10.0.0.10: ICMP echo request, id 21335, seq 1, length 64
23:42:58.239427 IP 10.0.0.10 > 10.0.0.6: ICMP echo reply, id 21335, seq 1, length 64
23:42:58.243795 ARP, Request who-has divmhlpt104804e.university.harvard.edu tell 10.0.0.6, length 28
23:42:58.244088 ARP, Reply divmhlpt104804e.university.harvard.edu is-at a2:de:e5:ff:01:9b (oui Unknown), length 28
23:42:58.244148 IP 10.0.0.6 > divmhlpt104804e.university.harvard.edu: ICMP echo request, id 21336, seq 1, length 64
23:42:58.244203 IP divmhlpt104804e.university.harvard.edu > 10.0.0.6: ICMP echo reply, id 21336, seq 1, length 64
23:42:58.247885 ARP, Request who-has iniwhwks3292009.university.harvard.edu tell 10.0.0.6, length 28
23:42:58.248118 ARP, Reply iniwhwks3292009.university.harvard.edu is-at 7a:3d:c3:54:48:4a (oui Unknown), length 28
23:42:58.248153 IP 10.0.0.6 > iniwhwks3292009.university.harvard.edu: ICMP echo request, id 21337, seq 1, length 64
23:42:58.248212 IP iniwhwks3292009.university.harvard.edu > 10.0.0.6: ICMP echo reply, id 21337, seq 1, length 64
23:42:58.252459 ARP, Request who-has 10.0.0.13 tell 10.0.0.6, length 28
23:42:58.252925 ARP, Reply 10.0.0.13 is-at 1e:a2:7f:3b:17:a8 (oui Unknown), length 28
23:42:58.252968 IP 10.0.0.6 > 10.0.0.13: ICMP echo request, id 21338, seq 1, length 64
23:42:58.253144 IP 10.0.0.13 > 10.0.0.6: ICMP echo reply, id 21338, seq 1, length 64
23:42:58.257628 ARP, Request who-has 10.0.0.14 tell 10.0.0.6, length 28
23:42:58.257914 ARP, Reply 10.0.0.14 is-at 26:23:22:1a:bd:ad (oui Unknown), length 28
23:42:58.257956 IP 10.0.0.6 > 10.0.0.14: ICMP echo request, id 21339, seq 1, length 64
23:42:58.258020 IP 10.0.0.14 > 10.0.0.6: ICMP echo reply, id 21339, seq 1, length 64
23:42:58.261940 ARP, Request who-has 10.0.0.15 tell 10.0.0.6, length 28
23:42:58.262294 ARP, Reply 10.0.0.15 is-at a6:f6:7f:9b:22:04 (oui Unknown), length 28
23:42:58.262330 IP 10.0.0.6 > 10.0.0.15: ICMP echo request, id 21340, seq 1, length 64
23:42:58.262387 IP 10.0.0.15 > 10.0.0.6: ICMP echo reply, id 21340, seq 1, length 64
23:42:58.266843 ARP, Request who-has 10.0.0.16 tell 10.0.0.6, length 28
23:42:58.267050 ARP, Reply 10.0.0.16 is-at b6:e3:93:ad:04:21 (oui Unknown), length 28
23:42:58.267205 IP 10.0.0.6 > 10.0.0.16: ICMP echo request, id 21341, seq 1, length 64
23:42:58.267260 IP 10.0.0.16 > 10.0.0.6: ICMP echo reply, id 21341, seq 1, length 64
23:42:58.292915 IP hrewhlpt2100046.university.harvard.edu > 10.0.0.5: ICMP echo request, id 21346, seq 1, length 64
23:42:58.292975 IP 10.0.0.5 > hrewhlpt2100046.university.harvard.edu: ICMP echo reply, id 21346, seq 1, length 64
23:42:58.296637 IP hrewhlpt2100046.university.harvard.edu > 10.0.0.6: ICMP echo request, id 21347, seq 1, length 64
23:42:58.296669 IP 10.0.0.6 > hrewhlpt2100046.university.harvard.edu: ICMP echo reply, id 21347, seq 1, length 64
23:42:58.384216 IP 10.0.0.8 > 10.0.0.5: ICMP echo request, id 21361, seq 1, length 64
23:42:58.384245 IP 10.0.0.5 > 10.0.0.8: ICMP echo reply, id 21361, seq 1, length 64
23:42:58.388670 IP 10.0.0.8 > 10.0.0.6: ICMP echo request, id 21362, seq 1, length 64
23:42:58.388702 IP 10.0.0.6 > 10.0.0.8: ICMP echo reply, id 21362, seq 1, length 64
23:42:58.460735 IP 10.0.0.9 > 10.0.0.5: ICMP echo request, id 21376, seq 1, length 64
23:42:58.460766 IP 10.0.0.5 > 10.0.0.9: ICMP echo reply, id 21376, seq 1, length 64
23:42:58.465112 IP 10.0.0.9 > 10.0.0.6: ICMP echo request, id 21377, seq 1, length 64
23:42:58.465141 IP 10.0.0.6 > 10.0.0.9: ICMP echo reply, id 21377, seq 1, length 64
23:42:58.535306 IP 10.0.0.10 > 10.0.0.5: ICMP echo request, id 21391, seq 1, length 64
23:42:58.535332 IP 10.0.0.5 > 10.0.0.10: ICMP echo reply, id 21391, seq 1, length 64
23:42:58.539707 IP 10.0.0.10 > 10.0.0.6: ICMP echo request, id 21392, seq 1, length 64
23:42:58.539757 IP 10.0.0.6 > 10.0.0.10: ICMP echo reply, id 21392, seq 1, length 64
23:42:58.605760 IP divmhlpt104804e.university.harvard.edu > 10.0.0.5: ICMP echo request, id 21406, seq 1, length 64
23:42:58.605791 IP 10.0.0.5 > divmhlpt104804e.university.harvard.edu: ICMP echo reply, id 21406, seq 1, length 64
23:42:58.609482 IP divmhlpt104804e.university.harvard.edu > 10.0.0.6: ICMP echo request, id 21407, seq 1, length 64
23:42:58.609510 IP 10.0.0.6 > divmhlpt104804e.university.harvard.edu: ICMP echo reply, id 21407, seq 1, length 64
23:42:58.676907 IP iniwhwks3292009.university.harvard.edu > 10.0.0.5: ICMP echo request, id 21421, seq 1, length 64
23:42:58.676937 IP 10.0.0.5 > iniwhwks3292009.university.harvard.edu: ICMP echo reply, id 21421, seq 1, length 64
23:42:58.680646 IP iniwhwks3292009.university.harvard.edu > 10.0.0.6: ICMP echo request, id 21422, seq 1, length 64
23:42:58.680675 IP 10.0.0.6 > iniwhwks3292009.university.harvard.edu: ICMP echo reply, id 21422, seq 1, length 64
23:42:58.748163 IP 10.0.0.13 > 10.0.0.5: ICMP echo request, id 21436, seq 1, length 64
23:42:58.748197 IP 10.0.0.5 > 10.0.0.13: ICMP echo reply, id 21436, seq 1, length 64
23:42:58.752383 IP 10.0.0.13 > 10.0.0.6: ICMP echo request, id 21437, seq 1, length 64
23:42:58.752414 IP 10.0.0.6 > 10.0.0.13: ICMP echo reply, id 21437, seq 1, length 64
23:42:58.817687 IP 10.0.0.14 > 10.0.0.5: ICMP echo request, id 21451, seq 1, length 64
23:42:58.817717 IP 10.0.0.5 > 10.0.0.14: ICMP echo reply, id 21451, seq 1, length 64
23:42:58.827026 IP 10.0.0.14 > 10.0.0.6: ICMP echo request, id 21452, seq 1, length 64
23:42:58.827057 IP 10.0.0.6 > 10.0.0.14: ICMP echo reply, id 21452, seq 1, length 64
23:42:58.895461 IP 10.0.0.15 > 10.0.0.5: ICMP echo request, id 21466, seq 1, length 64
23:42:58.895495 IP 10.0.0.5 > 10.0.0.15: ICMP echo reply, id 21466, seq 1, length 64
23:42:58.899446 IP 10.0.0.15 > 10.0.0.6: ICMP echo request, id 21467, seq 1, length 64
23:42:58.899474 IP 10.0.0.6 > 10.0.0.15: ICMP echo reply, id 21467, seq 1, length 64
23:42:58.961103 IP 10.0.0.16 > 10.0.0.5: ICMP echo request, id 21481, seq 1, length 64
23:42:58.961134 IP 10.0.0.5 > 10.0.0.16: ICMP echo reply, id 21481, seq 1, length 64
23:42:58.965248 IP 10.0.0.16 > 10.0.0.6: ICMP echo request, id 21482, seq 1, length 64
23:42:58.965278 IP 10.0.0.6 > 10.0.0.16: ICMP echo reply, id 21482, seq 1, length 64
23:43:02.875093 ARP, Request who-has paine-b-sw2.net.harvard.edu tell 10.0.0.6, length 28
23:43:02.875097 ARP, Request who-has paine-b-sw2.net.harvard.edu tell 10.0.0.5, length 28
23:43:02.875128 ARP, Request who-has rfctest.harvard.edu tell 10.0.0.6, length 28
23:43:02.875134 ARP, Request who-has rfctest.harvard.edu tell 10.0.0.5, length 28
23:43:02.875496 ARP, Reply paine-b-sw2.net.harvard.edu is-at 62:6c:1e:e9:a2:6a (oui Unknown), length 28
23:43:02.875502 ARP, Reply paine-b-sw2.net.harvard.edu is-at 62:6c:1e:e9:a2:6a (oui Unknown), length 28
23:43:02.875531 ARP, Reply rfctest.harvard.edu is-at 12:b3:8d:e2:20:85 (oui Unknown), length 28
23:43:02.875555 ARP, Reply rfctest.harvard.edu is-at 12:b3:8d:e2:20:85 (oui Unknown), length 28
23:43:03.131993 ARP, Request who-has 10.0.0.5 tell hrewhlpt2100046.university.harvard.edu, length 28
23:43:03.131853 ARP, Request who-has divwhlpt1048016.university.harvard.edu tell 10.0.0.6, length 28
23:43:03.131857 ARP, Request who-has divwhlpt1048016.university.harvard.edu tell 10.0.0.5, length 28
23:43:03.131904 ARP, Request who-has hamwhwks0643000.university.harvard.edu tell 10.0.0.6, length 28
23:43:03.131908 ARP, Request who-has hamwhwks0643000.university.harvard.edu tell 10.0.0.5, length 28
23:43:03.132548 ARP, Reply 10.0.0.5 is-at 86:21:71:bd:c0:f8 (oui Unknown), length 28
23:43:03.133358 ARP, Reply divwhlpt1048016.university.harvard.edu is-at 56:29:a3:a2:20:61 (oui Unknown), length 28
23:43:03.133364 ARP, Reply divwhlpt1048016.university.harvard.edu is-at 56:29:a3:a2:20:61 (oui Unknown), length 28
23:43:03.133425 ARP, Reply hamwhwks0643000.university.harvard.edu is-at 92:a1:ff:1f:cd:c5 (oui Unknown), length 28
23:43:03.133431 ARP, Reply hamwhwks0643000.university.harvard.edu is-at 92:a1:ff:1f:cd:c5 (oui Unknown), length 28
23:43:03.390396 ARP, Request who-has 10.0.0.6 tell 10.0.0.8, length 28
23:43:03.390403 ARP, Request who-has 10.0.0.6 tell hrewhlpt2100046.university.harvard.edu, length 28
23:43:03.390454 ARP, Request who-has 10.0.0.5 tell 10.0.0.8, length 28
23:43:03.390638 ARP, Request who-has 10.0.0.6 tell 10.0.0.16, length 28
23:43:03.390644 ARP, Request who-has 10.0.0.6 tell 10.0.0.15, length 28
23:43:03.390649 ARP, Request who-has 10.0.0.6 tell 10.0.0.14, length 28
23:43:03.390654 ARP, Request who-has 10.0.0.6 tell 10.0.0.13, length 28
23:43:03.390659 ARP, Request who-has 10.0.0.6 tell iniwhwks3292009.university.harvard.edu, length 28
23:43:03.390664 ARP, Request who-has 10.0.0.6 tell divmhlpt104804e.university.harvard.edu, length 28
23:43:03.390669 ARP, Request who-has 10.0.0.6 tell 10.0.0.10, length 28
23:43:03.390674 ARP, Request who-has 10.0.0.6 tell 10.0.0.9, length 28
23:43:03.390729 ARP, Request who-has 10.0.0.5 tell 10.0.0.16, length 28
23:43:03.390737 ARP, Request who-has 10.0.0.5 tell 10.0.0.15, length 28
23:43:03.390742 ARP, Request who-has 10.0.0.5 tell 10.0.0.14, length 28
23:43:03.390750 ARP, Request who-has 10.0.0.5 tell 10.0.0.13, length 28
23:43:03.390755 ARP, Request who-has 10.0.0.5 tell iniwhwks3292009.university.harvard.edu, length 28
23:43:03.390760 ARP, Request who-has 10.0.0.5 tell divmhlpt104804e.university.harvard.edu, length 28
23:43:03.390765 ARP, Request who-has 10.0.0.5 tell 10.0.0.10, length 28
23:43:03.390770 ARP, Request who-has 10.0.0.5 tell 10.0.0.9, length 28
23:43:03.390865 ARP, Reply 10.0.0.6 is-at 86:74:ea:fc:7a:62 (oui Unknown), length 28
23:43:03.390870 ARP, Reply 10.0.0.6 is-at 86:74:ea:fc:7a:62 (oui Unknown), length 28
23:43:03.390899 ARP, Reply 10.0.0.5 is-at 86:21:71:bd:c0:f8 (oui Unknown), length 28
23:43:03.391054 ARP, Reply 10.0.0.6 is-at 86:74:ea:fc:7a:62 (oui Unknown), length 28
23:43:03.391058 ARP, Reply 10.0.0.6 is-at 86:74:ea:fc:7a:62 (oui Unknown), length 28
23:43:03.391061 ARP, Reply 10.0.0.6 is-at 86:74:ea:fc:7a:62 (oui Unknown), length 28
23:43:03.391065 ARP, Reply 10.0.0.6 is-at 86:74:ea:fc:7a:62 (oui Unknown), length 28
23:43:03.391068 ARP, Reply 10.0.0.6 is-at 86:74:ea:fc:7a:62 (oui Unknown), length 28
23:43:03.391072 ARP, Reply 10.0.0.6 is-at 86:74:ea:fc:7a:62 (oui Unknown), length 28
23:43:03.391075 ARP, Reply 10.0.0.6 is-at 86:74:ea:fc:7a:62 (oui Unknown), length 28
23:43:03.391079 ARP, Reply 10.0.0.6 is-at 86:74:ea:fc:7a:62 (oui Unknown), length 28
23:43:03.391091 ARP, Reply 10.0.0.5 is-at 86:21:71:bd:c0:f8 (oui Unknown), length 28
23:43:03.391094 ARP, Reply 10.0.0.5 is-at 86:21:71:bd:c0:f8 (oui Unknown), length 28
23:43:03.391097 ARP, Reply 10.0.0.5 is-at 86:21:71:bd:c0:f8 (oui Unknown), length 28
23:43:03.391101 ARP, Reply 10.0.0.5 is-at 86:21:71:bd:c0:f8